Date,Title,Article,clean title,clean article,polarity,cong,bjp,senti
2014-12-04,anil kumar sinha named cbi director,"new delhi, december 2 senior ips officer anil kumar sinha was tonight appointed the cbi director to succeed ranjit sinha who retired in a glare of controversy with the supreme court directing him to recuse from the 2g spectrum scam probe. sinha, a 1979 batch ips officer of the bihar cadre, was the special director in the agency. the appointments committee of the cabinet, headed by prime minister narendra modi, cleared the name of anil kumar sinha who was among the candidates shortlisted by the search committee earlier this evening. the term of sinha will be for two years from the date he takes charge, an official notification said. earlier in the day, modi held discussions with the chief justice of india and leader of the main opposition in the lok sabha on selecting a new cbi head. ; the panel discussed the names of about 40 officers shortlisted by the department of personnel and training (dopt), sources said. ranjit sinha retired today after a tumultuous tenure of two years at the helm of affairs in the cbi that ended on a controversial note. sinha’s tenure as the cbi chief saw highs such as busting of some big bribery cases involving a railway board member, the chairman and managing director of a public sector bank, the chief executive officer of the censor board among others. the lows were mainly the criticism he faced from the supreme court which asked him to withdraw from the 2g probe, criticism from a special court for shoddy probe in coal scam cases, sharing of a status report in the coal scam with the then law minister ashwani kumar after which the agency earned the sobriquet of a “caged parrot” from the apex court. — pti ",anil kumar sinha named cbi director,"new delhi , december 2 senior ips officer anil kumar sinha tonight appointed cbi director succeed ranjit sinha retired glare controversy supreme court directing recuse 2g spectrum scam probe. sinha , 1979 batch ips officer bihar cadre , special director agency. appointments committee cabinet , headed prime minister narendra modi , cleared name anil kumar sinha among candidates shortlisted search committee earlier evening. term sinha two years date takes charge , official notification said. earlier day , modi held discussions chief justice india leader main opposition lok sabha selecting new cbi head. ; panel discussed names 40 officers shortlisted department personnel training ( dopt ) , sources said. ranjit sinha retired today tumultuous tenure two years helm affairs cbi ended controversial note. sinha ’ tenure cbi chief saw highs busting big bribery cases involving railway board member , chairman managing director public sector bank , chief executive officer censor board among others. lows mainly criticism faced supreme court asked withdraw 2g probe , criticism special court shoddy probe coal scam cases , sharing status report coal scam law minister ashwani kumar agency earned sobriquet “caged parrot ” apex court. — pti","{'bjp': 0, 'cong': 0}",0,0,0.1207958707958708
2014-12-09,opposition has run out of issues: modi,"dhanbad (jharkhand), december 9 prime minister narendra modi today asked the electorate in jharkhand to give a decisive mandate to bjp for a strong and stable government in the state and not opt for a coalition as ""thekedars"" (contractors) will then enjoy all power. modi also accused the opposition parties of needlessly targeting his government, saying they have run out of issues. ""jharkhand needs stable government. this time don't make a mistake. elect a strong bjp government. if you vote for a majority government then the reins of power will be in the hands of the people, but (in the event of a) coalition government reins will go in the hands of thekedars,"" modi told an election meeting here. dhanbad goes to polls in the fourth phase on december 14. he said, ""you have done this for the country, will you not do it for the sake of jharkhand? ... coalition governments in the country have given power in the hands of 'thekedars' and you know what they have done to the country and the states for so many years."" ""in the lok sabha elections, you have rejected the opposition,"" he said while hoping that people would reject them again in the ensuing state assembly elections. hitting out at the opposition, he said ""these days leaders of opposition parties are very upset. they have to campaign for the sake of their survival and are going to jharkhand and jammu and kashmir, too. but they don't have any issues against the modi government. they are repeating their speeches made during the lok sabha elections. there is bankruptcy of issues for opposition."" referring to abundance of coal in jharkhand, modi said, ""you are siting on black diamond. don’t you like to see it sparkle? but who will make the black diamonds sparkle? ""modi is ready for it, but jharkhand has to give an opportunity to him to utilise the mineral-resources in the development of the state and the country."" the prime minister said his government's policies will help the mineral-rich state progress fast and reap benefits of its coal reserves. on the coal scam and the supreme court verdict on it, modi said though it came as a ""blow"" and ""pained"" the government, it was taken up as an ""opportunity"" to improve things. — ptodhanbad (jharkhand), dec 9 (pti) prime minister narendra modi today asked the electorate in jharkhand to give a decisive mandate to bjp for a strong and stable government in the state and not opt for a coalition as ""thekedars"" (contractors) will then enjoy all power. modi also accused the opposition parties of needlessly targeting his government, saying they have run out of issues. ""jharkhand needs stable government. this time don't make a mistake. elect a strong bjp government. if you vote for a majority government then the reins of power will be in the hands of the people, but (in the event of a) coalition government reins will go in the hands of thekedars,"" modi told an election meeting here. dhanbad goes to polls in the fourth phase on december 14. he said, ""you have done this for the country, will you not do it for the sake of jharkhand ?... coalition governments in the country have given power in the hands of 'thekedars' and you know what they have done to the country and the states for so many years."" ""in the lok sabha elections, you have rejected the opposition,"" he said while hoping that people would reject them again in the ensuing state assembly elections. hitting out at the opposition, he said ""these days leaders of opposition parties are very upset. they have to campaign for the sake of their survival and are going to jharkhand and jammu and kashmir too. but they don't have any issues against the modi government. they are repeating their speeches made during the lok sabha elections. there is bankruptcy of issues for opposition."" referring to abundance of coal in jharkhand, modi said, ""you are siting on black diamond. don’t you like to see it sparkle? but who will make the black diamonds sparkle? ""modi is ready for it, but jharkhand has to give an opportunity to him to utilise the mineral-resources in the development of the state and the country."" the prime minister said his government's policies will help the mineral-rich state progress fast and reap benefits of its coal reserves. on the coal scam and the supreme court verdict on it, modi said though it came as a ""blow"" and ""pained"" the government, it was taken up as an ""opportunity"" to improve things. — pti",opposition run issues : modi,"dhanbad ( jharkhand ) , december 9 prime minister narendra modi today asked electorate jharkhand give decisive mandate bjp strong stable government state opt coalition "" thekedars "" ( contractors ) enjoy power. modi also accused opposition parties needlessly targeting government , saying run issues. "" jharkhand needs stable government. time ' make mistake. elect strong bjp government. vote majority government reins power hands people , ( event ) coalition government reins go hands thekedars , "" modi told election meeting here. dhanbad goes polls fourth phase december 14. said , "" done country , sake jharkhand ? ... coalition governments country given power hands ' thekedars ' know done country states many years. "" "" lok sabha elections , rejected opposition , "" said hoping people would reject ensuing state assembly elections. hitting opposition , said "" days leaders opposition parties upset. campaign sake survival going jharkhand jammu kashmir , too. ' issues modi government. repeating speeches made lok sabha elections. bankruptcy issues opposition. "" referring abundance coal jharkhand , modi said , "" siting black diamond. ’ like see sparkle ? make black diamonds sparkle ? "" modi ready , jharkhand give opportunity utilise mineral-resources development state country. "" prime minister said government ' policies help mineral-rich state progress fast reap benefits coal reserves. coal scam supreme court verdict , modi said though came "" blow "" "" pained "" government , taken "" opportunity "" improve things. — ptodhanbad ( jharkhand ) , dec 9 ( pti ) prime minister narendra modi today asked electorate jharkhand give decisive mandate bjp strong stable government state opt coalition "" thekedars "" ( contractors ) enjoy power. modi also accused opposition parties needlessly targeting government , saying run issues. "" jharkhand needs stable government. time ' make mistake. elect strong bjp government. vote majority government reins power hands people , ( event ) coalition government reins go hands thekedars , "" modi told election meeting here. dhanbad goes polls fourth phase december 14. said , "" done country , sake jharkhand ? ... coalition governments country given power hands ' thekedars ' know done country states many years. "" "" lok sabha elections , rejected opposition , "" said hoping people would reject ensuing state assembly elections. hitting opposition , said "" days leaders opposition parties upset. campaign sake survival going jharkhand jammu kashmir too. ' issues modi government. repeating speeches made lok sabha elections. bankruptcy issues opposition. "" referring abundance coal jharkhand , modi said , "" siting black diamond. ’ like see sparkle ? make black diamonds sparkle ? "" modi ready , jharkhand give opportunity utilise mineral-resources development state country. "" prime minister said government ' policies help mineral-rich state progress fast reap benefits coal reserves. coal scam supreme court verdict , modi said though came "" blow "" "" pained "" government , taken "" opportunity "" improve things. — pti","{'bjp': 4, 'cong': 0}",0,4,0.19444444444444445
2014-12-12,"coal scam: madhu koda, 7 others chargesheeted","new delhi, december 12 former jharkhand chief minister madhu koda, ex-chief secretary ashok kumar basu, former coal secretary h c gupta and five others have been chargesheeted by the cbi in a coal scam case relating to allocation of coal blocks to a kolkata-based firm. the chargesheet was filed two months after the court on september 4 had returned cbi’s final report filed in the case, observing that the probe agency had failed to give any plausible explanation to its queries. the decision to file a chargesheet in the case came after the supreme court on december 8 had allowed cbi to file chargesheets or closure reports in coal scam cases in which it had earlier restrained the agency from doing so in view of allegations against its then director ranjit sinha. the chargesheet was filed before special cbi judge bharat parashar, who fixed it for consideration on december 22 after the investigating officer (io) said he will file the necessary documents within a couple of days. besides koda and the two senior retired bureaucrats, the agency has named two serving public servants, basant kumar bhattacharya and bipin bihari singh, director of vini iron steel and udyog ltd vaibhav tulsyan and vijay joshi as accused in the case. kolkata-based vini iron steel and udyog ltd has also been arrayed as an accused in the case. ; all the accused have been chargesheeted for the offences punishable under sections 120-b (criminal conspiracy), 420 (cheating) of the ipc and under provisions of the prevention of corruption act. — pti","coal scam : madhu koda , 7 others chargesheeted","new delhi , december 12 former jharkhand chief minister madhu koda , ex-chief secretary ashok kumar basu , former coal secretary h c gupta five others chargesheeted cbi coal scam case relating allocation coal blocks kolkata-based firm. chargesheet filed two months court september 4 returned cbi ’ final report filed case , observing probe agency failed give plausible explanation queries. decision file chargesheet case came supreme court december 8 allowed cbi file chargesheets closure reports coal scam cases earlier restrained agency view allegations director ranjit sinha. chargesheet filed special cbi judge bharat parashar , fixed consideration december 22 investigating officer ( io ) said file necessary documents within couple days. besides koda two senior retired bureaucrats , agency named two serving public servants , basant kumar bhattacharya bipin bihari singh , director vini iron steel udyog ltd vaibhav tulsyan vijay joshi accused case. kolkata-based vini iron steel udyog ltd also arrayed accused case. ; accused chargesheeted offences punishable sections 120-b ( criminal conspiracy ) , 420 ( cheating ) ipc provisions prevention corruption act. — pti","{'bjp': 0, 'cong': 0}",0,0,-0.0004995004995005039
2014-12-16,court directs cbi to take ex-pm manmohan’s statement in coal scam,"new delhi, december 1 the cbi was today directed by a special court to record statements of former prime minister manmohan singh, who was holding charge as coal minister in 2005, and others in a coal blocks allocation scam case allegedly involving top industrialist kumar mangalam birla. refusing to accept cbi’s closure report filed in the matter, special cbi judge bharat parashar said, “i have ordered further investigation. i desire that statements of the then minister of coal (manmohan singh) be recorded besides other officials.” the court also directed the agency to file status report of its further probe in the case on january 27, next year. the court passed the order in a case in which an fir was lodged against birla, ex-coal secretary p c parakh and others relating to allocation of talabira ii and iii coal blocks in odisha in 2005 to hindalco. earlier, on december 12, court had reserved its order for today on the cbi’s closure report filed in the matter, in which the agency had also submitted the case diary and crime files in a sealed cover. ; on november 25,cbi had come in for some tough questioning from the court which had asked why the agency did not question former prime minister singh, who was also holding the coal portfolio between 2005 and 2009. the court’s observations had came after cbi had submitted that initially it felt singh’s examination was required, but later it was found to be not necessary. singh was heading the coal ministry when birla’s firm hindalco was allocated talabira ii & iii coal blocks in 2005. the fir against birla, parakh and others was registered in october last year by cbi which had alleged that parakh had first rejected coal block allocation to hindalco but had reversed his decision within months “without any valid basis or change in circumstances” and shown “undue favours”. cbi had booked birla, parakh and other hindalco officials under various ipc sections, including criminal conspiracy and criminal misconduct on part of government officials. on november 10, cbi had told the court that there was “prima facie enough material” to proceed against some private parties and public servants in the case. the supreme court-appointed special public prosecutor (spp) r s cheema for cbi had submitted before the judge that the court can take cognisance of the offences mentioned in the closure report as there was prima facie “evidence against the accused to show their involvement”. pti ",court directs cbi take ex-pm manmohan ’ statement coal scam,"new delhi , december 1 cbi today directed special court record statements former prime minister manmohan singh , holding charge coal minister 2005 , others coal blocks allocation scam case allegedly involving top industrialist kumar mangalam birla. refusing accept cbi ’ closure report filed matter , special cbi judge bharat parashar said , “i ordered investigation. desire statements minister coal ( manmohan singh ) recorded besides officials. ” court also directed agency file status report probe case january 27 , next year. court passed order case fir lodged birla , ex-coal secretary p c parakh others relating allocation talabira ii iii coal blocks odisha 2005 hindalco. earlier , december 12 , court reserved order today cbi ’ closure report filed matter , agency also submitted case diary crime files sealed cover. ; november 25 , cbi come tough questioning court asked agency question former prime minister singh , also holding coal portfolio 2005 2009. court ’ observations came cbi submitted initially felt singh ’ examination required , later found necessary. singh heading coal ministry birla ’ firm hindalco allocated talabira ii &amp; iii coal blocks 2005. fir birla , parakh others registered october last year cbi alleged parakh first rejected coal block allocation hindalco reversed decision within months “without valid basis change circumstances ” shown “undue favours ” . cbi booked birla , parakh hindalco officials various ipc sections , including criminal conspiracy criminal misconduct part government officials. november 10 , cbi told court “prima facie enough material ” proceed private parties public servants case. supreme court-appointed special public prosecutor ( spp ) r cheema cbi submitted judge court take cognisance offences mentioned closure report prima facie “evidence accused show involvement ” . pti","{'bjp': 0, 'cong': 0}",0,0,0.004100114444942031
2014-12-16,coal scam: court raps cbi,"new delhi the cbi was on monday pulled up by a special court for its failure to bring case diary of a coal blocks allocation scam, in which it had ordered further probe, saying the agency ""cannot simply sit"" over the matter to ""unnecessarily delay"" the probe. pti new delhi national herald casethe delhi high court on monday extended the stay on the trial court order summoning congress president sonia gandhi, rahul gandhi and three others in the national herald case till the final disposal of appeals against their summons. pti muzaffarnagar ; 2 gangrape accused nabbedtwo persons, gaurav and amardeep, who were allegedly involved in gangrape cases during muzaffarnagar riots, were arrested from police recruitment centres in moradabad. pti",coal scam : court raps cbi,"new delhi cbi monday pulled special court failure bring case diary coal blocks allocation scam , ordered probe , saying agency "" cannot simply sit "" matter "" unnecessarily delay "" probe. pti new delhi national herald casethe delhi high court monday extended stay trial court order summoning congress president sonia gandhi , rahul gandhi three others national herald case till final disposal appeals summons. pti muzaffarnagar ; 2 gangrape accused nabbedtwo persons , gaurav amardeep , allegedly involved gangrape cases muzaffarnagar riots , arrested police recruitment centres moradabad. pti","{'bjp': 0, 'cong': 1}",1,0,-0.0026796536796536872
