Date,Title,Article,clean title,clean article,polarity,cong,bjp,senti
2015-10-01,"court orders framing of charges against ex-coal secy gupta, 5 others","new delhi, october 1 a special court today ordered framing of charges against former coal secretary h.c. gupta and five others in a coal scam case pertaining to alleged irregularities in the allocation of coal block in madhya pradesh. besides gupta, the court ordered framing of charges against two senior public servant k.s. kropha and k c samria, accused firm kamal sponge steel and power ltd (ksspl), its managing director pawan kumar ahluwalia and chartered account amit goyal. special cbi judge bharat parashar ordered to put these six accused on trial for the alleged offences under section 120-b (criminal conspiracy) read with 420 (cheating), 409 (criminal breach of trust by public servant) of the ipc and under relevant provisions of the prevention of corruption act. the court has fixed the matter for october 14 for formal framing of charges against the accused. the case pertains to alleged irregularities in the allocation of thesgora-b rudrapuri coal block in madhya pradesh to ksspl. ; kropha was the then joint secretary in ministry of coal, while samria was the then director (coal allocation-i) section in the ministry. the court on october 13 last year had summoned them as accused after refusing to accept cbi’s closure report. the accused were earlier granted bail by the court. the cbi had lodged an fir against ksspl, its officials and other unknown persons for alleged misrepresentation of facts, including inflated net worth, to acquire the coal block. during the arguments on framing of charges, gupta had claimed that then prime minister manmohan singh had given the “final approval” for allocation of coal block to ksspl. cbi had refuted his claim and said that the then prime minister, who was also holding the portfolio of coal ministry at that time, was “kept in the dark” and it was the then coal secretary who had “misled” the senior officials of the prime minister’s office (pmo). the advocates representing other accused had argued that there was no evidence on record warranting framing of charges against them in the case. — pti ","court orders framing charges ex-coal secy gupta , 5 others","new delhi , october 1 special court today ordered framing charges former coal secretary h.c. gupta five others coal scam case pertaining alleged irregularities allocation coal block madhya pradesh. besides gupta , court ordered framing charges two senior public servant k.s. kropha k c samria , accused firm kamal sponge steel power ltd ( ksspl ) , managing director pawan kumar ahluwalia chartered account amit goyal. special cbi judge bharat parashar ordered put six accused trial alleged offences section 120-b ( criminal conspiracy ) read 420 ( cheating ) , 409 ( criminal breach trust public servant ) ipc relevant provisions prevention corruption act. court fixed matter october 14 formal framing charges accused. case pertains alleged irregularities allocation thesgora-b rudrapuri coal block madhya pradesh ksspl. ; kropha joint secretary ministry coal , samria director ( coal allocation-i ) section ministry. court october 13 last year summoned accused refusing accept cbi ’ closure report. accused earlier granted bail court. cbi lodged fir ksspl , officials unknown persons alleged misrepresentation facts , including inflated net worth , acquire coal block. arguments framing charges , gupta claimed prime minister manmohan singh given “final approval ” allocation coal block ksspl. cbi refuted claim said prime minister , also holding portfolio coal ministry time , “kept dark ” coal secretary “misled ” senior officials prime minister ’ office ( pmo ) . advocates representing accused argued evidence record warranting framing charges case. — pti","{'bjp': 0, 'cong': 0}",0,0,-0.010389610389610391
2015-10-02,ex-coal secy in dock,"new delhi a special court on thursday ordered framing of charges against former coal secretary hc gupta and five others in a coal scam case pertaining to alleged irregularities in allocation of coal block in madhya pradesh. the court also ordered framing of charges against two senior public servant ks kropha and kc samria. pti new delhi viswa bharati v-c quits visva bharati vice-chancellor sushanta dattagupta, facing charges of administrative and financial irregularities, has emailed his resignation to president pranab mukherjee. hrd ministry sources said they have received the letter from the president's secretariat but would insist on a written letter of resignation from the v-c. pti new delhi drones to monitor road work the government has decided to use isro-aided satellites and drones to monitor its highways construction programme, aimed at fast-tracking building of roads. ""to ensure proper implementation of highways construction programmes as well as tree plantation drive, we have decided to deploy satellites and drones,"" road transport and highways minister nitin gadkari said. pti",ex-coal secy dock,"new delhi special court thursday ordered framing charges former coal secretary hc gupta five others coal scam case pertaining alleged irregularities allocation coal block madhya pradesh. court also ordered framing charges two senior public servant ks kropha kc samria. pti new delhi viswa bharati v-c quits visva bharati vice-chancellor sushanta dattagupta , facing charges administrative financial irregularities , emailed resignation president pranab mukherjee. hrd ministry sources said received letter president ' secretariat would insist written letter resignation v-c. pti new delhi drones monitor road work government decided use isro-aided satellites drones monitor highways construction programme , aimed fast-tracking building roads. "" ensure proper implementation highways construction programmes well tree plantation drive , decided deploy satellites drones , "" road transport highways minister nitin gadkari said. pti","{'bjp': 0, 'cong': 0}",0,0,0.07402597402597402
2015-10-07,special bench to hear ex-pm manmohan’s plea: sc,"new delhi, october 7 the supreme court today made it clear that the appeal of former prime minister manmohan singh, challenging the trial court order summoning him as an accused in a coal scam case, would be heard by a special bench which has been hearing such cases. the observation was made by a bench headed by chief justice h.l. dattu when senior advocate kapil sibal, appearing for singh, sought an early hearing of the appeal filed by the former prime minister. “this is the matter which is not entirely related to the coal allocation case,” sibal said. “we will refer this to the coal bench and you go before that bench and convince them that this is not a coal matter,” the bench said. the bench, also comprising justice arun mishra, said this matter will be listed next week. ; minutes after the development, senior advocate harish salve appearing for hindalco, mentioned the plea before the bench and sought the hearing after diwali vacation. the plea was resisted by sibal. “these all are that matter. they should be heard together,” salve said. the submissions of salve were supported by another senior advocate k.k. venugopal who appeared for former minister of state for coal santosh bagrodia, also an accused in another coal scam case. the bench, which tentatively agreed with salve’s plea and fixed the matters for hearing on november 17, later asked the lawyers to arrive at a consensus with regard to the date of hearing and then mention it together before the bench. earlier, the supreme court had ordered deletion from its list of business of september 21 the batch of appeals filed by singh and others. the apex court had on april one stayed the trial court order summoning former pm as accused in a coal block allocation case and the proceedings before it. the relief was also extended to hindalco chairman kumar mangalam birla, whose company was granted talabira-ii coal block in odisha in 2005, former coal secretary p.c. parakh, two hindalco officials shubhendu amitabh and d. bhattacharya and the company itself. — pti",special bench hear ex-pm manmohan ’ plea : sc,"new delhi , october 7 supreme court today made clear appeal former prime minister manmohan singh , challenging trial court order summoning accused coal scam case , would heard special bench hearing cases. observation made bench headed chief justice h.l. dattu senior advocate kapil sibal , appearing singh , sought early hearing appeal filed former prime minister. “this matter entirely related coal allocation case , ” sibal said. “we refer coal bench go bench convince coal matter , ” bench said. bench , also comprising justice arun mishra , said matter listed next week. ; minutes development , senior advocate harish salve appearing hindalco , mentioned plea bench sought hearing diwali vacation. plea resisted sibal. “these matter. heard together , ” salve said. submissions salve supported another senior advocate k.k. venugopal appeared former minister state coal santosh bagrodia , also accused another coal scam case. bench , tentatively agreed salve ’ plea fixed matters hearing november 17 , later asked lawyers arrive consensus regard date hearing mention together bench. earlier , supreme court ordered deletion list business september 21 batch appeals filed singh others. apex court april one stayed trial court order summoning former pm accused coal block allocation case proceedings it. relief also extended hindalco chairman kumar mangalam birla , whose company granted talabira-ii coal block odisha 2005 , former coal secretary p.c. parakh , two hindalco officials shubhendu amitabh d. bhattacharya company itself. — pti","{'bjp': 0, 'cong': 0}",0,0,0.08084415584415586
2015-10-08,special bench to hear manmohan’s plea: sc,"new delhi, october 7 the supreme court today made it clear that the appeal of former prime minister manmohan singh, challenging the trial court order summoning him as an accused in a coal scam case, would be heard by a special bench which has been hearing such cases. the observation was made by a bench headed by chief justice hl dattu when senior advocate kapil sibal, appearing for singh, sought an early hearing of the appeal filed by former prime minister. “this is the matter which is not entirely related to the coal allocation case,” sibal said. “we will refer this to the coal bench and you go before that bench and convince them that this is not a coal matter,” the bench said. the bench, also comprising justice arun mishra, said the matter would be listed next week. minutes after the development, senior advocate harish salve appearing for hindalco, mentioned the plea before the bench and sought the hearing after diwali vacation. the plea was resisted by sibal. ; “these all are batch matters (eds correct). they should be heard together,” salve said. the submissions of salve were supported by another senior advocate kk venugopal who appeared for former minister of state for coal santosh bagrodia, also an accused in another coal scam case. the bench, which tentatively agreed with salve’s plea and fixed the matters for hearing on november 17, later asked the lawyers to arrive at a consensus with regard to the date of hearing and then mention it together before the bench. earlier, the supreme court had ordered deletion from its list of business of september 21 the batch of appeals filed by singh and others. the apex court had on april one stayed the trial court order summoning former pm as accused in a coal block allocation case and the proceedings before it. — pti",special bench hear manmohan ’ plea : sc,"new delhi , october 7 supreme court today made clear appeal former prime minister manmohan singh , challenging trial court order summoning accused coal scam case , would heard special bench hearing cases. observation made bench headed chief justice hl dattu senior advocate kapil sibal , appearing singh , sought early hearing appeal filed former prime minister. “this matter entirely related coal allocation case , ” sibal said. “we refer coal bench go bench convince coal matter , ” bench said. bench , also comprising justice arun mishra , said matter would listed next week. minutes development , senior advocate harish salve appearing hindalco , mentioned plea bench sought hearing diwali vacation. plea resisted sibal. ; “these batch matters ( eds correct ) . heard together , ” salve said. submissions salve supported another senior advocate kk venugopal appeared former minister state coal santosh bagrodia , also accused another coal scam case. bench , tentatively agreed salve ’ plea fixed matters hearing november 17 , later asked lawyers arrive consensus regard date hearing mention together bench. earlier , supreme court ordered deletion list business september 21 batch appeals filed singh others. apex court april one stayed trial court order summoning former pm accused coal block allocation case proceedings it. — pti","{'bjp': 0, 'cong': 0}",0,0,0.08623376623376625
2015-10-12,coal scam: court to hear arguments on charges from dec 7,"new delhi, october 12 arguments on framing of charges in a coal scam case in which congress mp vijay darda and six others, including ex-coal secretary hc gupta, are accused, would begin before a special court in december. special cbi judge bharat parashar posted the matter for arguments after the counsel appearing for the accused informed the court that scrutiny of documents supplied to them by the cbi was complete. “the case is now adjourned for consideration on charges on december 7,” the court said. the case pertains to alleged irregularities in allocation of fatehpur (east) coal block in chhattisgarh to accused firm m/s jld yavatmal energy pvt ltd. rajya sabha mp vijay darda, his son devendra darda, gupta, two senior government servants—ks kropha and kc samria—and businessman manoj kumar jayaswal are accused in the case, along with the firm jld yavatmal energy pvt ltd. ; the court had earlier granted bail to them. it had summoned them for alleged offences under sections 120-b (criminal conspiracy) read with 409 (criminal breach of trust by public servant) and 420 (cheating) of ipc and under relevant provisions of prevention of corruption act. it had on november 20 last year refused to accept cbi’s closure report filed in the case and directed the agency to conduct further probe into the matter, while saying that the rajya sabha mp had allegedly “misrepresented” facts in letters written to then prime minister manmohan singh, who was holding the coal ministry portfolio at that time. the accused have denied all allegations. — pti ",coal scam : court hear arguments charges dec 7,"new delhi , october 12 arguments framing charges coal scam case congress mp vijay darda six others , including ex-coal secretary hc gupta , accused , would begin special court december. special cbi judge bharat parashar posted matter arguments counsel appearing accused informed court scrutiny documents supplied cbi complete. “the case adjourned consideration charges december 7 , ” court said. case pertains alleged irregularities allocation fatehpur ( east ) coal block chhattisgarh accused firm m/s jld yavatmal energy pvt ltd. rajya sabha mp vijay darda , son devendra darda , gupta , two senior government servants — ks kropha kc samria — businessman manoj kumar jayaswal accused case , along firm jld yavatmal energy pvt ltd. ; court earlier granted bail them. summoned alleged offences sections 120-b ( criminal conspiracy ) read 409 ( criminal breach trust public servant ) 420 ( cheating ) ipc relevant provisions prevention corruption act. november 20 last year refused accept cbi ’ closure report filed case directed agency conduct probe matter , saying rajya sabha mp allegedly “misrepresented ” facts letters written prime minister manmohan singh , holding coal ministry portfolio time. accused denied allegations. — pti","{'bjp': 0, 'cong': 1}",1,0,-0.009334415584415586
2015-10-13,book hindalco if rs 25 crore recovery shows offence: sc," new delhi, october 12 the supreme court today asked the cbi to see if any offence was made out against aluminium major hindalco in the recovery of rs 25 crore in cash and a diary from its premises and proceed against the company in the event of finding anything illegal. “we expect the cbi to act” on any illegal activity even it did not relate to the alleged irregularities in the allocation of a coal block to the company, a bench headed by justice mb lokur said in its order. the bench, which included justices kurian joseph and ak sikri, is hearing coal block allocation scam cases. cbi booked hindalco and its chief kumar mangalam birla in october 2013 for obtaining allocation of a coal block in talabira ii in odisha. ;",book hindalco rs 25 crore recovery shows offence : sc,"new delhi , october 12 supreme court today asked cbi see offence made aluminium major hindalco recovery rs 25 crore cash diary premises proceed company event finding anything illegal. “we expect cbi act ” illegal activity even relate alleged irregularities allocation coal block company , bench headed justice mb lokur said order. bench , included justices kurian joseph ak sikri , hearing coal block allocation scam cases. cbi booked hindalco chief kumar mangalam birla october 2013 obtaining allocation coal block talabira ii odisha. ;","{'bjp': 0, 'cong': 0}",0,0,-0.18022727272727274
2015-10-16,coal scam: court dismisses koda's plea to summon ex-pm,"new delhi, october 16 a special court on friday dismissed the plea of ex-jharkhand chief minister madhu koda seeking to summon former prime minister manmohan singh as an additional accused in a coal scam case. ""the application moved by madhu koda is dismissed,"" special cbi judge bharat parashar said. the court had on september 28 reserved the order on koda's plea after the agency had opposed it saying that there was no evidence which even prima facie suggests that singh was part of any conspiracy in allocation of a coal block to naveen jindal group firms. cbi had argued in the court that the plea of koda, who had sought summoning of singh and two others as additional accused in the case, was ""devoid of any merits"" and that the records do not reflect that singh, who held the coal portfolio at that time, had any complicity with any accused in any manner. it had also said there was no evidence to show that singh had acted in a ""mechanical manner"" in the entire process. ; koda had alleged that cbi was trying to show there was no involvement of the then prime minister in the entire process. his counsel had also said it cannot be said that the then pm was not aware of all the facts and if file of the matter was said to be routed through then minister of state for coal dasari narayan rao, who is an accused, can it not be said that singh was one of the conspirators. the case pertains to alleged irregularities in allocation of amarkonda murgadangal coal block to jindal group firms -- jindal steel and power ltd (jspl) and gagan sponge iron pvt ltd (gsipl). besides singh, koda had sought summoning of anand swaroop, then secretary (energy) and jai shankar tiwari, then secretary (mines and geology) as additional accused in the case. regarding swaroop and tiwari, cbi had told the court that they are important prosecution witnesses in the case and ""rather it was koda who had tinkered with recommendations"". besides koda and rao, cbi had chargesheeted industrialist naveen jindal, former coal secretary h c gupta and 11 others, including five firms, in the case. out of these accused, only rao had supported koda's plea. the court had summoned these 15 as accused saying that prima facie offences under section 120-b (criminal conspiracy) read with sections 409 (criminal breach of trust by public servant), 420 (cheating) of ipc read with sections 13(1)(c) and 13(1)(d) (criminal misconduct by a public servant) of the prevention of corruption act were made out against them. —pti",coal scam : court dismisses koda ' plea summon ex-pm,"new delhi , october 16 special court friday dismissed plea ex-jharkhand chief minister madhu koda seeking summon former prime minister manmohan singh additional accused coal scam case. "" application moved madhu koda dismissed , "" special cbi judge bharat parashar said. court september 28 reserved order koda ' plea agency opposed saying evidence even prima facie suggests singh part conspiracy allocation coal block naveen jindal group firms. cbi argued court plea koda , sought summoning singh two others additional accused case , "" devoid merits "" records reflect singh , held coal portfolio time , complicity accused manner. also said evidence show singh acted "" mechanical manner "" entire process. ; koda alleged cbi trying show involvement prime minister entire process. counsel also said cannot said pm aware facts file matter said routed minister state coal dasari narayan rao , accused , said singh one conspirators. case pertains alleged irregularities allocation amarkonda murgadangal coal block jindal group firms -- jindal steel power ltd ( jspl ) gagan sponge iron pvt ltd ( gsipl ) . besides singh , koda sought summoning anand swaroop , secretary ( energy ) jai shankar tiwari , secretary ( mines geology ) additional accused case. regarding swaroop tiwari , cbi told court important prosecution witnesses case "" rather koda tinkered recommendations "" . besides koda rao , cbi chargesheeted industrialist naveen jindal , former coal secretary h c gupta 11 others , including five firms , case. accused , rao supported koda ' plea. court summoned 15 accused saying prima facie offences section 120-b ( criminal conspiracy ) read sections 409 ( criminal breach trust public servant ) , 420 ( cheating ) ipc read sections 13( 1 ) ( c ) 13( 1 ) ( ) ( criminal misconduct public servant ) prevention corruption act made them. — pti","{'bjp': 0, 'cong': 0}",0,0,-0.020797258297258297
