Date,Title,Article,clean title,clean article,polarity,cong,bjp,senti
2016-12-22,"rahul’s charges baseless, modi pure as ganga: bjp"," new delhi, december 21 the bjp today dismissed as “utterly baseless” and “shameful” congress vice-president rahul gandhi's allegations that narendra modi as gujarat chief minister had taken money from the sahara and birla groups. rejecting corruption charges against modi, union minister ravi shankar prasad said, “ganga ki tarah pavitra hain pradhan mantri (the prime minister is as pure as the ganga).” he said rahul's words reflected his frustration and were in fact a bid to divert attention from repeated electoral failures of the party and the agustawestland probe in which the names of congress leaders and members of his “family” were coming up. ; addressing a gujrat rally, rahul alleged that as the gujarat cm, modi had taken money from sahara and birla groups. prasad said rahul’s allegations were not just “baseless, false, shameful and mala fide”, they reflected his “frustration” in leading his party to disastrous defeats in state after state. “results of the chandigarh municipal corporation are a proof that no one is paying any attention to him. i condemn the irresponsible, baseless allegation with the contempt it deserves. it is his nature to level baseless charges. the country need not expect anything else from rahul gandhi who has emerged as biggest patron of corruption,” he said. “the charges have already been dismissed by the supreme court. why he did not raise voice against upa government’s massive scams. why he did not utter a single word when crores of rupees were being looted during the congress rule…,” the minister said. “the congress’ history stinks with corruption. it did not spare any part of the world while indulging in rampant corruption: earth (commonwealth games scam), space (devas-antrix deal), underground (coal scam), sky (agustawestland and 2g scam) and sea (submarine scam),” he said. ","rahul ’ charges baseless , modi pure ganga : bjp","new delhi , december 21 bjp today dismissed “utterly baseless ” “shameful ” congress vice-president rahul gandhi ' allegations narendra modi gujarat chief minister taken money sahara birla groups. rejecting corruption charges modi , union minister ravi shankar prasad said , “ganga ki tarah pavitra hain pradhan mantri ( prime minister pure ganga ) . ” said rahul ' words reflected frustration fact bid divert attention repeated electoral failures party agustawestland probe names congress leaders members “family ” coming up. ; addressing gujrat rally , rahul alleged gujarat cm , modi taken money sahara birla groups. prasad said rahul ’ allegations “baseless , false , shameful mala fide ” , reflected “frustration ” leading party disastrous defeats state state. “results chandigarh municipal corporation proof one paying attention him. condemn irresponsible , baseless allegation contempt deserves. nature level baseless charges. country need expect anything else rahul gandhi emerged biggest patron corruption , ” said. “the charges already dismissed supreme court. raise voice upa government ’ massive scams. utter single word crores rupees looted congress rule … , ” minister said. “the congress ’ history stinks corruption. spare part world indulging rampant corruption : earth ( commonwealth games scam ) , space ( devas-antrix deal ) , underground ( coal scam ) , sky ( agustawestland 2g scam ) sea ( submarine scam ) , ” said.","{'bjp': 1, 'cong': 4}",4,1,-0.1520779220779221
2016-12-23,"ex-coal secy, others on trial for cheating","new delhi, december 22 former coal secretary hc gupta, facing prosecution in coal scam cases, was today put on trial by a special court along with four others, including two public servants, for alleged offences of cheating and criminal conspiracy in the jicpl case. special cbi judge bharat parashar also framed charges against senior public servants ks kropha and kc samria, jas infrastructure capital pvt ltd (jicpl) and its director manoj kumar jayaswal for the alleged irregularities in the allotment of ‘mahuagarhi coal block’ in jharkhand to a private firm. after the charges were framed, the accused pleaded not guilty and claimed trial in the case. the court has put the matter for further hearing on april 17, 2017. while ordering to put the accused on trial, the court had on december 7, said: “the facts of the present case prima facie show that accused hc gupta, ks kropha and kc samria entered into a criminal conspiracy with company m/s jicpl and its director manoj kumar jayaswal so as to procure allotment of a coal block in favour of m/s jicpl.” the court had said: “the acts alleged against the accused public servants gupta, kropha and samria are such that if questioned, they cannot claim that they were acting in discharge of their official duties.” — pti ;","ex-coal secy , others trial cheating","new delhi , december 22 former coal secretary hc gupta , facing prosecution coal scam cases , today put trial special court along four others , including two public servants , alleged offences cheating criminal conspiracy the jicpl case. special cbi judge bharat parashar also framed charges senior public servants ks kropha kc samria , jas infrastructure capital pvt ltd ( jicpl ) director manoj kumar jayaswal alleged irregularities allotment ‘mahuagarhi coal block ’ jharkhand private firm. charges framed , accused pleaded guilty claimed trial case. court put matter hearing april 17 , 2017. ordering put accused trial , court december 7 , said : “the facts present case prima facie show accused hc gupta , ks kropha kc samria entered criminal conspiracy company m/s jicpl director manoj kumar jayaswal procure allotment coal block favour m/s jicpl. ” court said : “the acts alleged accused public servants gupta , kropha samria questioned , cannot claim acting discharge official duties. ” — pti ;","{'bjp': 0, 'cong': 0}",0,0,-0.010492139439507867
2017-01-11,bjp hits back after rahul attacks pm modi,"vibha sharma  new delhi, january 11 buoyed by the supreme court dismissal of a plea for investigations into the sahara-birla diaries, the bjp hit right back at congress vice-president rahul gandhi for his jibe-laced attack against prime minister narendra modi on wednesday. the ruling bjp reminded him of decisions taken by governments led by the congress party, which, it said were ""true examples of stifling of democracy and destruction of established institutions”. notably, rahul attack against the prime minister centered on “his incompetent decision"" to scrap high-value currency notes and attempts at “weakening every single institution” constituting the backbone of the country. ; but as per union minister prakash javadekar, it was the congress which had ""destroyed each and every institution in the country’s system"" and because rahul did not have much substance left to argue he was resorting to “senseless allegations”. “i think rahul gandhi does not have anything left to argue, which is why he is making senseless allegations. “who destroyed the nation’s system, it was the congress. the congress suffocated democracy in 1975 (by imposing the emergency) and then justified the sikh massacre in 1984. after rahul took over (as congress vice-president), everyone remembers how he insulted dr manmohan singh publicly when he tore an ordinance issued by his government and he now says that prime minister narendra modi has weakened institution,"" javadekar said. rahul had publicly castigated the upa government led by manmohan singh for issuing an ordinance to negate the supreme court order on disqualifying convicted mps and mlas, terming it as ""complete nonsense”. javadekar also sought to remind rahul that when late sunil dutt was enrolled in the cwg by the government, his name was struck off by 10 janpath (the official residence of congress president sonia gandhi) and the name of suresh kalmadi announced. “2g, coal scam and all the other scams during the upa regime — that was destroying institutions one after the other,"" he said, adding that because the poor people who earlier supported the congress were now backing the prime minister and his demonetisation move, the congress leader was ""worried and making senseless allegations like those against the prime minister on the basis of diaries which were dismissed by the supreme court today"". significantly, in a major relief for the bjp and the prime minister, the apex court today dismissed senior lawyer prashant bhushan’s plea for investigations into the documents seized in income tax raids. meanwhile, javadekar’s party colleague shahnawaz hussain dismissed rahul as a “part-time politician”, mocking him as someone who just returned yesterday from a holiday abroad. “rahul gandhi is a part-time politician. where was he for the past two weeks? he has just arrived from a vacation and is now talking about demonetisation. if he really cared about people and their plight he would not have gone for a holiday,” he said. ",bjp hits back rahul attacks pm modi,"vibha sharma new delhi , january 11 buoyed supreme court dismissal plea investigations sahara-birla diaries , bjp hit right back congress vice-president rahul gandhi jibe-laced attack prime minister narendra modi wednesday. ruling bjp reminded decisions taken governments led congress party , , said "" true examples stifling democracy destruction established institutions ” . notably , rahul attack prime minister centered “his incompetent decision "" scrap high-value currency notes attempts “weakening every single institution ” constituting backbone country. ; per union minister prakash javadekar , congress "" destroyed every institution country ’ system "" rahul much substance left argue resorting “senseless allegations ” . “i think rahul gandhi anything left argue , making senseless allegations. “who destroyed nation ’ system , congress. congress suffocated democracy 1975 ( imposing emergency ) justified sikh massacre 1984. rahul took ( congress vice-president ) , everyone remembers insulted dr manmohan singh publicly tore ordinance issued government says prime minister narendra modi weakened institution , "" javadekar said. rahul publicly castigated upa government led manmohan singh issuing ordinance negate supreme court order disqualifying convicted mps mlas , terming "" complete nonsense ” . javadekar also sought remind rahul late sunil dutt enrolled cwg government , name struck 10 janpath ( official residence congress president sonia gandhi ) name suresh kalmadi announced. “2g , coal scam scams upa regime — destroying institutions one , "" said , adding poor people earlier supported congress backing prime minister demonetisation move , congress leader "" worried making senseless allegations like prime minister basis diaries dismissed supreme court today "" . significantly , major relief bjp prime minister , apex court today dismissed senior lawyer prashant bhushan ’ plea investigations documents seized income tax raids. meanwhile , javadekar ’ party colleague shahnawaz hussain dismissed rahul “part-time politician ” , mocking someone returned yesterday holiday abroad. “rahul gandhi part-time politician. past two weeks ? arrived vacation talking demonetisation. really cared people plight would gone holiday , ” said.","{'bjp': 3, 'cong': 9}",9,3,0.017963015245623947
2017-01-12,charges senseless: minister,"vibha sharma  new delhi, january 11 buoyed by the supreme court dismissal of a plea for probing the sahara-birla diaries, the bjp hit back at congress vice-president rahul gandhi for his jibes-laced attack on pm narendra modi today. the ruling party reminded him of decisions taken by governments led by the congress, which, it said, were “true examples of stifling democracy and destruction of established institutions”. rahul’s attack on the pm centered on “his incompetent decision” to scrap high-value notes and attempts at “weakening institutions” that constituted the country’s backbone. but union minister prakash javadekar said it was the congress that “destroyed each and every institution in the country’s system” and because rahul did not have much substance left to argue, he was resorting to “senseless allegations”. ; javadekar also sought to remind rahul on how when late sunil dutt was enrolled in the cwg by the government, his name was struck off by 10 janpath (the official residence of congress president sonia gandhi) and the name of suresh kalmadi announced. “2g, coal scam and all other scams during the upa regime destroyed institutions one after the other,” he said, adding that because the poor, who earlier supported the congress, were now backing the pm and his demonetisation move, the congress leader was “worried and making senseless allegations on the basis of diaries dismissed by the supreme court today”. in a major relief for the bjp and the pm, the apex court today dismissed senior lawyer prashant bhushan’s plea for investigations into the documents seized in income tax raids. meanwhile, javadekar's party colleague shahnawaz hussain dismissed rahul as a ""part-time politician"", mocking him as someone who just returned yesterday from a holiday abroad. ""rahul is a part-time politician. where was he for the past two weeks? he has just arrived from a vacation and is now talking about demonetisation. if he really cared about people and their plight, he would not have gone for a holiday,"" he said.",charges senseless : minister,"vibha sharma new delhi , january 11 buoyed supreme court dismissal plea probing sahara-birla diaries , bjp hit back congress vice-president rahul gandhi jibes-laced attack pm narendra modi today. ruling party reminded decisions taken governments led congress , , said , “true examples stifling democracy destruction established institutions ” . rahul ’ attack pm centered “his incompetent decision ” scrap high-value notes attempts “weakening institutions ” constituted country ’ backbone. union minister prakash javadekar said congress “destroyed every institution country ’ system ” rahul much substance left argue , resorting “senseless allegations ” . ; javadekar also sought remind rahul late sunil dutt enrolled cwg government , name struck 10 janpath ( official residence congress president sonia gandhi ) name suresh kalmadi announced. “2g , coal scam scams upa regime destroyed institutions one , ” said , adding poor , earlier supported congress , backing pm demonetisation move , congress leader “worried making senseless allegations basis diaries dismissed supreme court today ” . major relief bjp pm , apex court today dismissed senior lawyer prashant bhushan ’ plea investigations documents seized income tax raids. meanwhile , javadekar ' party colleague shahnawaz hussain dismissed rahul "" part-time politician "" , mocking someone returned yesterday holiday abroad. "" rahul part-time politician. past two weeks ? arrived vacation talking demonetisation. really cared people plight , would gone holiday , "" said .","{'bjp': 2, 'cong': 6}",6,2,-0.042938311688311685
2017-01-13,coal scam: cbi files final report against naveen jindal,"new delhi, january 13 the cbi on friday filed the final report in further probe directed by special court in the coal scam case against congress leader and industrialist naveen jindal, ex-minister of state for coal dasari narayan rao and others. special judge bharat parashar, however, took strong objection to the io not filing the report in a proper format and asked him to do so by january 23. ; (follow the tribune on facebook; and twitter @thetribunechd) the report filed before the court today contains cfsl reports, list of witnesses and their statements recorded by the cbi. the court had earlier pulled up the cbi for delay in filing the report, saying it was affecting the progress of trial. the court had allowed the cbi's plea that it needed to probe the case further in light of certain disclosures made by a chartered accountant suresh singhal, who had sought the court's nod to turn approver. it had also allowed singhal's plea for pardon and ordered deletion of his name from the list of the accused. the cbi had alleged that ex-jharkhand chief minister madhu koda, also accused in the case, had favoured jindal group firms -- jindal steel and power ltd (jspl) and gagan sponge iron private ltd (gsipl) -- in allocation of amarkonda murgadangal coal block in jharkhand. opposing cbi's contention, all the accused had said there was no evidence to show that they were in any conspiracy during the coal block allocation process. they had also denied the allegations levelled against them by cbi in its charge sheet. —pti ",coal scam : cbi files final report naveen jindal,"new delhi , january 13 cbi friday filed final report probe directed special court coal scam case congress leader industrialist naveen jindal , ex-minister state coal dasari narayan rao others. special judge bharat parashar , however , took strong objection io filing report proper format asked january 23. ; ( follow tribune facebook ; twitter @thetribunechd ) report filed court today contains cfsl reports , list witnesses statements recorded cbi. court earlier pulled cbi delay filing report , saying affecting progress trial. court allowed cbi ' plea needed probe case light certain disclosures made chartered accountant suresh singhal , sought court ' nod turn approver. also allowed singhal ' plea pardon ordered deletion name list accused. cbi alleged ex-jharkhand chief minister madhu koda , also accused case , favoured jindal group firms -- jindal steel power ltd ( jspl ) gagan sponge iron private ltd ( gsipl ) -- allocation amarkonda murgadangal coal block jharkhand. opposing cbi ' contention , accused said evidence show conspiracy coal block allocation process. also denied allegations levelled cbi charge sheet. — pti","{'bjp': 0, 'cong': 1}",1,0,0.13832833832833832
2017-01-14,court raps cbi for ‘improper’ final report,"new delhi, january 13 a special court today pulled up the cbi for not filing in a “proper format” the final report in the coal block allocation case against former congress mp and industrialist naveen jindal, ex-minister of state for coal dasari narayan rao and others. “it is high time” that the cbi should know how to file a report in the court, special cbi judge bharat parashar said expressing annoyance over the manner in which the final report was filed before him. the cbi inspector, who filed the report, faced the flak of the court as the judge asked him “not to behave like a junior officer” and warned him that he would have to explain in writing if he did not file the report in the prescribed format. initially, the court asked the official to file the report in a format within three days but when he expressed his inability to do so, it said, “don’t you know it has to be submitted in a proper format? it is high time you should know it.” — agencies ;",court raps cbi ‘improper ’ final report,"new delhi , january 13 special court today pulled cbi filing “proper format ” final report coal block allocation case former congress mp industrialist naveen jindal , ex-minister state coal dasari narayan rao others. “it high time ” cbi know file report court , special cbi judge bharat parashar said expressing annoyance manner final report filed him. cbi inspector , filed report , faced flak court judge asked “not behave like junior officer ” warned would explain writing file report prescribed format. initially , court asked official file report format within three days expressed inability , said , “don ’ know submitted proper format ? high time know it. ” — agencies ;","{'bjp': 0, 'cong': 1}",1,0,0.10642266824085005
2017-01-23,coal scam: sc orders cbi probe against former director ranjit sinha,"satya prakash  new delhi, january 23 the supreme court on monday ordered a cbi probe against the agency's former director ranjit sinha for allegedly interfering in 2g and coal scam investigations. a bench headed by justice mb lokur said the cbi director can choose two other senior officers of the agency who can be part of the team. follow the tribune on facebook; and twitter @thetribunechd) ; the court, which rejected for an sit probe against sinha, said it was reposing faith in the cbi because of the change of guard in the agency. it asked the cbi director to inform the court about the composition of the probe team and the possible time to be taken by january 30, the next date of hearing. petitioner's common cause counsel prashant bhushan told the bench that senior ips officer and cbi joint director vineet vinayak, who has been supervising the coal scam probe, had conflict of interest in the matter. the court asked the cbi to verify the allegations and inform it by the next date. the court also asked the cbi and ed to submit status reports on the progress made in their respective probe. ""pull up your shocks,"" justice lokur told senior counsel amarendra sharan who represented the cbi. the court asked him to give a bird's eye view of the cases under investigation by the cbi and the ed. sharan told the bench that two cases had already reached culmination and at least one case was registered only in december last year. ",coal scam : sc orders cbi probe former director ranjit sinha,"satya prakash new delhi , january 23 supreme court monday ordered cbi probe agency ' former director ranjit sinha allegedly interfering 2g coal scam investigations. bench headed justice mb lokur said cbi director choose two senior officers agency part team. follow tribune facebook ; twitter @thetribunechd ) ; court , rejected sit probe sinha , said reposing faith cbi change guard agency. asked cbi director inform court composition probe team possible time taken january 30 , next date hearing. petitioner ' common cause counsel prashant bhushan told bench senior ips officer cbi joint director vineet vinayak , supervising coal scam probe , conflict interest matter. court asked cbi verify allegations inform next date. court also asked cbi ed submit status reports progress made respective probe. "" pull shocks , "" justice lokur told senior counsel amarendra sharan represented cbi. court asked give bird ' eye view cases investigation cbi ed. sharan told bench two cases already reached culmination least one case registered december last year.","{'bjp': 0, 'cong': 0}",0,0,-0.057386363636363645
2017-01-24,sc tells cbi to probe its former chief sinha,"new delhi, january 23 the supreme court on monday ordered a cbi inquiry against the agency’s former director ranjit sinha for allegedly interfering in coal scam investigations. a bench headed by justice mb lokur said: “a prima facie case has been definitely made out for investigation for abuse of authority.” the court said central bureau of investigation director alok verma could select two senior officers to carry out the probe. the court, while rejecting an sit inquiry, said it was reposing faith in the cbi because of the change of guard there. it asked the cbi director to inform the court about the composition of the team and duration of probe by january 30, the next date of hearing. the petitioner’s counsel, prashant bhushan, told the bench that cbi joint director vineet vinayak, who has been supervising the coal scam probe, had conflict of interest in the matter. the court asked the cbi to verify the allegations. ; it also asked the cbi and the enforcement directorate to submit status reports. “pull up your socks,” justice lokur told senior counsel amarendra sharan, who represented the cbi. attorney general mukul rohatgi had told the top court last year that a panel headed by former cbi special director ml sharma had indicted sinha for meeting some high-profile accused. — tns",sc tells cbi probe former chief sinha,"new delhi , january 23 supreme court monday ordered cbi inquiry agency ’ former director ranjit sinha allegedly interfering coal scam investigations. bench headed justice mb lokur said : “a prima facie case definitely made investigation abuse authority. ” court said central bureau investigation director alok verma could select two senior officers carry probe. court , rejecting sit inquiry , said reposing faith cbi change guard there. asked cbi director inform court composition team duration probe january 30 , next date hearing. petitioner ’ counsel , prashant bhushan , told bench cbi joint director vineet vinayak , supervising coal scam probe , conflict interest matter. court asked cbi verify allegations. ; also asked cbi enforcement directorate submit status reports. “pull socks , ” justice lokur told senior counsel amarendra sharan , represented cbi. attorney general mukul rohatgi told top court last year panel headed former cbi special director ml sharma indicted sinha meeting high-profile accused. — tns","{'bjp': 0, 'cong': 0}",0,0,0.08577331759149942
