Date,Title,Article,clean title,clean article,polarity,cong,bjp,senti
2015-05-20,"charges framed against power firm, 3 top officials in coal scam","new delhi, may 19 a special court today framed charges against delhi-based rathi steel and power limited (rspl) and its three top officials in a coal blocks allocation scam case. “charges are framed under sections 120b() read with 420 of ipc against all the four accused. the charge under section 420 of the ipc is made out against rspl and accused udit rathi. all the accused plead not guilty and claim trial. put up for admission and denial of documents on june 2,” special cbi judge bharat prashar said. the court had on may 7 fixed today for pronouncing its order on framing of charges in the case in which rspl and its top officials—managing director pradeep rathi, chief executive officer udit rathi and agm kushal aggarwal— have been charge sheeted by the cbi. the case pertains to alleged irregularities in allocation of kesla north coal block in chhattisgarh to rspl. the accused were charge -sheeted for alleged offences under section 120-b (criminal conspiracy) and 420 (cheating) of the ipc. ; during the arguments on framing of charges in the case, all the accused had contended that the cbi had “miserably” failed to show that there was a loss to the government or anybody else due to the allocation of coal block to rspl. the defence counsel had said the accused firm had not extracted any coal from the kesla north block and there was no wrongful gain or corresponding loss to anybody. he had argued that prima facie offences of cheating and criminal conspiracy were not made out against the accused. the cbi, however, had countered their submissions saying rspl and its officials had “misrepresented” facts before the 36th screening committee regarding acquisition of 250 acres of land to acquire the coal block. — pti","charges framed power firm , 3 top officials coal scam","new delhi , may 19 special court today framed charges delhi-based rathi steel power limited ( rspl ) three top officials coal blocks allocation scam case. “charges framed sections 120b( ) read 420 ipc four accused. charge section 420 ipc made rspl accused udit rathi. accused plead guilty claim trial. put admission denial documents june 2 , ” special cbi judge bharat prashar said. court may 7 fixed today pronouncing order framing charges case rspl top officials — managing director pradeep rathi , chief executive officer udit rathi agm kushal aggarwal — charge sheeted cbi. case pertains alleged irregularities allocation kesla north coal block chhattisgarh rspl. accused charge -sheeted alleged offences section 120-b ( criminal conspiracy ) 420 ( cheating ) ipc. ; arguments framing charges case , accused contended cbi “miserably ” failed show loss government anybody else due allocation coal block rspl. defence counsel said accused firm extracted coal kesla north block wrongful gain corresponding loss anybody. argued prima facie offences cheating criminal conspiracy made accused. cbi , however , countered submissions saying rspl officials “misrepresented ” facts 36th screening committee regarding acquisition 250 acres land acquire coal block. — pti","{'bjp': 0, 'cong': 0}",0,0,0.0202813852813853
2015-05-21,conspiracy behind my name appearing in cag report: gadkari," new delhi, may 21 union road transport and highways minister nitin gadkari claims there is a conspiracy behind the recent controversy involving a loan being extended by the state-run ireda to nagpur-based purti sakhar karkhana ltd (pskl) while gadkari was chairman of the company. in a recent interview, the minister said while the draft audit report did not have his name, the final one mentioned him. ""the draft report which went to the (new and renewable energy) ministry (for comments), my name was not there, but it is there in the printed final report,"" road transport, highways and shipping minister said in an interview here. earlier this month, the auditor criticised the ireda for flouting rules while extending a loan of rs 48.65-crore loan to pskl. citing cag reports on the 2g spectrum scam, coal scam and the controversial land deal believed to involve robert vadra, the son-in-law of congress president sonia gandhi, gadkari claimed none of the reports contained names of the directors of the companies believed to have been involved. ""i am not accusing the cag. but i cannot understand a few things. when there are firms who faced cbi cases, the names of their directors were not mentioned. but in my case, we are among the 29 firms who returned the maximum part of the loan, but my name has come in the report. ; ""i don't understand that when i took the loan and returned it, why was i named in the audit report... my name was not there in the draft report, but was in the final report. still… i am not accusing the cag,"" he said. — pti",conspiracy behind name appearing cag report : gadkari,"new delhi , may 21 union road transport highways minister nitin gadkari claims conspiracy behind recent controversy involving loan extended state-run ireda nagpur-based purti sakhar karkhana ltd ( pskl ) gadkari chairman company. recent interview , minister said draft audit report name , final one mentioned him. "" draft report went ( new renewable energy ) ministry ( comments ) , name , printed final report , "" road transport , highways shipping minister said interview here. earlier month , auditor criticised ireda flouting rules extending loan rs 48.65-crore loan pskl. citing cag reports 2g spectrum scam , coal scam controversial land deal believed involve robert vadra , son-in-law congress president sonia gandhi , gadkari claimed none reports contained names directors companies believed involved. "" accusing cag. cannot understand things. firms faced cbi cases , names directors mentioned. case , among 29 firms returned maximum part loan , name come report. ; "" ' understand took loan returned , named audit report ... name draft report , final report. still … accusing cag , "" said. — pti","{'bjp': 0, 'cong': 1}",1,0,0.02024793388429752
2015-05-22,"jindal, koda get bail in coal block allocation case","new delhi, may 22 congress leader and industrialist naveen jindal, ex-minister of state for coal dasari narayan rao, former jharkhand chief minister madhu koda and seven others were today granted bail by a special court in a coal block allocation scam case. jindal, rao, koda, formed coal secretary harish chandra gupta and others appeared as accused before the special cbi judge bharat parasar and moved separate pleas seeking bail. during the arguments, senior advocate ramesh gupta, appearing for jindal, told the court that his client had joined the investigation as and when called by the cbi and there was no apprehension that he would abscond or flee from justice. the counsel representing other nine individual accused told the court that their clients were not arrested during the investigation and there was no likelihood that any one of them will abscond. senior public prosecutor v k sharma opposed the bail pleas saying the accused in the case are high profile industrialists and politicians and most of the prosecution witnesses are their employees and could influence the witnesses or tamper with the evidence if released on bail. ; the judge, after hearing the submissions, granted bail to the ten individuals accused, saying, ""i deem it appropriate to admit all ten accused on bail on a personal bond of rs 1 lakh each with one surety of the like amount."" the court also directed the accused not to leave india without its prior permission and fixed the matter for further hearing on june 1. besides jindal, rao, koda and gupta, the other accused who were granted bail are suresh singhal, director of new delhi exim pvt ltd, rajeev jain, director of jindal realty pvt ltd, girish kumar suneja and radha krishna saraf, both directors of gagan sponge iron pvt ltd (gsipl), k ramakrishna prasad, managing director of sowbhagya media ltd and chartered accountant gyan swaroop garg. besides these ten accused, the authorised representatives of five accused firms -- jindal steel and pvt ltd (jspl), jindal realty pvt ltd, gagan infraenergy ltd (formerly known as gsipl), sowbhagya media ltd and new delhi exim pvt ltd -- also appeared before the court. the accused were summoned by the court in the case pertaining to the alleged irregularities in allocation of amarkonda murgadangal coal block in jharkhand to two jindal group firms, jindal steel and power ltd (jspl) and gagan sponge iron pvt ltd (gsipl). pti ","jindal , koda get bail coal block allocation case","new delhi , may 22 congress leader industrialist naveen jindal , ex-minister state coal dasari narayan rao , former jharkhand chief minister madhu koda seven others today granted bail special court coal block allocation scam case. jindal , rao , koda , formed coal secretary harish chandra gupta others appeared accused special cbi judge bharat parasar moved separate pleas seeking bail. arguments , senior advocate ramesh gupta , appearing jindal , told court client joined investigation called cbi apprehension would abscond flee justice. counsel representing nine individual accused told court clients arrested investigation likelihood one abscond. senior public prosecutor v k sharma opposed bail pleas saying accused case high profile industrialists politicians prosecution witnesses employees could influence witnesses tamper evidence released bail. ; judge , hearing submissions , granted bail ten individuals accused , saying , "" deem appropriate admit ten accused bail personal bond rs 1 lakh one surety like amount. "" court also directed accused leave india without prior permission fixed matter hearing june 1. besides jindal , rao , koda gupta , accused granted bail suresh singhal , director new delhi exim pvt ltd , rajeev jain , director jindal realty pvt ltd , girish kumar suneja radha krishna saraf , directors gagan sponge iron pvt ltd ( gsipl ) , k ramakrishna prasad , managing director sowbhagya media ltd chartered accountant gyan swaroop garg. besides ten accused , authorised representatives five accused firms -- jindal steel pvt ltd ( jspl ) , jindal realty pvt ltd , gagan infraenergy ltd ( formerly known gsipl ) , sowbhagya media ltd new delhi exim pvt ltd -- also appeared court. accused summoned court case pertaining alleged irregularities allocation amarkonda murgadangal coal block jharkhand two jindal group firms , jindal steel power ltd ( jspl ) gagan sponge iron pvt ltd ( gsipl ) . pti","{'bjp': 0, 'cong': 1}",1,0,0.09242621015348287
2015-05-23,"jindal, koda, 8 others get bail","new delhi, may 22 congress leader and industrialist naveen jindal, former jharkhand chief minister madhu koda, ex -minister of state for coal dasari narayan rao and seven others were today granted bail by a special court which asked them not to tamper with evidence or influence witnesses. the court granted them the relief after they appeared before it and sought bail on the ground that they have joined the investigation and there was no apprehension that they would flee from justice. apart from jindal, rao and koda, the court granted bail to former coal secretary harish chandra gupta and six others on furnishing of a personal bond of rs one lakh each and a surety of like amount. special cbi judge bharat parashar directed the accused not to leave the country without the court’s permission and fixed the matter for june 1 for scrutiny of documents. while granting bail, the court said undoubtedly the allegations against the accused persons were serious in nature, more so as they occupied high position in the society. ; “however, at the same time it is also true that during the course of investigation, none of the accused persons were arrested by the cbi and there has been no allegation that they did not join the investigation as and when called for,” it said. “i, thus, without entering into any further details on merits or demerits of the case at this stage of the matter, deem it appropriate that the interest of justice will be suitably met if all the above 10 accused persons are released on bail...,” the judge said.— pti","jindal , koda , 8 others get bail","new delhi , may 22 congress leader industrialist naveen jindal , former jharkhand chief minister madhu koda , ex -minister state coal dasari narayan rao seven others today granted bail special court asked tamper evidence influence witnesses. court granted relief appeared sought bail ground joined investigation apprehension would flee justice. apart jindal , rao koda , court granted bail former coal secretary harish chandra gupta six others furnishing personal bond rs one lakh surety like amount. special cbi judge bharat parashar directed accused leave country without court ’ permission fixed matter june 1 scrutiny documents. granting bail , court said undoubtedly allegations accused persons serious nature , occupied high position society. ; “however , time also true course investigation , none accused persons arrested cbi allegation join investigation called , ” said. “i , thus , without entering details merits demerits case stage matter , deem appropriate interest justice suitably met 10 accused persons released bail ... , ” judge said. — pti","{'bjp': 0, 'cong': 1}",1,0,0.16733225108225108
2015-05-27,"bjp hits back, says manmohan ‘lying with a straight face’","surat/new delhi, may 27 in a no-holds-barred counter-attack on manmohan singh, the bjp today branded the former prime minister a “puppet” and accused him of “lying with a straight face” after he charged the modi government with harping on corruption to divert the people’s attention to non-issues. leading the charge was bjp president amit shah who told reporters in gujarat that “scams” involving rs 12 lakh crore had been perpetrated during singh’s 10-year rule and he “cannot run away from its responsibility” by merely saying that he had not “enriched” himself. “i believe that a prime minister’s responsibility is not limited to not doing corruption himself but to also ensure that others are not allowed to do corruption. he has to root out corruption from the system. under singh’s rule, scams of (rs) 12 lakh crore occurred and the congress cannot run away from its responsibility,” shah said. “debate is not over simply because you (singh) do not yourself engage in corruption. a prime minister is expected to provide corruption free governance,” he said. at an event in new delhi earlier in the day, singh launched a sharp attack on the bjp government for its frequent reference to scams under his tenure and asserted, “i have not used my public office to enrich myself, to enrich my family or my friends. the bjp government keeps on harping on this theme of corruption because it wants to divert people’s attention to non-issues.” ; bjp spokesperson sambit patra said singh had broken his silence after being “exposed” by “books after books”, “facts after facts” and not only by agencies like cag and cbi but also by “his own bureaucrats”, a reference to allegations by former trai chairman pradip baijal that singh had warned him of harm if he did not cooperate on 2g telecom licenses. attacking the former prime minister for his assertion that he had not enriched himself or his family, patra said singh was a “shadow prime minister” who used his office to “enrich” 10 janpath, a reference to congress president sonia gandhi. “country knows... if there is a prime minister without the gandhi family, then he is merely a shadow prime minister, a puppet prime minister with the strings lying with the 10 janpath. in such a scenario, the country knew singh’s strings were lying with 10 janpath,” the bjp spokesperson said. alleging that singh’s uttering were “full of lies”, bjp secretary siddharth nath singh said, “one must give credit to him that he is (the) best politician india has produced in the last many decades... he can lie with a straight face and say i have not done anything wrong.” bjp spokesperson patra said it was “ironical” that former prime minister singh chose to keep silent when parliament debated scams during his tenure and speak out now when “truth is out in the open”. “it would be very apt to say that singh has broken his silence in self-defence and not for the nation,” he said. claiming that singh termed corruption as a “non-issue”, patra said, “your government, the congress-led upa, looted this country for 10 long years. thirteen to fifteen lakh crores (of rupees) were drained from country and you say it’s a non-issue.” “you had pick-pocketed money from every pocket of the country,” he charged. it may be a “non-issue” for the congress but a “core issue” for the country and people showed it in the 2014 election by giving congress merely 44 seats, he said. this “ritual” of breaking silence is of no use, he said as he referred to the summoning of singh by a local court in a coal scam case. singh reduced the position of prime minister to “ridicule”, he said, alleging that official files were taken to sonia gandhi for her approval during the former prime minister’s term. another party spokesperson nalin kohli said singh was never accused of personal corruption and referred to cancellation of spectrum and coal block allocations by the supreme court to highlight financial scandals in his rule. hitting out at the bjp government, singh had accused it of repackaging upa’s programmes and marketing as its own. “what bjp had opposed when we were in power are now being sold as its contribution,” the former prime minister said. rejecting criticism of “policy paralysis” under the upa, he said when his government left, india was the second fastest growing economy in the world and noted there was a “fragileness” in economic recovery under the current dispensation. bjp leaders also raked up the charges levelled by singh’s cabinet colleague jayanthi natarajan, who had been expelled from congress, and arrest of the then telecom minister a raja to attack him. they said the modi dispensation was successfully reconstructing the economy broken under the upa rule. — pti ","bjp hits back , says manmohan ‘lying straight face ’","surat/new delhi , may 27 no-holds-barred counter-attack manmohan singh , bjp today branded former prime minister “puppet ” accused “lying straight face ” charged modi government harping corruption divert people ’ attention non-issues. leading charge bjp president amit shah told reporters gujarat “scams ” involving rs 12 lakh crore perpetrated singh ’ 10-year rule “cannot run away responsibility ” merely saying “enriched ” himself. “i believe prime minister ’ responsibility limited corruption also ensure others allowed corruption. root corruption system. singh ’ rule , scams ( rs ) 12 lakh crore occurred congress cannot run away responsibility , ” shah said. “debate simply ( singh ) engage corruption. prime minister expected provide corruption free governance , ” said. event new delhi earlier day , singh launched sharp attack bjp government frequent reference scams tenure asserted , “i used public office enrich , enrich family friends. bjp government keeps harping theme corruption wants divert people ’ attention non-issues. ” ; bjp spokesperson sambit patra said singh broken silence “exposed ” “books books ” , “facts facts ” agencies like cag cbi also “his bureaucrats ” , reference allegations former trai chairman pradip baijal singh warned harm cooperate 2g telecom licenses. attacking former prime minister assertion enriched family , patra said singh “shadow prime minister ” used office “enrich ” 10 janpath , reference congress president sonia gandhi. “country knows ... prime minister without gandhi family , merely shadow prime minister , puppet prime minister strings lying 10 janpath. scenario , country knew singh ’ strings lying 10 janpath , ” bjp spokesperson said. alleging singh ’ uttering “full lies ” , bjp secretary siddharth nath singh said , “one must give credit ( ) best politician india produced last many decades ... lie straight face say done anything wrong. ” bjp spokesperson patra said “ironical ” former prime minister singh chose keep silent parliament debated scams tenure speak “truth open ” . “it would apt say singh broken silence self-defence nation , ” said. claiming singh termed corruption “non-issue ” , patra said , “your government , congress-led upa , looted country 10 long years. thirteen fifteen lakh crores ( rupees ) drained country say ’ non-issue. ” “you pick-pocketed money every pocket country , ” charged. may “non-issue ” congress “core issue ” country people showed 2014 election giving congress merely 44 seats , said. “ritual ” breaking silence use , said referred summoning singh local court coal scam case. singh reduced position prime minister “ridicule ” , said , alleging official files taken sonia gandhi approval former prime minister ’ term. another party spokesperson nalin kohli said singh never accused personal corruption referred cancellation spectrum coal block allocations supreme court highlight financial scandals rule. hitting bjp government , singh accused repackaging upa ’ programmes marketing own. “what bjp opposed power sold contribution , ” former prime minister said. rejecting criticism “policy paralysis ” upa , said government left , india second fastest growing economy world noted “fragileness ” economic recovery current dispensation. bjp leaders also raked charges levelled singh ’ cabinet colleague jayanthi natarajan , expelled congress , arrest telecom minister raja attack him. said modi dispensation successfully reconstructing economy broken upa rule. — pti","{'bjp': 11, 'cong': 5}",5,11,0.05493647656691136
2015-05-29,ex-coal secy concealed facts from then pm: cbi,"new delhi, may 29 the cbi today told a special court that former coal secretary h.c. gupta had allegedly concealed facts from then prime minister manmohan singh that jharkhand had not recommended vini iron and steel udyog ltd (visul) for allocation of a chhattisgarh coal block. during arguments on framing of charges in the case involving gupta, former jharkhand chief minister madhu koda and others, the cbi said the top official was aware that the state government had not recommended the coal block to visul but he did not mention this in the file noting sent to the office of the prime minister, who then headed the coal ministry too. “gupta did not highlight in the file sent to the minister of coal (singh) that visul was not recommended by the state government but a.k. basu (then chief secretary of jharkhand and an accused in the case) had insisted in the meeting of screening committee that visul should be given the block,” senior public prosecutor v.k. sharma told special cbi judge bharat parashar. the prosecutor further said, “he (gupta) did not write it in the file. gupta did not mention it in the noting sent to the minister of coal. he concealed this fact from the minister of coal.” gupta on may 27 had argued that singh, being the then coal minister, had the ultimate power to allocate coal block. ; during arguments today, the agency said that koda, basu and two other accused public servants conspired with each other to somehow favour visul in the coal block allocation despite the fact that the state government had initially recommended two other firms for it. it alleged that basu, who had attended the meeting of screening committee, insisted that visul should be recommended for the allocation. the prosecutor said that even the steel ministry had not recommended visul for rajhara north coal block allocation. some of the accused, however, opposed the contentions of the cbi saying there was no evidence against them. the court after hearing the arguments fixed the matter for june 30 for any clarification. the case pertains to alleged irregularities in allocation of rajhara north coal block in jharkhand to kolkata-based visul. — pti ",ex-coal secy concealed facts pm : cbi,"new delhi , may 29 cbi today told special court former coal secretary h.c. gupta allegedly concealed facts prime minister manmohan singh jharkhand recommended vini iron steel udyog ltd ( visul ) allocation chhattisgarh coal block. arguments framing charges case involving gupta , former jharkhand chief minister madhu koda others , cbi said top official aware state government recommended coal block visul mention file noting sent office prime minister , headed coal ministry too. “gupta highlight file sent minister coal ( singh ) visul recommended state government a.k. basu ( chief secretary jharkhand accused case ) insisted meeting screening committee visul given block , ” senior public prosecutor v.k. sharma told special cbi judge bharat parashar. prosecutor said , “he ( gupta ) write file. gupta mention noting sent minister coal. concealed fact minister coal. ” gupta may 27 argued singh , coal minister , ultimate power allocate coal block. ; arguments today , agency said koda , basu two accused public servants conspired somehow favour visul coal block allocation despite fact state government initially recommended two firms it. alleged basu , attended meeting screening committee , insisted visul recommended allocation. prosecutor said even steel ministry recommended visul rajhara north coal block allocation. accused , however , opposed contentions cbi saying evidence them. court hearing arguments fixed matter june 30 clarification. case pertains alleged irregularities allocation rajhara north coal block jharkhand kolkata-based visul. — pti","{'bjp': 0, 'cong': 0}",0,0,0.05398154477101844
