Date,Title,Article,Sentiment,clean title,clean article,polarity,cong,bjp
2013-02-25,chopper scam: india within its right to request italian probe documents according to a un convention,"india can gain access to the certified copies of the documents on the italian probe into the alleged payment of kickbacks by agustawestland to bag the rs 3,600crore vvip chopper deal since it is a signatory to the united nations convention against corruption, 2003.this is the belief expressed by carlo bennusi, associate professor, criminal and commercial law at milan university. ""if india ratifies the 2003 un international treaty against corruption (which it has already done) then under article 46 it can request the documents in keeping with the protocol,"" bennusi said.eye on the casehe said a judicial authority in india can make a request for the documents to a judicial authority of equivalent stature in italy. the prosecutor in the case has the power to say 'yes' or 'no' to releasing the documents. bennusi went on to explain that even if the prosecutor says no, he is obliged to provide a summary of the fact sheet of the details of the case.the professor said in order to add more weight to the demand, india can make the request official by approaching the organisation for international co-operation and development (oecd).india is one of the many nonmember economies with which the oecd has working relationships in addition to its member countries. the last resort, bennusi said, is, of course, the foreign ministry of italy. ""the cbi team that came to milan had met the foreign ministry officials who assured all cooperation in the matter,"" he said.the indian government has argued that it needs the classified documents because it would not be possible to base a judicial inquiry on the basis of the excerpts from the so-called '64page' document available with the media.the italian authorities have denied india access to the documents because it is based on preliminary investigation. in italy, preliminary investigations are bound by a confidentiality clause.luca labianca, the judge in the case, explained how the clause applies to preliminary investigation in the country. ""in italy a preliminary probe is initiated by a public prosecutor. the prosecutor aims to find the truth that could lead to conviction of the accused as well as his acquittal,"" he said. ""the interrogation of the accused by the prosecutor happens under the supervision of a judge? the judge of a such an investigation seldom intervenes. one of his main duties is to safeguard the rights of the defendant/accused if infringed,"" labianca added.the preliminary investigation is concluded by the submission of a report by the prosecutor to the judge.if the charges are found to be valid then the accused/defendant is called for a hearing. at this stage all documents and information associated with the case is public.different actions asked as to why giuseppe orsi, former chairman of finmeccanica was in detention while bruno spagnolini, former ceo of agustawestland, was under house arrest, labianca said: ""there is surely strong evidence against him (orsi) and thus the detention. orsi's lawyer ennio amodio had told me that this is done if the judicial authority thinks that the accused can escape or tamper with evidence.""",0.017391304347826084,chopper scam : india within right request italian probe documents according un convention,"india gain access certified copies documents italian probe alleged payment kickbacks agustawestland bag rs 3,600crore vvip chopper deal since signatory united nations convention corruption , 2003.this belief expressed carlo bennusi , associate professor , criminal commercial law milan university. "" india ratifies 2003 un international treaty corruption ( already done ) article 46 request documents keeping protocol , "" bennusi said.eye casehe said judicial authority india make request documents judicial authority equivalent stature italy. prosecutor case power say ' yes ' ' ' releasing documents. bennusi went explain even prosecutor says , obliged provide summary fact sheet details case.the professor said order add weight demand , india make request official approaching organisation international co-operation development ( oecd ) .india one many nonmember economies oecd working relationships addition member countries. last resort , bennusi said , , course , foreign ministry italy. "" cbi team came milan met foreign ministry officials assured cooperation matter , "" said.the indian government argued needs classified documents would possible base judicial inquiry basis excerpts so-called ' 64page ' document available media.the italian authorities denied india access documents based preliminary investigation. italy , preliminary investigations bound confidentiality clause.luca labianca , judge case , explained clause applies preliminary investigation country. "" italy preliminary probe initiated public prosecutor. prosecutor aims find truth could lead conviction accused well acquittal , "" said. "" interrogation accused prosecutor happens supervision judge ? judge investigation seldom intervenes. one main duties safeguard rights defendant/accused infringed , "" labianca added.the preliminary investigation concluded submission report prosecutor judge.if charges found valid accused/defendant called hearing. stage documents information associated case public.different actions asked giuseppe orsi , former chairman finmeccanica detention bruno spagnolini , former ceo agustawestland , house arrest , labianca said : "" surely strong evidence ( orsi ) thus detention. orsi ' lawyer ennio amodio told done judicial authority thinks accused escape tamper evidence . ""","{'bjp': 0, 'cong': 0}",0,0
2013-02-26,vvip chopper scam: govt gets first set of documents from italy," the indian government has received the first set of official documents from italy in connection with the vvip chopper scam including the warrants issued against former finmeccanica ceo giuseppe orsi by authorities there.the documents are expected to fast-track the indian investigations into the bribery allegations in the rs 3,600 crore deal for 12 aw-101 choppers, highly-placed government sources said here.the receipt of these documents is expected to boost efforts to go to the root of the alleged scam amid defence minister a k antony's keenness to ensure that the truth is brought out expeditiously.so far, indian investigations into the case have been stuck in absence of official documents as the italian court had refused to share it with india citing italian laws.however, the government is yet to officially receive the preliminary investigation report filed by the italian prosecutors in the court of busto arsizio, they said.the search warrant against orsi is understood to have details about the alleged payment of kickbacks to middlemen engaged by him to swing the deal in favour of his firm.orsi had allegedly hired guido heschke and christian michel for bagging the deal. the two were allegedly in touch with the three cousins of former iaf chief s p tyagi and they all have already been interrogated by the cbi.antony had told the rajya sabha that the truth in the case would come out soon with the two parallel investigations going on in italy and india.the minister and his team including defence secretary shashikant sharma are working in this direction and are offering full cooperation to the cbi in its probe.soon after the arrest of orsi on february 18 in italy, antony had ordered a cbi inquiry into the case and the ministry had dispatched a one-member team including joint secretary and acquisition manager arun kumar bal to milan to get ""as much evidence as possible"".",0.011874999999999995,vvip chopper scam : govt gets first set documents italy,"indian government received first set official documents italy connection vvip chopper scam including warrants issued former finmeccanica ceo giuseppe orsi authorities there.the documents expected fast-track indian investigations bribery allegations rs 3,600 crore deal 12 aw-101 choppers , highly-placed government sources said here.the receipt documents expected boost efforts go root alleged scam amid defence minister k antony ' keenness ensure truth brought expeditiously.so far , indian investigations case stuck absence official documents italian court refused share india citing italian laws.however , government yet officially receive preliminary investigation report filed italian prosecutors court busto arsizio , said.the search warrant orsi understood details alleged payment kickbacks middlemen engaged swing deal favour firm.orsi allegedly hired guido heschke christian michel bagging deal. two allegedly touch three cousins former iaf chief p tyagi already interrogated cbi.antony told rajya sabha truth case would come soon two parallel investigations going italy india.the minister team including defence secretary shashikant sharma working direction offering full cooperation cbi probe.soon arrest orsi february 18 italy , antony ordered cbi inquiry case ministry dispatched one-member team including joint secretary acquisition manager arun kumar bal milan get "" much evidence possible "" .","{'bjp': 0, 'cong': 0}",0,0
2013-03-07,vvip chopper scam: cbi freezes bank account of ex-iaf chief sp tyagi ," cbi has frozen bank accounts of former indian air force chief s p tyagi and other indians named as accused for allegedly receiving kickbacks in the rs 3,600 crore vvip helicopter deal.agency sources said here today that ""certain bank accounts of all the indian accused"" named in the fir have been frozen by cbi.the bank accounts of indian companies named in the alleged scam - aeromatrix info solutions private limited and ids infotech - have already been frozen by the agency, they said.the sources said bank accounts of tyagi's cousins - sanjeev alias julie, rajeev alias docsa and sandeep - have also been frozen as part of the investigation.other indians named in the fir whose accounts have been frozen by the agency include former union minister santosh bagrodia's brother satish bagrodia, who is also chairman of ids infotech, the company's managing director pratap aggarwal, aeromatrix ceo praveen bakshi and legal advisor gautam khaitan, the sources said.cbi in its fir has booked all the accused under the provisions of the ipc relating to cheating and criminal conspiracy and the prevention of corruption act.tyagi is the first chief of the indian air force to be named in a corruption or criminal case by cbi.cbi has alleged that during his tenure as air chief, tyagi and ""with his approval"" the air force ""conceded to reduce the service ceiling for vvip helicopters from 6000 meters to 4500 meters as mandatory to which it was opposing vehemently on the grounds of security constraints and other related reasons"".according to the fir, ""haschke guido and gerosa carlo (middlemen) managed to send euro 5.6 million through mohali-based ids infotech and chandigarh-based aeromatrix info solutions private limited to india and kept the remaining amount out of about euro 24.30 million received from agustawestland with themselves in the account of ids tunisia"".",-0.04873949579831933,vvip chopper scam : cbi freezes bank account ex-iaf chief sp tyagi,"cbi frozen bank accounts former indian air force chief p tyagi indians named accused allegedly receiving kickbacks rs 3,600 crore vvip helicopter deal.agency sources said today "" certain bank accounts indian accused "" named fir frozen cbi.the bank accounts indian companies named alleged scam - aeromatrix info solutions private limited ids infotech - already frozen agency , said.the sources said bank accounts tyagi ' cousins - sanjeev alias julie , rajeev alias docsa sandeep - also frozen part investigation.other indians named fir whose accounts frozen agency include former union minister santosh bagrodia ' brother satish bagrodia , also chairman ids infotech , company ' managing director pratap aggarwal , aeromatrix ceo praveen bakshi legal advisor gautam khaitan , sources said.cbi fir booked accused provisions ipc relating cheating criminal conspiracy prevention corruption act.tyagi first chief indian air force named corruption criminal case cbi.cbi alleged tenure air chief , tyagi "" approval "" air force "" conceded reduce service ceiling vvip helicopters 6000 meters 4500 meters mandatory opposing vehemently grounds security constraints related reasons "" .according fir , "" haschke guido gerosa carlo ( middlemen ) managed send euro 5.6 million mohali-based ids infotech chandigarh-based aeromatrix info solutions private limited india kept remaining amount euro 24.30 million received agustawestland account ids tunisia "" .","{'bjp': 0, 'cong': 0}",0,0
2013-03-07,vvip chopper scam: cbi freezes bank account of ex-iaf chief sp tyagi ," cbi has frozen bank accounts of former indian air force chief s p tyagi and other indians named as accused for allegedly receiving kickbacks in the rs 3,600 crore vvip helicopter deal.agency sources said here today that ""certain bank accounts of all the indian accused"" named in the fir have been frozen by cbi.the bank accounts of indian companies named in the alleged scam - aeromatrix info solutions private limited and ids infotech - have already been frozen by the agency, they said.the sources said bank accounts of tyagi's cousins - sanjeev alias julie, rajeev alias docsa and sandeep - have also been frozen as part of the investigation.other indians named in the fir whose accounts have been frozen by the agency include former union minister santosh bagrodia's brother satish bagrodia, who is also chairman of ids infotech, the company's managing director pratap aggarwal, aeromatrix ceo praveen bakshi and legal advisor gautam khaitan, the sources said.cbi in its fir has booked all the accused under the provisions of the ipc relating to cheating and criminal conspiracy and the prevention of corruption act.tyagi is the first chief of the indian air force to be named in a corruption or criminal case by cbi.cbi has alleged that during his tenure as air chief, tyagi and ""with his approval"" the air force ""conceded to reduce the service ceiling for vvip helicopters from 6000 meters to 4500 meters as mandatory to which it was opposing vehemently on the grounds of security constraints and other related reasons"".according to the fir, ""haschke guido and gerosa carlo (middlemen) managed to send euro 5.6 million through mohali-based ids infotech and chandigarh-based aeromatrix info solutions private limited to india and kept the remaining amount out of about euro 24.30 million received from agustawestland with themselves in the account of ids tunisia"".",-0.04873949579831933,vvip chopper scam : cbi freezes bank account ex-iaf chief sp tyagi,"cbi frozen bank accounts former indian air force chief p tyagi indians named accused allegedly receiving kickbacks rs 3,600 crore vvip helicopter deal.agency sources said today "" certain bank accounts indian accused "" named fir frozen cbi.the bank accounts indian companies named alleged scam - aeromatrix info solutions private limited ids infotech - already frozen agency , said.the sources said bank accounts tyagi ' cousins - sanjeev alias julie , rajeev alias docsa sandeep - also frozen part investigation.other indians named fir whose accounts frozen agency include former union minister santosh bagrodia ' brother satish bagrodia , also chairman ids infotech , company ' managing director pratap aggarwal , aeromatrix ceo praveen bakshi legal advisor gautam khaitan , sources said.cbi fir booked accused provisions ipc relating cheating criminal conspiracy prevention corruption act.tyagi first chief indian air force named corruption criminal case cbi.cbi alleged tenure air chief , tyagi "" approval "" air force "" conceded reduce service ceiling vvip helicopters 6000 meters 4500 meters mandatory opposing vehemently grounds security constraints related reasons "" .according fir , "" haschke guido gerosa carlo ( middlemen ) managed send euro 5.6 million mohali-based ids infotech chandigarh-based aeromatrix info solutions private limited india kept remaining amount euro 24.30 million received agustawestland account ids tunisia "" .","{'bjp': 0, 'cong': 0}",0,0
2013-03-07,"cbi set to book former iaf chief sp tyagi in vvip chopper scam, a shameful first for the armed forces"," the central bureau of investigation (cbi) is all set to name former air chief s.p. tyagi and 10 others in a regular complaint (rc), the agency's version of a first information report (fir), as the next major step in its probe of the augusta westland helicopter deal.sources say that the former air chief will face charges of criminal misconduct by a public servant under the prevention of corruption act (pca) for his alleged role in the rs 3,600-crore deal to purchase 12 vvip helicopters.this will be the first time that a former service chief will be charged with corruption. the fir is expected to be filed next week by the agency.tyagi, an accomplished fighter pilot and a veteran of the 1965 and 1971 wars, commanded three crucial commands of the indian air force before becoming the chief of air staff.besides tyagi, the agency's rc is likely to name his cousins sanjeev aka julie tyagi, docsa tyagi, sandeep tyagi, gautam khaitan (who was formerly associated with aeromatrix info solutions (p) limited) and praveen bakshi. others likely to be named include giuseppe orsi, former ceo of italian defence major finmeccanica; bruno spagnolini, ceo of agustawestland, a britain-based subsidiary of finmeccanica; and alleged middlemen guido ralph haschke, carlo gerosa and christian michel.the firms named are finmeccanica, agustawestland, ids infotech ltd (india) and aeromatrix info solutions pvt ltd (india).the foreigners named in the rc will face charges under the pca.sources say the decision to go ahead with a rc follows the treasure trove of information uncovered by the cbi officials from italy, and the questioning of the accused. sources told mail today that the former air chief was grilled for almost seven hours on wednesday, describing him as ""evasive"" during the questioning by cbi officials.tyagi is believed to have blamed the special protection group, the arm of the national security guard that is tasked with vip security, for the change of specifications that allowed the entry of agustawestland in the bidding process.disassociating himself from the change in specifications, tyagi told cbi officials that the change was guided by the users, and the purchase decision was taken by the government. he also tried to distance himself from his cousins.cbi officials, however, claim that the money trail has been tracked and they have conclusive evidence. ""we have evidence that tyagi was instrumental in getting agustawestland into the deal. the change of specification was critical,"" a senior official told mail today.noose tightenssources say the rc details are being worked out and some other sections may also be invoked once the preliminary enquiry is completed.sources say the cbi case is watertight and director ranjit sinha is keen to send out a message that the agency will conduct an impartial inquiry without being influenced by anyone.cbi officials say julie and docsa tyagi have been quizzed on their alleged association with european middlemen gerosa and haschke who have been accused by the italian investigators of making illegal payments to swing the deal in favour of agustawestland.sources said the cbi has already questioned executives of the indian arms of aeromatrix and ids infotech - the companies through which the alleged bribes were routed from mauritius and tunisia in the garb of payments for engineering contracts.the italian probe in finmeccanica says that gerosa and haschke had close contacts with the former air chief 's family, particularly his three cousins - julie, docsa and sandeep.it had claimed that haschke and gerosa, through the tyagi brothers, managed to change the tender details, modifying the 'operational ceiling' of the copter from 18,000 feet to 15,000 feet, thus making agustawestland eligible to bid. it is here that the agency believes that the air chief played a key role to get the company the contract.the report further said that the two also managed to introduce a comparative flight trial with a non-functional engine, thus facilitating agustawestland helicopters, the only one with three engines - thus swinging the deal in its favour.",-0.0022702104097452928,"cbi set book former iaf chief sp tyagi vvip chopper scam , shameful first armed forces","central bureau investigation ( cbi ) set name former air chief s.p. tyagi 10 others regular complaint ( rc ) , agency ' version first information report ( fir ) , next major step probe augusta westland helicopter deal.sources say former air chief face charges criminal misconduct public servant prevention corruption act ( pca ) alleged role rs 3,600-crore deal purchase 12 vvip helicopters.this first time former service chief charged corruption. fir expected filed next week agency.tyagi , accomplished fighter pilot veteran 1965 1971 wars , commanded three crucial commands indian air force becoming chief air staff.besides tyagi , agency ' rc likely name cousins sanjeev aka julie tyagi , docsa tyagi , sandeep tyagi , gautam khaitan ( formerly associated aeromatrix info solutions ( p ) limited ) praveen bakshi. others likely named include giuseppe orsi , former ceo italian defence major finmeccanica ; bruno spagnolini , ceo agustawestland , britain-based subsidiary finmeccanica ; alleged middlemen guido ralph haschke , carlo gerosa christian michel.the firms named finmeccanica , agustawestland , ids infotech ltd ( india ) aeromatrix info solutions pvt ltd ( india ) .the foreigners named rc face charges pca.sources say decision go ahead rc follows treasure trove information uncovered cbi officials italy , questioning accused. sources told mail today former air chief grilled almost seven hours wednesday , describing "" evasive "" questioning cbi officials.tyagi believed blamed special protection group , arm national security guard tasked vip security , change specifications allowed entry agustawestland bidding process.disassociating change specifications , tyagi told cbi officials change guided users , purchase decision taken government. also tried distance cousins.cbi officials , however , claim money trail tracked conclusive evidence. "" evidence tyagi instrumental getting agustawestland deal. change specification critical , "" senior official told mail today.noose tightenssources say rc details worked sections may also invoked preliminary enquiry completed.sources say cbi case watertight director ranjit sinha keen send message agency conduct impartial inquiry without influenced anyone.cbi officials say julie docsa tyagi quizzed alleged association european middlemen gerosa haschke accused italian investigators making illegal payments swing deal favour agustawestland.sources said cbi already questioned executives indian arms aeromatrix ids infotech - companies alleged bribes routed mauritius tunisia garb payments engineering contracts.the italian probe finmeccanica says gerosa haschke close contacts former air chief ' family , particularly three cousins - julie , docsa sandeep.it claimed haschke gerosa , tyagi brothers , managed change tender details , modifying ' operational ceiling ' copter 18,000 feet 15,000 feet , thus making agustawestland eligible bid. agency believes air chief played key role get company contract.the report said two also managed introduce comparative flight trial non-functional engine , thus facilitating agustawestland helicopters , one three engines - thus swinging deal favour .","{'bjp': 0, 'cong': 0}",0,0
