Date,Title,Article,Sentiment,clean title,clean article,polarity,cong,bjp
2014-02-05,authenticity of vvip chopper deal notes not proved: antony,"defence minister a.k. antonydefence minister a.k. antony on wednesday said certain notes have come to light suggesting that middlemen in the vvip chopper deal were trying to target certain indian leaders but their authenticity is ""not proved"".he was making a suo motu statement in rajya sabha on the agustawestland chopper scam after a note received from italy suggested that one of the middlemen christian michel had written to an agustawestland official in india to ask a 'high commissioner' to target upa chairman sonia gandhi and her close advisers ahmed patel, pranab mukherjee, veerappa moily.""there is another unsigned document purported to be written by mr christian to the attention of one mr peter hullet for high commissioner to target certain indian leaders. the authenticity of these documents is not proved. the case is presently in italian court,"" antony said.on the hearings in an italian court, he said one unsigned handwritten paper has been produced which has headings ""af, bur, pol (under which ap is recorded), fam etc and guido hashcke, from whom this document has been recovered, has been cross-examined on this.""the defence minister said transcript of this cross- examination of haschke was received by his ministry.""haschke, in response to a specific question by the italian public prosecutor as to the meaning of fam, he replied that fam is family. in reply to another question, he stated ""... due to the family, that is to the tyagi brothers.""antony said when haschke was asked about ap, he said, ""i don't know what it means.""he said based on documents and other relevant evidences available with the government, the contract for the supply of 12 vvip choppers was cancelled on january 1 on grounds of breach of provisions of pre-integrity pact.",0.10626984126984126,authenticity vvip chopper deal notes proved : antony,"defence minister a.k. antonydefence minister a.k. antony wednesday said certain notes come light suggesting middlemen vvip chopper deal trying target certain indian leaders authenticity "" proved "" .he making suo motu statement rajya sabha agustawestland chopper scam note received italy suggested one middlemen christian michel written agustawestland official india ask ' high commissioner ' target upa chairman sonia gandhi close advisers ahmed patel , pranab mukherjee , veerappa moily. "" another unsigned document purported written mr christian attention one mr peter hullet high commissioner target certain indian leaders. authenticity documents proved. case presently italian court , "" antony said.on hearings italian court , said one unsigned handwritten paper produced headings "" af , bur , pol ( ap recorded ) , fam etc guido hashcke , document recovered , cross-examined this. "" defence minister said transcript cross- examination haschke received ministry. "" haschke , response specific question italian public prosecutor meaning fam , replied fam family. reply another question , stated "" ... due family , tyagi brothers. "" antony said haschke asked ap , said , "" ' know means. "" said based documents relevant evidences available government , contract supply 12 vvip choppers cancelled january 1 grounds breach provisions pre-integrity pact .","{'bjp': 0, 'cong': 0}",0,0
2014-03-02,antony orders cbi probe in bribe charges in aircraft engine deal,"defence minister ak antony has ordered a cbi probe into allegations that a global engine manufacturing firm had paid bribes to indian defence officials to bag military contracts from 2007 to 2011 in deals worth over rs 10,000 crore.the allegations surfaced in the form of a letter received by hindustan aeronautics limited (hal) recently claiming that bribes were paid to officials in hal and other departments concerned to bag contracts, highly-placed government sources told pti here.hal immediately initiated an inquiry into the charges through its chief vigilance officer, which has found credence in the charges. the firm in question has supplied engines for the aircraft being manufactured by the hal for the indian air force, they said.the investigations by the hal, cvo have prima facie found that the company allegedly violated several of the contractual obligations with hal between the period of 2007-11, when these bribes were allegedly paid, they said.the issue came to light after hal issued queries to its vendors and suppliers to ensure probity in its transactions as part of its integrity pact to be signed with them, they said.after the case with the findings and recommendations of the hal,cvo was brought to the notice of defence minister, antony ordered that the case be handed over to cbi for further investigations, the sources said.after the development, iaf's several programmes are expected to get delayed but the defence ministry is firm that it would not allow any corruption to take place in its procurement process and would take strict action even if it means delays in some of the projects.the firm concerned could not be contacted for its response on the issue.antony has been prompt in ordering inquiries into defence deals even if the complaints are received from anonymous sources to avoid and eradicate corruption in military purchases.the defence minister took stern action against the charges of bribery made in the agustawestland chopper scam by cancelling the deal on january 1 this year after it was allegedly found that the firm had violated the pre-integrity pact of the defence ministry meant for ensuring probity in defence deals.in his tenure of more than eight years, the defence minister has handed over around 100 cases of alleged corruption to cbi for investigations.",-0.020684523809523802,antony orders cbi probe bribe charges aircraft engine deal,"defence minister ak antony ordered cbi probe allegations global engine manufacturing firm paid bribes indian defence officials bag military contracts 2007 2011 deals worth rs 10,000 crore.the allegations surfaced form letter received hindustan aeronautics limited ( hal ) recently claiming bribes paid officials hal departments concerned bag contracts , highly-placed government sources told pti here.hal immediately initiated inquiry charges chief vigilance officer , found credence charges. firm question supplied engines aircraft manufactured hal indian air force , said.the investigations hal , cvo prima facie found company allegedly violated several contractual obligations hal period 2007-11 , bribes allegedly paid , said.the issue came light hal issued queries vendors suppliers ensure probity transactions part integrity pact signed , said.after case findings recommendations hal , cvo brought notice defence minister , antony ordered case handed cbi investigations , sources said.after development , iaf ' several programmes expected get delayed defence ministry firm would allow corruption take place procurement process would take strict action even means delays projects.the firm concerned could contacted response issue.antony prompt ordering inquiries defence deals even complaints received anonymous sources avoid eradicate corruption military purchases.the defence minister took stern action charges bribery made agustawestland chopper scam cancelling deal january 1 year allegedly found firm violated pre-integrity pact defence ministry meant ensuring probity defence deals.in tenure eight years , defence minister handed around 100 cases alleged corruption cbi investigations .","{'bjp': 0, 'cong': 0}",0,0
2015-06-24,"agustawestland chopper scam: no corruption by ex-iaf chief sp tyagi, says italian court","in a major twist in the upa government's biggest defence kickback scam, an italian court has said that it has found no evidence of corruption by former indian air force chief air chief marshal sp tyagi. the scandal had rocked the then manmohan singh government to its very core. now, with the italian court giving a clean chit to sp tyagi, certain questions would certainly be asked and most shattering of them is: was there really a scam at all?india today has exclusive access to the 145 page final judgement of the italian court from which the entire story began in the first place. an october 2014 judgement that hasn't seen the light of day till now, categorically states that there were no kickbacks. it firmly acquits tyagi, the chief accused.the italian court's final verdict, a copy of which is with india today, said no corruption was found in italian company agustawestland's chopper deal with the indian air force. the trial in italy centred on corruption allegations against finmeccanica in the rs 3,600 crore deal. its british unit, agustawestland, was contracted by india in 2010 to supply 12 high-end helicopters.the verdict by the italy court has brought relief for the former air force chief. tyagi, who is also being investigated by the cbi, however, told india today tv that till the time the probe in india is on, he is an accused in the case. ""i am an accused till the probe is on,"" tyagi said, adding, ""i want to tell you, this trial by media has to stop.""meanwhile, the cbi is also likely to close the probe into alleged kickbacks scam after the italy court's verdict. time has come full circle since the rs 3,600 crore contract was scrapped two years ago after italian prosecutors got the whiff of corruption in the dealings of the top executives of finmeccanica, the parent company of anglo-italian agustawestland.the case in italy was closed last year and its obvious ramifications were felt in india where the cbi struggled to move in the absence of evidence despite booking a host of individuals including former iaf chief sp tyagi and his cousins among others who allegedly took money to swing the deal in favour of the helicopter-maker.india has recovered more than what it paid, around rs 1,800 crore, as the first installment for the contract. three of the 12 helicopters that were delivered have been gathering dust at iaf's palam air base in delhi.the iaf is only the custodian of these tri-engine helicopters and its manufacturer has gone into arbitration to settle the dispute. the pilots who were trained to fly these helicopters have returned to other assignments. the iaf has drawn out six newly acquired mi-17v5 helicopters for vvip use",0.08991286491286489,"agustawestland chopper scam : corruption ex-iaf chief sp tyagi , says italian court","major twist upa government ' biggest defence kickback scam , italian court said found evidence corruption former indian air force chief air chief marshal sp tyagi. scandal rocked manmohan singh government core. , italian court giving clean chit sp tyagi , certain questions would certainly asked shattering : really scam all?india today exclusive access 145 page final judgement italian court entire story began first place. october 2014 judgement ' seen light day till , categorically states kickbacks. firmly acquits tyagi , chief accused.the italian court ' final verdict , copy india today , said corruption found italian company agustawestland ' chopper deal indian air force. trial italy centred corruption allegations finmeccanica rs 3,600 crore deal. british unit , agustawestland , contracted india 2010 supply 12 high-end helicopters.the verdict italy court brought relief former air force chief. tyagi , also investigated cbi , however , told india today tv till time probe india , accused case. "" accused till probe , "" tyagi said , adding , "" want tell , trial media stop. "" meanwhile , cbi also likely close probe alleged kickbacks scam italy court ' verdict. time come full circle since rs 3,600 crore contract scrapped two years ago italian prosecutors got whiff corruption dealings top executives finmeccanica , parent company anglo-italian agustawestland.the case italy closed last year obvious ramifications felt india cbi struggled move absence evidence despite booking host individuals including former iaf chief sp tyagi cousins among others allegedly took money swing deal favour helicopter-maker.india recovered paid , around rs 1,800 crore , first installment contract. three 12 helicopters delivered gathering dust iaf ' palam air base delhi.the iaf custodian tri-engine helicopters manufacturer gone arbitration settle dispute. pilots trained fly helicopters returned assignments. iaf drawn six newly acquired mi-17v5 helicopters vvip use","{'bjp': 0, 'cong': 0}",0,0
2016-04-27,"sonia gandhi on vvip chopper scam: not afraid, what was the government doing for 2 years?","parliament has been paralysed for the third consecutive day today by the agustawestland chopper scam as both government and opposition trading charges.there were angry exchanges between opposition congress and ruling bjp members over subramaniam swamy seeking to drag sonia gandhi's name in the controversial agustawestland helicopter contract bribery case that led to adjournments of the rajya sabha.however, gandhi's name was later expunged by deputy chairman p j kurien. ""the name of the member of the other house can't be taken. since this is your (swamy's)first day, i am not admonishing you. but the name would be expunged,"" kurien said.but congress president sonia gandhi was quick to react and rejected all the charges.sonia gandhi said she was ""not afraid"" of any inquiry into the agusta westland chopper deal.asserting that she is not ""afraid"" of being ""cornered"" on the issue, she asked the government what it has been doing in power for the last two years and demanded that the ongoing inquiry be completed impartially.""i am not afraid of anyone cornering me as there is no basis to that. all the accusations they are throwing at us are false,"" gandhi told reporters in parliament complex as bjp sought to target her on the deal.""where are the proofs. they are lying. they are part of a strategy of character assassination which we have known these people indulge in,"" gandhi said.the rs 3,600-crore deal for 12 vvip choppers was cancelled by india in 2014 after the italian agencies began investigating it.also read parliament live updates",0.03297979797979797,"sonia gandhi vvip chopper scam : afraid , government 2 years ?","parliament paralysed third consecutive day today agustawestland chopper scam government opposition trading charges.there angry exchanges opposition congress ruling bjp members subramaniam swamy seeking drag sonia gandhi ' name controversial agustawestland helicopter contract bribery case led adjournments rajya sabha.however , gandhi ' name later expunged deputy chairman p j kurien. "" name member house ' taken. since ( swamy ' ) first day , admonishing you. name would expunged , "" kurien said.but congress president sonia gandhi quick react rejected charges.sonia gandhi said "" afraid "" inquiry agusta westland chopper deal.asserting "" afraid "" "" cornered "" issue , asked government power last two years demanded ongoing inquiry completed impartially. "" afraid anyone cornering basis that. accusations throwing us false , "" gandhi told reporters parliament complex bjp sought target deal. "" proofs. lying. part strategy character assassination known people indulge , "" gandhi said.the rs 3,600-crore deal 12 vvip choppers cancelled india 2014 italian agencies began investigating it.also read parliament live updates","{'bjp': 2, 'cong': 2}",2,2
2016-04-27,what is agustawestland chopper deal? why is sonia gandhi under attack for it?,"rajya sabha saw much ruckus today after bjp mp subramanian swamy pointed out congress president sonia gandhi's alleged involvement in the court proceedings of the agusta westland chopper scam in italy.as the bjp is expected to raise the issue yet again in the next rajya sabha proceeding, here is all you need to know about the 2013 indian helicopter bribery scandal or the vvip agustawestland chopper deal:exclusive: agustawestland middleman christian michel speaks to india todaywhat is the agustawestland chopper deal?in february 2010, the congress-led upa government had signed a contract with uk-based helicopter manufacturing company agustawestland to purchase 12 aw101 helicopters for the indian air force for rs 3,600 crore.these choppers were supposed to be used for flying the president of india, the prime minister, and other such vvips.why was the deal dropped?in february 2013, italian police arrested agusta westland ceo bruno spagnolini and guiseppe orsi, chairman of agustawestland's parent company finmeccanica, on charges of paying bribes to win the vvip chopper deal with the indian air force.this led to the upa government putting a hold on the deal, as the then defence minister ak antony ordered a cbi probe into the matter.in 2014, the upa government cancelled the deal with agustawestland on grounds of the integrity pact being violated. most of the money paid for the deal is said to have been recovered.why is the bjp attacking sonia gandhi over it?in its 225-page judgment, the italian court of appeals addresses several conversations which took place among three middlemen involved in this deal: carlos gerosa, christian michel and guildo haschke.these conversations have mentions of ""mrs gandhi"" being the ""driving force behind the vip"", and she and her ""closest advisers"" (ahmed patel and pranab mukherjee) being ""the aim of the british high commissioner"".what is the congress defence?countering the attack by bjp in the rajya sabha, congress president sonia gandhi told reporters that the party has ""nothing to hide"". as to her name being pointed out, gandhi said she is ""not afraid"".""we have nothing to hide. let them take my name, i am not afraid,"" she said. ""this government has been in power for two years now, why didn't they complete the inquiry?""the congress also alleges a deal was struck between prime minister narendra modi and his italian counterpart over allowing italian marine accused of killing indian fishermen to go back home in exchange for information on the choppergate.the bjp has rejected the allegation, saying no such meeting took place between the two leaders.who is sp tyagi? what is his connection to the vvip chopper deal?air chief marshal sp tyagi, the former indian air force chief, is being accused of having tweaked with the altitude requirements in favour of agustawestland winning the vvip chopper deal.prior to tyagi becoming the air force chief, the iaf is said to have opposed purchasing agustawestland's aw101 as they were not capable of flying in high-altitude areas like siachen and tiger hill.however, once tyagi was appointed as the chief, the iaf ""conceded to reduce"" the altitude requirements, hence, bringing agustawestland back into the race for the chopper deal.the italian court of appeals judgement says there are ""unmistakable indications regarding corruption of an indian officer"", identified as a cousin of tyagi, therefore, implying tyagi being involved in the scam.",0.08568965517241381,agustawestland chopper deal ? sonia gandhi attack ?,"rajya sabha saw much ruckus today bjp mp subramanian swamy pointed congress president sonia gandhi ' alleged involvement court proceedings agusta westland chopper scam italy.as bjp expected raise issue yet next rajya sabha proceeding , need know 2013 indian helicopter bribery scandal vvip agustawestland chopper deal : exclusive : agustawestland middleman christian michel speaks india todaywhat agustawestland chopper deal?in february 2010 , congress-led upa government signed contract uk-based helicopter manufacturing company agustawestland purchase 12 aw101 helicopters indian air force rs 3,600 crore.these choppers supposed used flying president india , prime minister , vvips.why deal dropped?in february 2013 , italian police arrested agusta westland ceo bruno spagnolini guiseppe orsi , chairman agustawestland ' parent company finmeccanica , charges paying bribes win vvip chopper deal indian air force.this led upa government putting hold deal , defence minister ak antony ordered cbi probe matter.in 2014 , upa government cancelled deal agustawestland grounds integrity pact violated. money paid deal said recovered.why bjp attacking sonia gandhi it?in 225-page judgment , italian court appeals addresses several conversations took place among three middlemen involved deal : carlos gerosa , christian michel guildo haschke.these conversations mentions "" mrs gandhi "" "" driving force behind vip "" , "" closest advisers "" ( ahmed patel pranab mukherjee ) "" aim british high commissioner "" .what congress defence?countering attack bjp rajya sabha , congress president sonia gandhi told reporters party "" nothing hide "" . name pointed , gandhi said "" afraid "" . "" nothing hide. let take name , afraid , "" said. "" government power two years , ' complete inquiry ? "" congress also alleges deal struck prime minister narendra modi italian counterpart allowing italian marine accused killing indian fishermen go back home exchange information choppergate.the bjp rejected allegation , saying meeting took place two leaders.who sp tyagi ? connection vvip chopper deal?air chief marshal sp tyagi , former indian air force chief , accused tweaked altitude requirements favour agustawestland winning vvip chopper deal.prior tyagi becoming air force chief , iaf said opposed purchasing agustawestland ' aw101 capable flying high-altitude areas like siachen tiger hill.however , tyagi appointed chief , iaf "" conceded reduce "" altitude requirements , hence , bringing agustawestland back race chopper deal.the italian court appeals judgement says "" unmistakable indications regarding corruption indian officer "" , identified cousin tyagi , therefore , implying tyagi involved scam .","{'bjp': 5, 'cong': 4}",4,5
2016-05-02,"vvip chopper scam: ex-air chief sp tyagi admits to meeting officials of finmeccanica, claims cbi","after sustained cross-examination and being confronted with hard evidence on the agustawestland chopper deal, ex-air chief sp tyagi admitted today to having met officials of finmeccanica, including georgio zapa, the then coo, in 2005 in india, cbi officials said.tyagi had been evasive on monday but today he was forced to admit he met the officials after being confronted with the visitor's diary and registers.according to sources, the cbi will now zoom in on details about his international travel after retirement. the former air chief has admittedto having financial interests in three companies - vanshi, anuras and shavan.however, during investigation the name of a new company surfaced. this fourth company is called meghanshu.tyagi has been named in the fir in the rs 3,600-crore vvip helicopter deal along with 13 others including his brothers - sanjeev, rajeev and sandeep - and european middlemen guido haschke and carlo gerosa.sources said tyagi's brothers will soon be summoned for questioning along with gautam khaitan, another accused in the case.the allegation against the former iaf chief is that he had reduced flying ceiling of the helicopter from 6,000 metres to 4,500 metres (15,000 feet) so that agustawestland could be included in the bids.",-0.0505892255892256,"vvip chopper scam : ex-air chief sp tyagi admits meeting officials finmeccanica , claims cbi","sustained cross-examination confronted hard evidence agustawestland chopper deal , ex-air chief sp tyagi admitted today met officials finmeccanica , including georgio zapa , coo , 2005 india , cbi officials said.tyagi evasive monday today forced admit met officials confronted visitor ' diary registers.according sources , cbi zoom details international travel retirement. former air chief admittedto financial interests three companies - vanshi , anuras shavan.however , investigation name new company surfaced. fourth company called meghanshu.tyagi named fir rs 3,600-crore vvip helicopter deal along 13 others including brothers - sanjeev , rajeev sandeep - european middlemen guido haschke carlo gerosa.sources said tyagi ' brothers soon summoned questioning along gautam khaitan , another accused case.the allegation former iaf chief reduced flying ceiling helicopter 6,000 metres 4,500 metres ( 15,000 feet ) agustawestland could included bids .","{'bjp': 0, 'cong': 0}",0,0
