Date,Title,Article,Sentiment,clean title,clean article,polarity,cong,bjp
2018-03-29,karnataka election 2018: can siddaramaiah win it for congress beating modi-shah duo with ahinda campaign?,"as per one study done by the centre for studies of developing societies (csds), the upper social bloc votes are almost equally distributed among the congress, the bjp and the jd(s) in karnataka - 34 per cent, 33 per cent and 31 per cent respectively. however, the divide lines within the bloc get sharper depending on community allegiance.analysing the voting pattern for 2008 karnataka assembly election, the study found that 51 per cent of lingayat votes went to the bjp led by bs yeddiyurappa in the state. yeddiyurappa hails from the lingayat community which has been recently accorded by the congress government of siddaramaiah the status of a separate religion distinct from hinduism. the congress had secured only 25 per cent votes from the lingayat community while the jds got 15 per cent.upper caste voters prefer the bjp (41 per cent) to the congress (33 per cent) and the jd(s) 13 per cent. the jd(s) led by hd deve gowda received 40 per cent of vokkaliga votes. deve gowda belongs to the community. the congress got 35 per cent vokkaliga votes while the bjp got only 18 per cent favour from the community.in the case of lower social bloc votes, the congress secured 54 per cent votes followed by the bjp and the jd(s) with both getting 18 per cent each. as many as 38 per cent lower obc votes favoured the congress. the bjp (29 per cent) and the jd(s) - 20 per cent - came next.dalits, adivasis and muslims overwhelmingly voted for the congress - 50 per cent, 44 per cent and 65 per cent respectively. the bjp's share among dalit votes was only 20 per cent and among the adivasis, it was 25 per cent. only 11 per cent muslim voters favoured the bjp.caste and karnatakathis pattern of voting is believed to have remained the same in all the elections held over the last decade. chief minister siddaramaiah is eying to change this politico-electoral alignment of castes with his social engineering - ahinda campaign when the state votes to elect the next government on may 12.majority of karnataka chief ministers since 1952 have belonged to either lingayat or vokkalinga community based on the perception that they are the most dominant political force in the state. with his ahinda (acronym for alpa sankhyatara, hindulida, dalit or minorities, backward castes and dalits) campaign, siddaramaiah has tried to change the way castes have been casting their votes in karnataka.siddaramaiah commissioned a caste census at the cost of rs 150 crore in 2015. the reports have not been officially made public but according to what seems like a tactical leak of the caste census data, the share of lingayats in karnataka's population has come down from around 16-17 per cent to 9.8 per cent.in the case of vokkaliga, the proportion in state's population came down from around 14-15 per cent to just over 8 per cent. according to caste census of 2015, the dalits form the single biggest community in karnataka. they account for 24 per cent of 6.5 crore population of the state.muslims constitute about 12.5 per cent of karnataka's population while scheduled tribes and kurubas (the community to which chief minister siddaramaiah belongs to) have a share of 7 per cent each. the brahmins comprise only two per cent of the state's population. this also means that about 80 per cent of karnataka's population belongs to ahinda (minorities, obcs, scs and sts).caste wooing in karnatakathe new ""leaked"" data have forced all the political parties to realign their electoral calculations ahead of voting in the karnataka assembly election. siddaramaiah is trying to win over lingayats by acceding to their demand for recognition as a distinct religious group from hindu.besides, siddaramaiah has got himself described as ahinda chief minister in order to woo the communities which are believed to be ""not inclined"" towards the bjp. on the other hand, the bjp is trying to reach out to communities that are believed to be in the folds of the jd(s) or the congress.bjp president amit shah has met priests of adichunchanagiri - the spiritual headquarters of the vokkaliga, who have voted largely for either the congress or the jd(s). vokkaligas were said to be outraged following income tax raids at the properties of karnataka energy minister dk shivakumar. amit shah's visit was also aimed at pacifying the community.at the same time, both shah and prime minister narendra modi have projected yeddiyurappa as the chief ministerial candidate despite him having crossed the unofficial retirement age of 75 years. this seems to be an attempt to keep the lingayats behind the party in the karnataka assembly election.the bjp is also playing down the differences between yeddiyurappa and ks eshwarappa, a powerful leader from obc community. eshwarappa is the leader of opposition in the karnataka legislative council. the bjp's outreach to the obcs is likely to get limited success given the open rivalry between yeddiyurappa, the cm candidate of the party and eshwarappa.the jd(s), on its part, has stitched an alliance with mayawati's bsp in karnataka to attract dalit voters, who have now emerged as the most dominant ""vote bank"". it also hopes to keep its support base among vokkaligas intact.with all three dominant parties giving weightage to new caste data in karnataka, attempts are afloat for fresh community alignments. the old brahmins-lingayats, scheduled caste-scheduled tribes, obc and muslims formulae are set to go for a toss in the karnataka assembly election 2018.",0.05200959171547406,karnataka election 2018 : siddaramaiah win congress beating modi-shah duo ahinda campaign ?,"per one study done centre studies developing societies ( csds ) , upper social bloc votes almost equally distributed among congress , bjp jd( ) karnataka - 34 per cent , 33 per cent 31 per cent respectively. however , divide lines within bloc get sharper depending community allegiance.analysing voting pattern 2008 karnataka assembly election , study found 51 per cent lingayat votes went bjp led bs yeddiyurappa state. yeddiyurappa hails lingayat community recently accorded congress government siddaramaiah status separate religion distinct hinduism. congress secured 25 per cent votes lingayat community jds got 15 per cent.upper caste voters prefer bjp ( 41 per cent ) congress ( 33 per cent ) jd( ) 13 per cent. jd( ) led hd deve gowda received 40 per cent vokkaliga votes. deve gowda belongs community. congress got 35 per cent vokkaliga votes bjp got 18 per cent favour community.in case lower social bloc votes , congress secured 54 per cent votes followed bjp jd( ) getting 18 per cent each. many 38 per cent lower obc votes favoured congress. bjp ( 29 per cent ) jd( ) - 20 per cent - came next.dalits , adivasis muslims overwhelmingly voted congress - 50 per cent , 44 per cent 65 per cent respectively. bjp ' share among dalit votes 20 per cent among adivasis , 25 per cent. 11 per cent muslim voters favoured bjp.caste karnatakathis pattern voting believed remained elections held last decade. chief minister siddaramaiah eying change politico-electoral alignment castes social engineering - ahinda campaign state votes elect next government may 12.majority karnataka chief ministers since 1952 belonged either lingayat vokkalinga community based perception dominant political force state. ahinda ( acronym alpa sankhyatara , hindulida , dalit minorities , backward castes dalits ) campaign , siddaramaiah tried change way castes casting votes karnataka.siddaramaiah commissioned caste census cost rs 150 crore 2015. reports officially made public according seems like tactical leak caste census data , share lingayats karnataka ' population come around 16-17 per cent 9.8 per cent.in case vokkaliga , proportion state ' population came around 14-15 per cent 8 per cent. according caste census 2015 , dalits form single biggest community karnataka. account 24 per cent 6.5 crore population state.muslims constitute 12.5 per cent karnataka ' population scheduled tribes kurubas ( community chief minister siddaramaiah belongs ) share 7 per cent each. brahmins comprise two per cent state ' population. also means 80 per cent karnataka ' population belongs ahinda ( minorities , obcs , scs sts ) .caste wooing karnatakathe new "" leaked "" data forced political parties realign electoral calculations ahead voting karnataka assembly election. siddaramaiah trying win lingayats acceding demand recognition distinct religious group hindu.besides , siddaramaiah got described ahinda chief minister order woo communities believed "" inclined "" towards bjp. hand , bjp trying reach communities believed folds jd( ) congress.bjp president amit shah met priests adichunchanagiri - spiritual headquarters vokkaliga , voted largely either congress jd( ) . vokkaligas said outraged following income tax raids properties karnataka energy minister dk shivakumar. amit shah ' visit also aimed pacifying community.at time , shah prime minister narendra modi projected yeddiyurappa chief ministerial candidate despite crossed unofficial retirement age 75 years. seems attempt keep lingayats behind party karnataka assembly election.the bjp also playing differences yeddiyurappa ks eshwarappa , powerful leader obc community. eshwarappa leader opposition karnataka legislative council. bjp ' outreach obcs likely get limited success given open rivalry yeddiyurappa , cm candidate party eshwarappa.the jd( ) , part , stitched alliance mayawati ' bsp karnataka attract dalit voters , emerged dominant "" vote bank "" . also hopes keep support base among vokkaligas intact.with three dominant parties giving weightage new caste data karnataka , attempts afloat fresh community alignments. old brahmins-lingayats , scheduled caste-scheduled tribes , obc muslims formulae set go toss karnataka assembly election 2018 .","{'bjp': 11, 'cong': 9}",9,11
2018-03-29,"'pm modi will destroy nation', amit shah's translator goofs up at karnataka rally","it seems the bharatiya janata party's campaign in the election-bound karnataka is making headlines for all the wrong reasons.the party's president amit shah was caught in a fix today, thanks to a translator who twisted the bjp chief's words.while shah was addressing a bjp rally in challkere of karnataka's devanagiri district where, according to the translator prahlad joshi's version, he said, ""pm narendra modi will not do anything for dalits, poor and the backward classes. he will damage the nation. please vote for him.""however, what shah had actually said was this: ""siddaramaiah government could not develop karnataka. you have faith in pm modi and cast your vote for yeddyurappa. we will transform karnataka into the best state in the country.""this is not the first time that shah was caught in a similarly embarrassing situation. earlier this week, shah ended up calling his own man, bs yeddyurappa (bsy), 'corrupt'.""bhrashtachar keliye agar spardha kar li jaaye to yeddyurappa sarkar ko bhrashtachar mein number one sarkar ka award zurur milega (if ever there is a competition on the most corrupt, then yeddyurappa government will be awarded number one,"" shah said at a press conference shortly after the dates of the karnataka election were announced.shah's convoluted situation gave the opposition congress an opportunity to hit back. karnataka congress soon tweeted saying that even amit shah agreed that yeddyurappa led the most corrupt government.also read: can siddaramaiah win karnataka for congress beating modi-shah duo with ahinda campaign?watch: freudian slip? bjp president amit shah calls own man bs yeddyurappa corrupt&lt;/strong&gt;&lt;/p&gt;",0.08157894736842104,"' pm modi destroy nation ' , amit shah ' translator goofs karnataka rally","seems bharatiya janata party ' campaign election-bound karnataka making headlines wrong reasons.the party ' president amit shah caught fix today , thanks translator twisted bjp chief ' words.while shah addressing bjp rally challkere karnataka ' devanagiri district , according translator prahlad joshi ' version , said , "" pm narendra modi anything dalits , poor backward classes. damage nation. please vote him. "" however , shah actually said : "" siddaramaiah government could develop karnataka. faith pm modi cast vote yeddyurappa. transform karnataka best state country. "" first time shah caught similarly embarrassing situation. earlier week , shah ended calling man , bs yeddyurappa ( bsy ) , ' corrupt ' . "" bhrashtachar keliye agar spardha kar li jaaye yeddyurappa sarkar ko bhrashtachar mein number one sarkar ka award zurur milega ( ever competition corrupt , yeddyurappa government awarded number one , "" shah said press conference shortly dates karnataka election announced.shah ' convoluted situation gave opposition congress opportunity hit back. karnataka congress soon tweeted saying even amit shah agreed yeddyurappa led corrupt government.also read : siddaramaiah win karnataka congress beating modi-shah duo ahinda campaign?watch : freudian slip ? bjp president amit shah calls man bs yeddyurappa corrupt&lt ; / strong&gt ; &lt ; / p&gt ;","{'bjp': 3, 'cong': 3}",3,3
2018-04-07,"exclusive | rahul gandhi ready to replace modi, says jyotiraditya scindia","mp from guna, madhya pradesh, jyotiraditya scindia is thought to be close to congress president rahul gandhi. be it executing rahul gandhi's strategy on the floor of the house or working to revamp and reinforce the base of the congress party in madhya pradesh, scindia plays a leading role.according to him, rahul gandhi is now ready to replace narendra modi. he is a viable alternative and would succeed in garnering the support of the citizens. however, on the issue of projecting his name as the chief ministerial candidate in madhya pradesh, scindia said that as a party worker, any decision of the high command would be acceptable to him. scindia was candid enough to concede that the congress party is passing through a tough phase. on the issue of dynastic politics he asked which party is devoid of the syndrome.speaking to india's no. 1 news channel 'aaj tak's' relaunched flagship show 'seedhi baat' jyotiraditya scindia gave straight answers to pointed questions from anchor sweta singh.congress' toughest phaseon asked if this is the toughest phase for the congress party, scindia said, ""there can be no two opinion about it (if) someone believes (that the congress) is passing through tough times and says so then he inhabits a different space.""on being asked if the assembly polls in madhya pradesh in 2018 is important for him or if it is the 2019 general elections, jyotiraditya scindia said,""it is my belief that as a social worker and political leader every election should be crucial for you. for me, whether it is the lok sabha elections or some byelections in my state, wherever the party directs me to campaign, every election is important.""when asked to name four issues on which the central government can be charge sheeted in 2019? he said, ""the chargesheet on the central government would contain more than four issues. be it dealing with terrorism, issues of security or issues of the prevailing internal situation in the country, be it questions on the foreign policy, or doklam issue, or the issue of engaging pakistan or the issue of maldives, unemployment, women's security, or data leak or question paper leak, they will have to provide answers.""road to 2019if elections of 2018 would chart the course for 2019? he replied, ""as a office bearer of the congress party, the most important thing at present is the upcoming karnataka elections and four state assembly polls after that.""for the 2018 madhya pradesh assembly polls, who is the bigger adversary for jyotiraditya scindia, bjp or the infighting within the congress? replying to this question he said, ""internal politics was indeed a reality in the congress, but that was some 5, 10, 15 years ago. now the top congress leadership in madhya pradesh, be it digvijaya singh or kamal nath, suresh pachauri or satyavrat chaturvedi, we all consult each other while finalising strategies.""scindia as madhya pradesh cm candidatewhen he was asked that almost all the surveys show that scindia is a very popular figure, so why doesn't the congress announce him as the cm candidate? he said, ""i think the high command should take the call on the leadership issue, as a party worker i shall wholeheartedly accept whatever they decide.""whether it is karti chidambaram or the son in law of capt. amrinder singh, whenever issues of corruption comes up congress finds itself on shaky grounds. replying to this scindia said, ""see they are raking up issues in both the cases where none exists. what is the issue with amrinder singh's son in law, the loan he took out was not even listed as an npa. we are ready, you act, what is stopping them from taking action.""when questioned on the issue of dynastic politics, jyotiraditya scindia said, ""if it is the children of some businessman you shall not raise any issues, nor if the children of a doctor follow his profession, however if the children of a politician follows him in the role there will be questions raised. which party in india is free of dynastic trends, but let me say these, they win election to get there.""you can see the complete interview with jyotiraditya scindia on aaj tak on sunday, april 8, at 8 pm in the evening.also read:temple visit, massive bengaluru rally on rahul gandhi's to-do list for two-day karnataka triprahul gandhi attacks rss again, this time in karnatakaalso watch: rahul raj: political journey of rahul gandhi from a reluctant prince to congress' foreman",0.11851851851851855,"exclusive &#124; rahul gandhi ready replace modi , says jyotiraditya scindia","mp guna , madhya pradesh , jyotiraditya scindia thought close congress president rahul gandhi. executing rahul gandhi ' strategy floor house working revamp reinforce base congress party madhya pradesh , scindia plays leading role.according , rahul gandhi ready replace narendra modi. viable alternative would succeed garnering support citizens. however , issue projecting name chief ministerial candidate madhya pradesh , scindia said party worker , decision high command would acceptable him. scindia candid enough concede congress party passing tough phase. issue dynastic politics asked party devoid syndrome.speaking india ' no. 1 news channel ' aaj tak ' ' relaunched flagship show ' seedhi baat ' jyotiraditya scindia gave straight answers pointed questions anchor sweta singh.congress ' toughest phaseon asked toughest phase congress party , scindia said , "" two opinion ( ) someone believes ( congress ) passing tough times says inhabits different space. "" asked assembly polls madhya pradesh 2018 important 2019 general elections , jyotiraditya scindia said , "" belief social worker political leader every election crucial you. , whether lok sabha elections byelections state , wherever party directs campaign , every election important. "" asked name four issues central government charge sheeted 2019 ? said , "" chargesheet central government would contain four issues. dealing terrorism , issues security issues prevailing internal situation country , questions foreign policy , doklam issue , issue engaging pakistan issue maldives , unemployment , women ' security , data leak question paper leak , provide answers. "" road 2019if elections 2018 would chart course 2019 ? replied , "" office bearer congress party , important thing present upcoming karnataka elections four state assembly polls that. "" 2018 madhya pradesh assembly polls , bigger adversary jyotiraditya scindia , bjp infighting within congress ? replying question said , "" internal politics indeed reality congress , 5 , 10 , 15 years ago. top congress leadership madhya pradesh , digvijaya singh kamal nath , suresh pachauri satyavrat chaturvedi , consult finalising strategies. "" scindia madhya pradesh cm candidatewhen asked almost surveys show scindia popular figure , ' congress announce cm candidate ? said , "" think high command take call leadership issue , party worker shall wholeheartedly accept whatever decide. "" whether karti chidambaram son law capt. amrinder singh , whenever issues corruption comes congress finds shaky grounds. replying scindia said , "" see raking issues cases none exists. issue amrinder singh ' son law , loan took even listed npa. ready , act , stopping taking action. "" questioned issue dynastic politics , jyotiraditya scindia said , "" children businessman shall raise issues , children doctor follow profession , however children politician follows role questions raised. party india free dynastic trends , let say , win election get there. "" see complete interview jyotiraditya scindia aaj tak sunday , april 8 , 8 pm evening.also read : temple visit , massive bengaluru rally rahul gandhi ' to-do list two-day karnataka triprahul gandhi attacks rss , time karnatakaalso watch : rahul raj : political journey rahul gandhi reluctant prince congress ' foreman","{'bjp': 1, 'cong': 12}",12,1
