Date,Title,Article,Sentiment,clean title,clean article,polarity,cong,bjp
2008-05-24,"forthcoming events from may 23 to 30, 2008","here is a list of upcoming events from may 23 to 30, 2008.here is a list of upcoming events from may 23 to 30, 2008.may 23, 2008president pratibha patil will begin her five-day visit to jammu and kashmir from today. president pratibha patil, the supreme commander of the armed forces, will address army jawans for the first time when she undertakes her maiden visit to jammu and kashmir today. president pratibha patil will be visiting the forward india post of tangdhar near the loc in jammu and kashmir on may 23 where pakistani troops opened unprovoked fire.4th global telecom summit 2008 - the most comprehensive global telecom summit in india for a unique personalised experience. 23 & 24th may 2008 9.30 am. hotel shangri-la, new delhiair india's service from bangalore to singapore will be the first flight to take off from the new international airport in the city when it becomes operational todaynational institute of public finance and policy to host a two-day seminar on issues before the 13th finance commissionphdcci to organise an interactive meeting with a business delegation from cuba. eduardo e amador, deputy minister of foreign trade, cuba will be the chief guest venue phd house. time 11.30 ammay 25, 2008results of the karnataka elections today- as many as 47 centres have been identified across the state for counting of votes, which is scheduled to be held today after the conclusion of the three-phase polls to the stae assemblyunion food, civil supplies and agriculture minister sharad pawar will be visiting hyderabad today and he is expected to sort out the issue relating to restoration of earlier allocation of 3,18,287 mt of rice per month for the below poverty line (bpl) and above overty line (apl) categories.pakistani band junoon is performing on the banks of the dal lake today. more than 10,000 people are being invited to see the band singing. the concert will be part of the celebrations marking the inauguration by the president of kashmir studies institute at kashmir university (ku). the concert has been sponsored by the indian chapter of south asia foundation, a non-profit group, in collaboration with the ku.counting of votes today for the bye-elections of the haryana, hp, maharashtra, meghalaya & punjab for which elections held on may 22, 2008national institute of public finance and policy to host a two-day seminar on issues before the 13th finance commission4th global telecom summit 2008 - the most comprehensive global telecom summit in india for a unique personalised experience. 23 & 24th may 2008 9.30 am. hotel shangri-la, new delhi may 26, 2008first meeting of the india-iran joint working group today. both the countries to ink rail network mouthe phoenix spacecraft will attempt to land on the martian arctic at about 5 am (ist) todaytwo international dignitaries - maldives' president maumoon abdul gayoom and former sri lankan pm chandrika kumaratunga - visit to the vally today along with president pratibha patil to attend the inaugural function of the kashmir studies centre oday kashmirsadhus, saints and religious leaders in varanasi will perform shramdan to clean up the ganga river in the holy city. led by swami avimuktheshwaranand, a representatitive of shankaracharya of jyotis and sharda-dwarka peeth swami and swarupanand saraswati, they will start the sharamdan in varanasi from todaymay 27, 2008the centenary celebrations of indian institute of science (iisc) will commence from today and will go on for one full yearberline air show - india will be participating in the forthcoming berlin air show as an ""official partner country"" now. over 25 companies from india will be participating in the six-day air show which begins today, with hindustan aeronautics ltd (hal) leading the packparliamentary panel studying the women's bill to meet for the first time today. ms brinda karat, ms najma heptullah and ms prabha thakur inducted in the paneldefcom india 2008 - technology and anti technology challenges for defence forces [27-28 may 2008: new delhi] venue: india habitat centre, lodi road, new delhias part of her j&k 5-day visit the president will leave for jammu on may 27, where she is expected to visit the shrine of vaishno devi in the trikuta hills. jammumay 28, 2008 left-upa meet on nuclear deal todaynepal's government announced that its new constitution-drafting body would meet for the first today when it is due to formally abolish the monarchy and declare the country a republicthe association of women entrepreneurs of karnataka (awake) is celebrating its silver jubilee, will host an international summit, expo and b2b to highlight the 'role and contribution of women to the global ecnomy' at the bangalore palace grounds from today till june 2. it will see the participation of successful women entrepreneurs from 14 countriesmay 29, 2008bypolls to the four lok sabha seats and 18 assembly seats in andhra pradesh to be held todayaccording to the india meteorological department forecast the onset of the south-west monsoon over kerala is likely today, with a model error of plus or minus four days. in other words, the monsoon could enter the indian landmass between may 25 and june 2.nepal has declared may 29 as international mount everest day, celebrating the edmund hillary-tenzing norgay conquest in 1953. a mountain film festival will be heldnobel prize winners from across the world have appealed to india to free human rights activist binayak sen on humanitarian grounds to enable him to receive the jonathan mann award for global health and human rights in washington on may 29.""everest day"" celebrations today. hillary's 18-year-old grand daughter, amelia, left for solukhumbhu with her father peter, who has climbed moutn everest twicewatech 2008: international conference & exposition industrial & urban water management technologies. may 29-30, 2008 - ficci, federation house, tansen marg, new delhi, india may 30, 2008seventh international institute for strategic studies (iiss) asia security summit, or the shangri-la dialogue. defence minister a.k. antony visits singapore for the shangri-la dialogue. defence ministers and senior officials from india, china and 21 other countries - including the united kingdom and the united states to participate in the summitthe mint south banking conclave ii - why do we need so many banks? balancing inclusion and competitiveness. guest of honour: v leeladhar (dy governor, rbi). 7 pm onwards at the leela palace, kempinski bangalorewatech 2008: international conference & exposition industrial & urban water management technologies. may 29-30, 2008 - ficci, federation house, tansen marg, new delhi, indiaalliance francaise de delhi in association with the french embassy in india & the ashok presents jazz by julien lourau. 7.30 pm at the theatre, the ashok, chanakyapuri, delhi",0.11679292929292932,"forthcoming events may 23 30 , 2008","list upcoming events may 23 30 , 2008.here list upcoming events may 23 30 , 2008.may 23 , 2008president pratibha patil begin five-day visit jammu kashmir today. president pratibha patil , supreme commander armed forces , address army jawans first time undertakes maiden visit jammu kashmir today. president pratibha patil visiting forward india post tangdhar near loc jammu kashmir may 23 pakistani troops opened unprovoked fire.4th global telecom summit 2008 - comprehensive global telecom summit india unique personalised experience. 23 &amp; 24th may 2008 9.30 am. hotel shangri-la , new delhiair india ' service bangalore singapore first flight take new international airport city becomes operational todaynational institute public finance policy host two-day seminar issues 13th finance commissionphdcci organise interactive meeting business delegation cuba. eduardo e amador , deputy minister foreign trade , cuba chief guest venue phd house. time 11.30 ammay 25 , 2008results karnataka elections today- many 47 centres identified across state counting votes , scheduled held today conclusion three-phase polls stae assemblyunion food , civil supplies agriculture minister sharad pawar visiting hyderabad today expected sort issue relating restoration earlier allocation 3,18,287 mt rice per month poverty line ( bpl ) overty line ( apl ) categories.pakistani band junoon performing banks dal lake today. 10,000 people invited see band singing. concert part celebrations marking inauguration president kashmir studies institute kashmir university ( ku ) . concert sponsored indian chapter south asia foundation , non-profit group , collaboration ku.counting votes today bye-elections haryana , hp , maharashtra , meghalaya &amp; punjab elections held may 22 , 2008national institute public finance policy host two-day seminar issues 13th finance commission4th global telecom summit 2008 - comprehensive global telecom summit india unique personalised experience. 23 &amp; 24th may 2008 9.30 am. hotel shangri-la , new delhi may 26 , 2008first meeting india-iran joint working group today. countries ink rail network mouthe phoenix spacecraft attempt land martian arctic 5 ( ist ) todaytwo international dignitaries - maldives ' president maumoon abdul gayoom former sri lankan pm chandrika kumaratunga - visit vally today along president pratibha patil attend inaugural function kashmir studies centre oday kashmirsadhus , saints religious leaders varanasi perform shramdan clean ganga river holy city. led swami avimuktheshwaranand , representatitive shankaracharya jyotis sharda-dwarka peeth swami swarupanand saraswati , start sharamdan varanasi todaymay 27 , 2008the centenary celebrations indian institute science ( iisc ) commence today go one full yearberline air show - india participating forthcoming berlin air show "" official partner country "" now. 25 companies india participating six-day air show begins today , hindustan aeronautics ltd ( hal ) leading packparliamentary panel studying women ' bill meet first time today. ms brinda karat , ms najma heptullah ms prabha thakur inducted paneldefcom india 2008 - technology anti technology challenges defence forces [ 27-28 may 2008 : new delhi ] venue : india habitat centre , lodi road , new delhias part j&k 5-day visit president leave jammu may 27 , expected visit shrine vaishno devi trikuta hills. jammumay 28 , 2008 left-upa meet nuclear deal todaynepal ' government announced new constitution-drafting body would meet first today due formally abolish monarchy declare country republicthe association women entrepreneurs karnataka ( awake ) celebrating silver jubilee , host international summit , expo b2b highlight ' role contribution women global ecnomy ' bangalore palace grounds today till june 2. see participation successful women entrepreneurs 14 countriesmay 29 , 2008bypolls four lok sabha seats 18 assembly seats andhra pradesh held todayaccording india meteorological department forecast onset south-west monsoon kerala likely today , model error plus minus four days. words , monsoon could enter indian landmass may 25 june 2.nepal declared may 29 international mount everest day , celebrating edmund hillary-tenzing norgay conquest 1953. mountain film festival heldnobel prize winners across world appealed india free human rights activist binayak sen humanitarian grounds enable receive jonathan mann award global health human rights washington may 29. "" everest day "" celebrations today. hillary ' 18-year-old grand daughter , amelia , left solukhumbhu father peter , climbed moutn everest twicewatech 2008 : international conference &amp; exposition industrial &amp; urban water management technologies. may 29-30 , 2008 - ficci , federation house , tansen marg , new delhi , india may 30 , 2008seventh international institute strategic studies ( iiss ) asia security summit , shangri-la dialogue. defence minister a.k. antony visits singapore shangri-la dialogue. defence ministers senior officials india , china 21 countries - including united kingdom united states participate summitthe mint south banking conclave ii - need many banks ? balancing inclusion competitiveness. guest honour : v leeladhar ( dy governor , rbi ) . 7 pm onwards leela palace , kempinski bangalorewatech 2008 : international conference &amp; exposition industrial &amp; urban water management technologies. may 29-30 , 2008 - ficci , federation house , tansen marg , new delhi , indiaalliance francaise de delhi association french embassy india &amp; ashok presents jazz julien lourau. 7.30 pm theatre , ashok , chanakyapuri , delhi","{'bjp': 0, 'cong': 0}",0,0
2008-05-26,sonia said 'no' to karnataka government formation bid,"the congress party has taken a conscious decision not to attempt to form a government in karnataka, where the bharatiya janata pary (bjp) has emerged as the largest party but three short of a majority, as party president sonia gandhi declined to give the go-ahead.""had the congress president given us the green signal, we would have got our chief minister sworn in before wednesday. we could easily have paraded 114 mlas before the governor,"" said a senior congress leader, who was involved in the karnataka elections.although the bjp emerged as the single largest party, winning 110 of the 224 seats in the karnataka elections, the party is still three short of majority to form the government. the congress won 80, while the janata dal-secular (jd-s), the former ruling ally of the bjp, bagged 28. the independents and others have six seats.the congress leader claimed the jd-s was willing to forge a post-poll alliance with the congress to form a non-bjp government in the state, which would give the alliance 108 seats. four independents who won, have been congress rebels. ""we could manage two more easily,"" he said.""however, gandhi was of the view that it would be immoral and the party should not indulge in such attempts. she said it would damage the party in other states also,"" the leader said on condition of anonymity.""to top it, there are more than three party leaders who are ready to be sworn in as chief minister,"" he quipped.the congress, whose electoral debacle in karnataka follows defeats in gujarat, punjab, himachal pradesh, uttarakhand and uttar pradesh, is trying to fix the reasons.""i admit that there have been reverses. we are in the process of fix it. we will have an internal review,"" congress spokesperson manish tewari said.tewari said the congress ""fought the election as a cohesive and collective entity. all our leaders have put their best foot forward. in democracy, we win at times, we lose other times. we have to take it in our stride.""however, in private, party leaders admitted that the congress has to ""do introspection"" and the leadership has to review its strategies.""the leadership has to ensure that the state units are functioning with discipline and are election oriented,"" said a party leader, who worked in karnataka.he admitted that there were flaws in the candidate selection. ""of the total 11 women candidates we fielded, none could win. of the 16 muslim party candidates, seven won and one of the two christian candidates was also elected.""the party lost its traditional support base among the scheduled castes. in the 36 reserved constituencies, the congress won only 10, while the bjp managed 22.""we have to find out what happened in those constituencies. we will study the results carefully,"" said prithviraj chavan, the party general secretary who was in charge of karnataka elections.",0.16018062397372745,sonia said ' ' karnataka government formation bid,"congress party taken conscious decision attempt form government karnataka , bharatiya janata pary ( bjp ) emerged largest party three short majority , party president sonia gandhi declined give go-ahead. "" congress president given us green signal , would got chief minister sworn wednesday. could easily paraded 114 mlas governor , "" said senior congress leader , involved karnataka elections.although bjp emerged single largest party , winning 110 224 seats karnataka elections , party still three short majority form government. congress 80 , janata dal-secular ( jd-s ) , former ruling ally bjp , bagged 28. independents others six seats.the congress leader claimed jd-s willing forge post-poll alliance congress form non-bjp government state , would give alliance 108 seats. four independents , congress rebels. "" could manage two easily , "" said. "" however , gandhi view would immoral party indulge attempts. said would damage party states also , "" leader said condition anonymity. "" top , three party leaders ready sworn chief minister , "" quipped.the congress , whose electoral debacle karnataka follows defeats gujarat , punjab , himachal pradesh , uttarakhand uttar pradesh , trying fix reasons. "" admit reverses. process fix it. internal review , "" congress spokesperson manish tewari said.tewari said congress "" fought election cohesive collective entity. leaders put best foot forward. democracy , win times , lose times. take stride. "" however , private , party leaders admitted congress "" introspection "" leadership review strategies. "" leadership ensure state units functioning discipline election oriented , "" said party leader , worked karnataka.he admitted flaws candidate selection. "" total 11 women candidates fielded , none could win. 16 muslim party candidates , seven one two christian candidates also elected. "" party lost traditional support base among scheduled castes. 36 reserved constituencies , congress 10 , bjp managed 22. "" find happened constituencies. study results carefully , "" said prithviraj chavan , party general secretary charge karnataka elections .","{'bjp': 4, 'cong': 12}",12,4
2008-11-07,aicc disapproves of alva's outburst,"congress on friday disapproved of party general secretary margaret alva's charges that election tickets were sold in karnataka but remained silent on whether it was a fit case for disciplinary action.""we do not agree for sweeping statements and... grievances ought not be aired in public,"" aicc spokesman abhishek manu singhvi told reporters in new delhi.singhvi described alva as a seasoned and senior leader of the party but said for all her grievances there are established and ample fora within the party.""we have no doubt that such outburst would recur again,"" he said.alva, who has been sulking since her son nivedith was not given nomination in karnataka elections, had created an embarrassment for the party on thursday as she alleged adoption of ""different yardsticks"" in deciding party nominations for upcoming elections in six states. she had wondered why her son and grandson of former union minister c.k. jaffer sharief were not given nominations while relatives of two dozen leaders were given tickets in madhya pradesh, chhattisgarh, rajasthan and jammu and kashmir.""were my son and jaffer sharief's grandson anti-national, terrorists or smugglers?"" alva had asked. she is also apparently upset over the appointment of her bete noire r.v. deshpande as state party chief.aicc general secretary prithviraj chavan, who is in-charge of party affairs in karnataka and who appeared to be in alva's firing line, has already dismissed her charges as ""unsubstantiated and born out of frustration"".chavan had said ""as long as alva is general secretary, i will not comment on her unfortunate statement. since she is general secretary of the party, any decision on it will be taken by the congress high command and central disciplinary action committee"".antony, when asked for a reaction on the alva issue at a defence ministry function in new delhi on friday, merely said politics should not be mixed with issues relating to defence.""no politics in defence. it is matter of defence function. in the last two years (that i have been defence minister) i have not mixed defence and politics,"" he said.",0.01856643356643357,aicc disapproves alva ' outburst,"congress friday disapproved party general secretary margaret alva ' charges election tickets sold karnataka remained silent whether fit case disciplinary action. "" agree sweeping statements ... grievances ought aired public , "" aicc spokesman abhishek manu singhvi told reporters new delhi.singhvi described alva seasoned senior leader party said grievances established ample fora within party. "" doubt outburst would recur , "" said.alva , sulking since son nivedith given nomination karnataka elections , created embarrassment party thursday alleged adoption "" different yardsticks "" deciding party nominations upcoming elections six states. wondered son grandson former union minister c.k. jaffer sharief given nominations relatives two dozen leaders given tickets madhya pradesh , chhattisgarh , rajasthan jammu kashmir. "" son jaffer sharief ' grandson anti-national , terrorists smugglers ? "" alva asked. also apparently upset appointment bete noire r.v. deshpande state party chief.aicc general secretary prithviraj chavan , in-charge party affairs karnataka appeared alva ' firing line , already dismissed charges "" unsubstantiated born frustration "" .chavan said "" long alva general secretary , comment unfortunate statement. since general secretary party , decision taken congress high command central disciplinary action committee "" .antony , asked reaction alva issue defence ministry function new delhi friday , merely said politics mixed issues relating defence. "" politics defence. matter defence function. last two years ( defence minister ) mixed defence politics , "" said .","{'bjp': 0, 'cong': 2}",2,0
2009-01-06,media-savvy digvijay singh,"diggie's gameshe is known in the party as rahul gandhi's ahmad patel. ever since digvijay singh took over as general secretary uttar pradesh and has been working closely with rahul gandhi he has emerged as a sort of a mentor to the young scion and is sometimes seen as his mouthpiece.for instance, the minute singh defended antulay it was clear that the foot-n-mouth union minister would save his job. digvijay is known to take positions different from the conventional party view - he favours the hanging of afzal guru for instance.sometime back when margaret alva-known to be close to sonia-took digvijay over the distribution of tickets in the karnataka elections, guess who lost? of all the general secretaries at the congress headquarters - it is digivijay's office that is the most crowded, both with journos and congress workers.he is not the media incharge but he gets to have the last word on most issues. though the last word is not always reassuring, such as his recent claim that the government refused to negotiate with the terrorists in mumbai. later, when it was pointed out that the terrorists themselves were not looking for negotiations, singh mumbled saying that he was going by what he had read in the papers. well, he should know better.read between the nuancesthe mea is all about nuances and so are its briefings. at a shivshankar menon briefing recently his dry wit and sarcasm was on display as he dealt with some rather obscure questions.when he stated that kasab would be tried under the indian system of justice, a journalist asked if that would be in india. to which menon replied saying, ""where else will there be an indian system of justice?""later, when he spoke about handing material against the mumbai terrorists to pakistan he was asked if all the evidence had been handed over. ever correct, he replied, that what was handed over was material. evidence was something that is valid in a court of law under the evidence act. trust the mea to argue about the semantics of that one.bjp powerplaythe case of the missing cash is being used by rajnath singh's detractors who claim that this is an example of the haphazard manner in which the party office is being run during his tenure.it is not just the theft they say but also the fact that there are not enough skilled spokespersons in bjp to defend the party. now this is rather a tenuous connection, but no one is worrying about that. the idea is to build a laundry list of complaints against the hapless rajnath, and then to wash it in full public gaze.",0.02251984126984128,media-savvy digvijay singh,"diggie ' gameshe known party rahul gandhi ' ahmad patel. ever since digvijay singh took general secretary uttar pradesh working closely rahul gandhi emerged sort mentor young scion sometimes seen mouthpiece.for instance , minute singh defended antulay clear foot-n-mouth union minister would save job. digvijay known take positions different conventional party view - favours hanging afzal guru instance.sometime back margaret alva-known close sonia-took digvijay distribution tickets karnataka elections , guess lost ? general secretaries congress headquarters - digivijay ' office crowded , journos congress workers.he media incharge gets last word issues. though last word always reassuring , recent claim government refused negotiate terrorists mumbai. later , pointed terrorists looking negotiations , singh mumbled saying going read papers. well , know better.read nuancesthe mea nuances briefings. shivshankar menon briefing recently dry wit sarcasm display dealt rather obscure questions.when stated kasab would tried indian system justice , journalist asked would india. menon replied saying , "" else indian system justice ? "" later , spoke handing material mumbai terrorists pakistan asked evidence handed over. ever correct , replied , handed material. evidence something valid court law evidence act. trust mea argue semantics one.bjp powerplaythe case missing cash used rajnath singh ' detractors claim example haphazard manner party office run tenure.it theft say also fact enough skilled spokespersons bjp defend party. rather tenuous connection , one worrying that. idea build laundry list complaints hapless rajnath , wash full public gaze .","{'bjp': 1, 'cong': 2}",2,1
