Date,Title,Article,Sentiment,clean title,clean article,polarity,cong,bjp
2018-05-12,"karnataka poll of polls shows bjp ahead, jd(s) as kingmaker","well over two-thirds of karnataka's voters headed to polling booths today to elect state lawmakers, and as many as five exit polls suggest they've given prime minister narendra modi's bjp reason to cheer.poll numbers published by news x-cnx, news nation, dighvijay news, abp-c-voter, and republic tv predict maximum seat tallies ranging between 101 and 114 for the bjp, which in recent months has emerged as a formidable election-winning machine - save a few hiccups in lok sabha bypolls.if the bjp does win more than 112 seats, bs yeddyurappa, the bjp's chief ministerial candidate, could very well find himself inviting the prime minister to his swearing-in ceremony, as he said he would.but there's no need for congress shoulders to sag. two other exit polls, including the india today - axis my india poll - forecast vastly different outcomes, both favourable for the grand old party.the 'bookends' of the inc's maximum projected seat tallies are 103 and 118. the second number would take team siddaramiah well past the halfway mark - cue fireworks and sweets at delhi's 24, akbar road, the congress headquarters.but in the event of a hung assembly, hd kumaraswamy's jd(s) could get a chance to play kingmaker. not a single survey gives it less than 18 seats - a sizeable chunk that is sure to interest both the heavyweights.here's a look at the raw numbers, as well as the best and worst case scenarios for the bjp and the congress.exit poll numbersindia today - axis my india bjp - 79-92 | congress - 106-118 | jds+ - 22-30 | others - 1-4 times now - vmrbjp - 80-93 | congress - 90-103 | jds+ - 31-39 | others - 2-4 republic tvbjp - 95-114 | congress - 73-82 | jds+ - 32-43 | others - 2-3 news nationbjp - 105-109 | congress - 71-75 | jds+ - 36-40 | others - 3-5 news x - cnxbjp - 102-110 | congress - 70-78 | jds+ - 35-39 | others - 3-5 dighvijay news bjp - 103-107 | congress - 76-80 | jds+ - 31-35 | others - 4-5abp-c voterbjp - 101-113 | congress - 82-94 | jds+ - 18 to 31 | others - 1-8scenariosbjp, best case | 114 seatsrepublic tv's exit poll predicts that the bjp could win between 95 and 114 seats. that's a pretty wide margin - 19 seats. but if the saffron party manages to cobble together enough to scrape past the 112-mark, it's curtains for the congress in karnataka, at least till 2023.bjp, worst case | 79 seatsthe most pessimistic estimate for the bjp would be based on the india today numbers. the india today-axis my india survey suggests the party could bag 79 to 92 seats. but remember the jd(s) factor - post-poll alliances could spell doom for the congress if it fails to achieve a clear majority.congress, best case | 118 seatswhen india today asked chief minister siddaramaiah about its numbers, he said he ""expected this,"" and said they were ""nearer to truth"" and the ""ground reality."" if the inc's performance matches the higher spectrum of the india today numbers, the road to 2019 could get very interesting indeed.congress, worst case | 70 seats the news x-cnx poll suggests the congress may find itself with just 70 to 78 seats.but crunch all the numbers you want - the verdict that truly matters is the one you'll hear on counting day: may 15.stay tuned.go to our karnataka election page for full coverage of one of the most anticipated elections in recent memory.analysis | my india exit poll: congress to have edge over rivals, to win 106-118 seats in karnataka",0.15162252277636898,"karnataka poll polls shows bjp ahead , jd( ) kingmaker","well two-thirds karnataka ' voters headed polling booths today elect state lawmakers , many five exit polls suggest ' given prime minister narendra modi ' bjp reason cheer.poll numbers published news x-cnx , news nation , dighvijay news , abp-c-voter , republic tv predict maximum seat tallies ranging 101 114 bjp , recent months emerged formidable election-winning machine - save hiccups lok sabha bypolls.if bjp win 112 seats , bs yeddyurappa , bjp ' chief ministerial candidate , could well find inviting prime minister swearing-in ceremony , said would.but ' need congress shoulders sag. two exit polls , including india today - axis india poll - forecast vastly different outcomes , favourable grand old party.the ' bookends ' inc ' maximum projected seat tallies 103 118. second number would take team siddaramiah well past halfway mark - cue fireworks sweets delhi ' 24 , akbar road , congress headquarters.but event hung assembly , hd kumaraswamy ' jd( ) could get chance play kingmaker. single survey gives less 18 seats - sizeable chunk sure interest heavyweights.here ' look raw numbers , well best worst case scenarios bjp congress.exit poll numbersindia today - axis india bjp - 79-92 &#124; congress - 106-118 &#124; jds+ - 22-30 &#124; others - 1-4 times - vmrbjp - 80-93 &#124; congress - 90-103 &#124; jds+ - 31-39 &#124; others - 2-4 republic tvbjp - 95-114 &#124; congress - 73-82 &#124; jds+ - 32-43 &#124; others - 2-3 news nationbjp - 105-109 &#124; congress - 71-75 &#124; jds+ - 36-40 &#124; others - 3-5 news x - cnxbjp - 102-110 &#124; congress - 70-78 &#124; jds+ - 35-39 &#124; others - 3-5 dighvijay news bjp - 103-107 &#124; congress - 76-80 &#124; jds+ - 31-35 &#124; others - 4-5abp-c voterbjp - 101-113 &#124; congress - 82-94 &#124; jds+ - 18 31 &#124; others - 1-8scenariosbjp , best case &#124; 114 seatsrepublic tv ' exit poll predicts bjp could win 95 114 seats. ' pretty wide margin - 19 seats. saffron party manages cobble together enough scrape past 112-mark , ' curtains congress karnataka , least till 2023.bjp , worst case &#124; 79 seatsthe pessimistic estimate bjp would based india today numbers. india today-axis india survey suggests party could bag 79 92 seats. remember jd( ) factor - post-poll alliances could spell doom congress fails achieve clear majority.congress , best case &#124; 118 seatswhen india today asked chief minister siddaramaiah numbers , said "" expected , "" said "" nearer truth "" "" ground reality. "" inc ' performance matches higher spectrum india today numbers , road 2019 could get interesting indeed.congress , worst case &#124; 70 seats news x-cnx poll suggests congress may find 70 78 seats.but crunch numbers want - verdict truly matters one ' hear counting day : may 15.stay tuned.go karnataka election page full coverage one anticipated elections recent memory.analysis &#124; india exit poll : congress edge rivals , win 106-118 seats karnataka","{'bjp': 9, 'cong': 13}",13,9
2018-05-12,karnataka election 2018: biggest takeaways from india today-axis my india exit poll,"the indian national congress is expected to emerge as the single-largest party in the karnataka and could even form the next government single-handedly, the india today-axis my india exit poll has predicted.the party is expected to win between 106 and 118 seats in the 224-seat assembly (the exit poll prediction are only for 222 seats since polling in two constituencies has been postponed). the halfway mark in the assembly is 112.the bharatiya janata party (bjp), which is hoping to steal the congress's southern bastion to get an advantage ahead of next year's lok sabha election, is expected to win between 79 and 92 seats while the janata dal (secular) and its allies could win 22-30 seats.here are some of the biggest takeaways from the india today-axis my india exit poll: 2018 vs 2013: based on the 2013 karnataka election actual numbers and the india today-axis my india projections, the congress is losing seats while the bjp would gain on its 2013 seat tally. in 2013, the congress had won 122 seats while the bjp had won 40. but, it must be noted that yedyurappa had rebelled against the bjp in 2013 and had floated his own party to contest that election. no anti-incumbency: there is almost no anti-incumbency factor noticed, according to the findings of the exit poll. incumbent chief minister siddaramaiah enjoys overall popularity in relative terms, given the cloud of concerns around the bjp cm candidate yeddyurappa. however, the concerns over yeddyurappa have been countered to a large extent by prime minister narendra modi's campaigning.caste consolidation: according to the india today-axis my india poll, the congress enjoys the support of minorities (muslims and christians), kurubas and scs/sts, which constitute 48 per cent of karnataka's population. bjp enjoys the support of lingayats, brahmins, jains, obcs, kshatriyas and marathis, constituting 41 per cent of the population.region-wise trends: coastal karnataka, central karnataka and bombay karnataka are with the bjp. hyderabad, old mysore and bangalore city are with the congress. however, in old mysore, vokkaliga-dominated seats are with the jds. bjp's conundrum: according to the india today-axis my india exit poll, the bjp and the congress face a straight fight in 170 seats. in the other 52 seats, the fight is between the congress and the jd(s). this means that for the bjp to attain a majority mark in the karnataka assembly, the party must win 70 per cent of its battles against congress in the 170 seats. this is an uphill task.follow our coverage of the karnataka assembly election 2018 herealso read: expected this, says siddaramaiah after india today exit poll predicts congress advantagewatch | advantage congress in karnataka: india today-axis my india exit poll",0.17678571428571435,karnataka election 2018 : biggest takeaways india today-axis india exit poll,"indian national congress expected emerge single-largest party karnataka could even form next government single-handedly , india today-axis india exit poll predicted.the party expected win 106 118 seats 224-seat assembly ( exit poll prediction 222 seats since polling two constituencies postponed ) . halfway mark assembly 112.the bharatiya janata party ( bjp ) , hoping steal congress ' southern bastion get advantage ahead next year ' lok sabha election , expected win 79 92 seats janata dal ( secular ) allies could win 22-30 seats.here biggest takeaways india today-axis india exit poll : 2018 vs 2013 : based 2013 karnataka election actual numbers india today-axis india projections , congress losing seats bjp would gain 2013 seat tally. 2013 , congress 122 seats bjp 40. , must noted yedyurappa rebelled bjp 2013 floated party contest election. anti-incumbency : almost anti-incumbency factor noticed , according findings exit poll. incumbent chief minister siddaramaiah enjoys overall popularity relative terms , given cloud concerns around bjp cm candidate yeddyurappa. however , concerns yeddyurappa countered large extent prime minister narendra modi ' campaigning.caste consolidation : according india today-axis india poll , congress enjoys support minorities ( muslims christians ) , kurubas scs/sts , constitute 48 per cent karnataka ' population. bjp enjoys support lingayats , brahmins , jains , obcs , kshatriyas marathis , constituting 41 per cent population.region-wise trends : coastal karnataka , central karnataka bombay karnataka bjp. hyderabad , old mysore bangalore city congress. however , old mysore , vokkaliga-dominated seats jds. bjp ' conundrum : according india today-axis india exit poll , bjp congress face straight fight 170 seats. 52 seats , fight congress jd( ) . means bjp attain majority mark karnataka assembly , party must win 70 per cent battles congress 170 seats. uphill task.follow coverage karnataka assembly election 2018 herealso read : expected , says siddaramaiah india today exit poll predicts congress advantagewatch &#124; advantage congress karnataka : india today-axis india exit poll","{'bjp': 10, 'cong': 11}",11,10
2018-05-13,"jd-s will form government in karnataka, says kumaraswamy","after a tumultuous campaign season, citizens of karnataka voted today to choose their next government.for long, the fight was always between the congress and bjp, but the dark horse for many was the regional party, jd(s)-led by former cm hd kumaraswamy.india today met kumaraswamy, early in the morning at the rajarajeshwari temple, who told that he was at the temple to seek blessings of the divine and that his family was extremely religious.but, he exuded confidence that his party would form the next government and people would debunk all the survey reports that have given his party the third place.he then travelled to bidadi to exercise his franchise and was mobbed by hundreds of his supporters who were waiting for hours to meet and greet him.his actor son nikhil gowda said that people need a change today and that change is none other than hd kumaraswamy.unlike bengaluru, which saw low voter turnout, villages outside the city witnessed people coming out early and standing in long queues to cast their vote.counting of votes for karnataka assembly election begins at 8 am on tuesday, may 15. our live coverage begins at 7 am. watch this space for the latest results. follow our complete coverage herealso read: karnataka election 2018: biggest takeaways from india today-axis my india exit poll also read: expected this, says siddaramaiah after india today exit poll predicts congress advantage",0.04646464646464647,"jd-s form government karnataka , says kumaraswamy","tumultuous campaign season , citizens karnataka voted today choose next government.for long , fight always congress bjp , dark horse many regional party , jd( ) -led former cm hd kumaraswamy.india today met kumaraswamy , early morning rajarajeshwari temple , told temple seek blessings divine family extremely religious.but , exuded confidence party would form next government people would debunk survey reports given party third place.he travelled bidadi exercise franchise mobbed hundreds supporters waiting hours meet greet him.his actor son nikhil gowda said people need change today change none hd kumaraswamy.unlike bengaluru , saw low voter turnout , villages outside city witnessed people coming early standing long queues cast vote.counting votes karnataka assembly election begins 8 tuesday , may 15. live coverage begins 7 am. watch space latest results. follow complete coverage herealso read : karnataka election 2018 : biggest takeaways india today-axis india exit poll also read : expected , says siddaramaiah india today exit poll predicts congress advantage","{'bjp': 1, 'cong': 2}",2,1
2018-05-13,karnataka election 2018: siddaramaiah says exit polls are just for entertainment,"karnataka chief minister siddaramaiah has brushed aside the projections made by different exit polls after karnataka voted to decide its next government on saturday.writing on his twitter handle on sunday morning, he termed the exit polls as means of entertainment.""exit opinion polls are entertainment for the next two days. so, dear party workers, supporters and well wishers, don't worry about exit polls. relax and enjoy your weekend. we are coming back,"" he said. posts from siddaramaiah's twitter handle.this comes a day after he told india today the he was expecting the same result as projected by the india today-axis my india exit poll.the survey, in which over 51,500 people in 222 constituencies participated, predicts that the congress will win between 106 and 118 seats, and 39 per cent of the vote share. anything above 112 seats - the halfway mark - will hand the congress a clear majority, which siddaramaiah feels his party will achieve.when asked about the numbers, the chief minister simply said, ""i was expecting this."" the results of the poll, he said, were ""nearer to truth,"" and the ""ground reality.""meanwhile, following the voting on saturday, the congress and bjp have both expressed confidence of garnering a victory.the votes will be counted on may 15.counting of votes for karnataka assembly election begins at 8 am on tuesday, may 15. our live coverage begins at 7 am. watch this space for the latest results. follow our complete coverage hereread here for our complete coverage of karnataka assembly election.also read | india today exit poll: bjp to lose to congress as siddaramaiah set to win in karnatakaalso read | jd-s will form government in karnataka, says kumaraswamyalso watch | advantage congress in karnataka: india today-axis my india exit poll",0.17272727272727273,karnataka election 2018 : siddaramaiah says exit polls entertainment,"karnataka chief minister siddaramaiah brushed aside projections made different exit polls karnataka voted decide next government saturday.writing twitter handle sunday morning , termed exit polls means entertainment. "" exit opinion polls entertainment next two days. , dear party workers , supporters well wishers , ' worry exit polls. relax enjoy weekend. coming back , "" said. posts siddaramaiah ' twitter handle.this comes day told india today expecting result projected india today-axis india exit poll.the survey , 51,500 people 222 constituencies participated , predicts congress win 106 118 seats , 39 per cent vote share. anything 112 seats - halfway mark - hand congress clear majority , siddaramaiah feels party achieve.when asked numbers , chief minister simply said , "" expecting this. "" results poll , said , "" nearer truth , "" "" ground reality. "" meanwhile , following voting saturday , congress bjp expressed confidence garnering victory.the votes counted may 15.counting votes karnataka assembly election begins 8 tuesday , may 15. live coverage begins 7 am. watch space latest results. follow complete coverage hereread complete coverage karnataka assembly election.also read &#124; india today exit poll : bjp lose congress siddaramaiah set win karnatakaalso read &#124; jd-s form government karnataka , says kumaraswamyalso watch &#124; advantage congress karnataka : india today-axis india exit poll","{'bjp': 2, 'cong': 5}",5,2
2018-05-13,"modi, shah in touch with me, 100 per cent confident of victory, says yeddyurappa","a day after he announced the date of his swearing-in ceremony, bharatiya janata party (bjp) chief-ministerial candidate bs yeddyurappa reiterated ""confidence"" that his party will emerge victorious in the karnataka assembly election.responding to the predications made by exit polls, yeddyurappa said prime minister narendra modi and bjp chief amit shah are in touch with him.""he [modi] is in touch with me. everybody is confident of winning with absolute majority. we are 100 per cent sure of forming the government on may 17,"" yeddyurappa said.he (pm modi) is in touch with me and amit shah. everybody is confident of winning with absolute majority. we are 100% sure of forming the government on may 17: bs yeddyurappa, bjp #karnatakaelections2018 pic.twitter.com/yktylgjrxbani (@ani) may 13, 2018the veteran bjp leader and former chief minister also claimed that his party will win more than 125-130 seats in the election for which voting was held on saturday.""bjp will win more than 125-130 seats, congress will not be able to cross 70 seats and jds [janata dal secular] will not cross 24-25 seats,"" he said.bjp will win more than 125-130 seats, congress will not be able to cross 70 seats and jds will not cross 24-25 seats. there is a silent and strong wave in favour of bjp and public anger against siddaramaiah and congress: bjp's cm candidate bs yeddyurappa #karnatakaelections2018 pic.twitter.com/ojqoggk8zoani (@ani) may 13, 2018rubbishing the congress' claim of winning the polls, he said, ""there is a silent and strong wave in favour of bjp and public anger against siddaramaiah and congress.""the india today-axis my india exit poll has projected that the congress will emerge as the single-largest party in the karnataka election, bagging between 106-118 seats of the 222 seats where polling was held on saturday.the magic figure in the karnataka vidhan sabha is 113 and axis projects that the congress is comfortably placed to beat anti-incumbency and form the next government in the state, the exit polls reveal.meanwhile, in a tit-for-tat, chief minister siddaramaiah also posted tweets from his personal handle asking party workers and supporters to ""relax over the weekend"" and said the congress is all set to form the next government in karnataka.on the other hand, asked about his stand on choosing between bjp and congress, jds chief hd deve gowda said, ""i am not prepared to accept or reject anything, let's wait for may 15. we will know the reality.""counting of votes for karnataka assembly election begins at 8 am on tuesday, may 15. our live coverage begins at 7 am. watch this space for the latest results. follow our complete coverage herefollow our coverage of the karnataka assembly election 2018 herealso read | india today exit poll: bjp to lose to congress as siddaramaiah set to win in karnatakaalso read | karnataka election 2018: biggest takeaways from india today-axis my india exit pollalso watch | karnataka assembly election: india today-axis my india exit poll gives thumbs up to siddaramaiah",0.2580007390983002,"modi , shah touch , 100 per cent confident victory , says yeddyurappa","day announced date swearing-in ceremony , bharatiya janata party ( bjp ) chief-ministerial candidate bs yeddyurappa reiterated "" confidence "" party emerge victorious karnataka assembly election.responding predications made exit polls , yeddyurappa said prime minister narendra modi bjp chief amit shah touch him. "" [ modi ] touch me. everybody confident winning absolute majority. 100 per cent sure forming government may 17 , "" yeddyurappa said.he ( pm modi ) touch amit shah. everybody confident winning absolute majority. 100 % sure forming government may 17 : bs yeddyurappa , bjp #karnatakaelections2018 pic.twitter.com/yktylgjrxbani ( @ani ) may 13 , 2018the veteran bjp leader former chief minister also claimed party win 125-130 seats election voting held saturday. "" bjp win 125-130 seats , congress able cross 70 seats jds [ janata dal secular ] cross 24-25 seats , "" said.bjp win 125-130 seats , congress able cross 70 seats jds cross 24-25 seats. silent strong wave favour bjp public anger siddaramaiah congress : bjp ' cm candidate bs yeddyurappa #karnatakaelections2018 pic.twitter.com/ojqoggk8zoani ( @ani ) may 13 , 2018rubbishing congress ' claim winning polls , said , "" silent strong wave favour bjp public anger siddaramaiah congress. "" india today-axis india exit poll projected congress emerge single-largest party karnataka election , bagging 106-118 seats 222 seats polling held saturday.the magic figure karnataka vidhan sabha 113 axis projects congress comfortably placed beat anti-incumbency form next government state , exit polls reveal.meanwhile , tit-for-tat , chief minister siddaramaiah also posted tweets personal handle asking party workers supporters "" relax weekend "" said congress set form next government karnataka.on hand , asked stand choosing bjp congress , jds chief hd deve gowda said , "" prepared accept reject anything , let ' wait may 15. know reality. "" counting votes karnataka assembly election begins 8 tuesday , may 15. live coverage begins 7 am. watch space latest results. follow complete coverage herefollow coverage karnataka assembly election 2018 herealso read &#124; india today exit poll : bjp lose congress siddaramaiah set win karnatakaalso read &#124; karnataka election 2018 : biggest takeaways india today-axis india exit pollalso watch &#124; karnataka assembly election : india today-axis india exit poll gives thumbs siddaramaiah","{'bjp': 10, 'cong': 9}",9,10
