Date,Title,Article,Sentiment,clean title,clean article,polarity,cong,bjp
2008-01-18,"i kept bjp on tenterhooks, says mayawati","apparently sending a strong signal to the minorities, up chief minister mayawati has said that despite sharing power with the bjp three times, she always kept the saffron party on tenterhooks.""i feel that the bjp leadership will have always regretted and repented that mayawati never allowed imposition of its thought and ideology over her government despite taking support from them"", she said.the bjp leadership might be feeling that ""i cared two hoots for them and kept them on tenterhooks"", the bsp supremo says in her autobiographical book using the phrase in hindi juti ke nok per he rakha.recalling that the first alliance effected by the bsp was with the samajwadi party in the 1993 uttar pradesh elections, she says that it shows that it was an anti-bjp alliance and aimed at ""forcing the saffron party to disembark from the rath to ayodhya"".in the 1000-page book written in hindi tittled mere sangharshmay jeevan aevam bsp movement ka safarnama, the u p chief minister says that ""we were completely successful in our strategy"".she says at that time it was essential for the bsp to make timely change in its strategy by aligning with the sp to show an aggressive bjp ""its proper place"".while the congress had been already ""angry"" with the bsp for ensuring its marginalisation in the politically key state, the bjp too adopted a similar attitude, she says.the saffron forces were angry because they were unable to make any dent despite forging post-poll alliances with the bsp, she points out.",-0.03974358974358975,"kept bjp tenterhooks , says mayawati","apparently sending strong signal minorities , chief minister mayawati said despite sharing power bjp three times , always kept saffron party tenterhooks. "" feel bjp leadership always regretted repented mayawati never allowed imposition thought ideology government despite taking support "" , said.the bjp leadership might feeling "" cared two hoots kept tenterhooks "" , bsp supremo says autobiographical book using phrase hindi juti ke nok per rakha.recalling first alliance effected bsp samajwadi party 1993 uttar pradesh elections , says shows anti-bjp alliance aimed "" forcing saffron party disembark rath ayodhya "" .in 1000-page book written hindi tittled mere sangharshmay jeevan aevam bsp movement ka safarnama , u p chief minister says "" completely successful strategy "" .she says time essential bsp make timely change strategy aligning sp show aggressive bjp "" proper place "" .while congress already "" angry "" bsp ensuring marginalisation politically key state , bjp adopted similar attitude , says.the saffron forces angry unable make dent despite forging post-poll alliances bsp , points .","{'bjp': 5, 'cong': 1}",1,5
2008-04-25,will rahul gandhi become a role model like his father rajiv?,"rahul gandhi can't win an mla election without his mother's support. how can he become a role model for the country? india has already seen how the congress party has fared in the up elections in which he played a key role.—rajesh ojha from jodhpur, india (rajesh1.ojha@rediffmail.com)it is true that rajiv gandhi had a dream for modern india. however rahul's case is different. neither has he any potential nor any commendable understanding of indian politics. to talk of his being the prime minister is foolhardy. he is no different from delhi's pizza craving youth—ignorant and unsympathetic of india's poor.—maneesh pandey from allahabad, india (maneeshnarayan@yahoo.co.in)",0.19285714285714284,rahul gandhi become role model like father rajiv ?,"rahul gandhi ' win mla election without mother ' support. become role model country ? india already seen congress party fared elections played key role. — rajesh ojha jodhpur , india ( rajesh1.ojha@rediffmail.com ) true rajiv gandhi dream modern india. however rahul ' case different. neither potential commendable understanding indian politics. talk prime minister foolhardy. different delhi ' pizza craving youth — ignorant unsympathetic india ' poor. — maneesh pandey allahabad , india ( maneeshnarayan@yahoo.co.in )","{'bjp': 0, 'cong': 1}",1,0
2009-05-02,"criminals, crorepatis galore in up poll arena","politics in uttar pradesh always has the reputation of being driven by guns and money power. and the current elections are no different in india’s largest state. interestingly, chief minister mayawati in her campaign speeches paints samajwadi party (sp) as an outfit that had unleashed ‘goonda raj' in up while her archrival mulayam singh yadav has been describing bsp as a ‘party of mafia gangs’. now the up election watch (upew) has exposed the truth behind such utterances. after analysing the affidavits filed by the candidates it says in the first four rounds of elections involving 66 of 80 constituencies there were 171 candidates or 14.68 per cent of the total 1165 candidates with criminal records while there were 184 crorepatis or 15.79 per cent. of these 18 constituencies will go to the polls on may 7. the statistics compiled by upew revealed that while sp headed by mulayam singh yadav led the field by fielding 31 candidates with criminal records (51.61% of its candidates) the bahujan samaj party (bsp) headed by mayawati had the maximum number of crorepatis in the fray. it had set up 41 crorepati candidates or 15.79 per cent candidates. according to upew, a voluntary group comprising association for democratic reforms (adr), national election watch besides over 1200 ngos working of electoral reforms, there are 26 “red alert’ constituencies in the first four phases where three or more candidates are contesting. two of them – chandauli in the east and ghaziabad in the west bordering delhi – have more than seven candidates with criminal records. other top parties with criminal-candidates are bsp, bjp and congress. while bsp has 25 such candidates (37.88%) bjp has fielded 18 (29.51%) and congress 15 (27.27%). in the first four phases there are altogether 95 candidates with ‘heinous crimes’ ranging from murder, attempt to murder, kidnapping and extortions. out of these, sp has the maximum number of 19 candidates closely followed by bsp-18, bjp-12 and congress only 5. on the other hand while bsp tops the list of crorepatis with 41 such candidates, bjp followed by fielding 37 candidates, sp with 35 and congress has 31 crorepatis. according to upew, among the major parties the average asset per candidate for bsp is at 7 crores while sp, bjp and congress at rs 2 crores. of all the candidates 16.8 per cent candidates are graduate, 6.58 per cent are graduate professional, 18.76 per cent are post-graduates while 3.05 per cent candidates hold doctorate degrees. fourth phase: looking at the complexion of candidates 313 candidates in the fray in the fourth phase for which voting would be held on may 7, the upew says 49 or 15.65 per cent have criminal records. of them 30 candidates were facing heinous charges. out of them 6 belong to bsp, three to sp, 2 to congress and 1 to bjp. there are:eight out of 18 are ‘red alert’ constituenciesof the total candidates 66 are crorepatis 21.1 per cent are graduates, 9.3 per cent are graduate professionals and 15.3 per cent are post-graduate while 2.6 per cent hold doctorate degrees ",0.017672413793103442,"criminals , crorepatis galore poll arena","politics uttar pradesh always reputation driven guns money power. current elections different india ’ largest state. interestingly , chief minister mayawati campaign speeches paints samajwadi party ( sp ) outfit unleashed ‘goonda raj ' archrival mulayam singh yadav describing bsp ‘party mafia gangs ’ . election watch ( upew ) exposed truth behind utterances. analysing affidavits filed candidates says first four rounds elections involving 66 80 constituencies 171 candidates 14.68 per cent total 1165 candidates criminal records 184 crorepatis 15.79 per cent. 18 constituencies go polls may 7. statistics compiled upew revealed sp headed mulayam singh yadav led field fielding 31 candidates criminal records ( 51.61 % candidates ) bahujan samaj party ( bsp ) headed mayawati maximum number crorepatis fray. set 41 crorepati candidates 15.79 per cent candidates. according upew , voluntary group comprising association democratic reforms ( adr ) , national election watch besides 1200 ngos working electoral reforms , 26 “red alert ’ constituencies first four phases three candidates contesting. two – chandauli east ghaziabad west bordering delhi – seven candidates criminal records. top parties criminal-candidates bsp , bjp congress. bsp 25 candidates ( 37.88 % ) bjp fielded 18 ( 29.51 % ) congress 15 ( 27.27 % ) . first four phases altogether 95 candidates ‘heinous crimes ’ ranging murder , attempt murder , kidnapping extortions. , sp maximum number 19 candidates closely followed bsp-18 , bjp-12 congress 5. hand bsp tops list crorepatis 41 candidates , bjp followed fielding 37 candidates , sp 35 congress 31 crorepatis. according upew , among major parties average asset per candidate bsp 7 crores sp , bjp congress rs 2 crores. candidates 16.8 per cent candidates graduate , 6.58 per cent graduate professional , 18.76 per cent post-graduates 3.05 per cent candidates hold doctorate degrees. fourth phase : looking complexion candidates 313 candidates fray fourth phase voting would held may 7 , upew says 49 15.65 per cent criminal records. 30 candidates facing heinous charges. 6 belong bsp , three sp , 2 congress 1 bjp. : eight 18 ‘red alert ’ constituenciesof total candidates 66 crorepatis 21.1 per cent graduates , 9.3 per cent graduate professionals 15.3 per cent post-graduate 2.6 per cent hold doctorate degrees","{'bjp': 5, 'cong': 6}",6,5
2011-02-25,better safe," minister of state for surface transport jitin prasada is busy trying to find a safe seat for his wife neha in next year's uttar pradesh elections. with neha's disappointing stint as media adviser to vasundhara raje scindia on top of his mind, prasada wants to personally handle his wife's publicity.",0.1,better safe,"minister state surface transport jitin prasada busy trying find safe seat wife neha next year ' uttar pradesh elections. neha ' disappointing stint media adviser vasundhara raje scindia top mind , prasada wants personally handle wife ' publicity .","{'bjp': 0, 'cong': 0}",0,0
2011-02-26,better safe," minister of state for surface transport jitin prasada is busy trying to find a safe seat for his wife neha in next year's uttar pradesh elections. with neha's disappointing stint as media adviser to vasundhara raje scindia on top of his mind, prasada wants to personally handle his wife's publicity.",0.1,better safe,"minister state surface transport jitin prasada busy trying find safe seat wife neha next year ' uttar pradesh elections. neha ' disappointing stint media adviser vasundhara raje scindia top mind , prasada wants personally handle wife ' publicity .","{'bjp': 0, 'cong': 0}",0,0
2011-06-06,congress to fight up elections on its own: digvijay,"the congress on tuesday said it will fight the elections in uttar pradesh on its own.congress general secretary digvijay singh said the party will have no pre-poll alliance with the bsp or samajwadi party for the elections due next year.singh said maximum tickets will be given to scs, sts, minorities and the youth.the congress has been eyeing a comeback in uttar pradesh, with general secretary rahul gandhi laying special emphasis on the state. after a prolonged dry phase, the party won several seats in uttar pradesh in the 2009 lok sabha elections.",0.03792517006802722,congress fight elections : digvijay,"congress tuesday said fight elections uttar pradesh own.congress general secretary digvijay singh said party pre-poll alliance bsp samajwadi party elections due next year.singh said maximum tickets given scs , sts , minorities youth.the congress eyeing comeback uttar pradesh , general secretary rahul gandhi laying special emphasis state. prolonged dry phase , party several seats uttar pradesh 2009 lok sabha elections .","{'bjp': 0, 'cong': 2}",2,0
2011-09-29,"upa suffering from anarchy of leadership crisis, says bjp","the bjp on friday launched a fresh broadside at the upa government as its national executive meet started in the national capital on friday.bjp spokesman ravi shankar prasad, briefing the media on party president nitin gadkari's opening speech at the national executive meet, took on prime minister manmohan singh for his inability to control corruption in his government.""the upa government is suffering from anarchy of leadership crisis,"" prasad said, adding, ""why is manmohan singh holding the prime minister's post if he is so indifferent and oblivious of people's problem?""the main opposition party, which met to fine tune the strategy for veteran leader l.k. advani's yatra against corruption, turned the heat on the government.chidambaram comes under attackprasad trained his guns on the government over the 2g spectrum allocation scam insisting that finance minister pranab mukherjee was wrong to give a clean chit to home minister p. chidambaram. he sought to know why the cbi was not inclined to question the former finance minister.dismissing mukherjee's clean chit to chidambaram on the 2g note, prasad said the finance minister had made a ""comical"" statement on thursday. he insisted that chidambaram should be in jail for his role in the 2g case.modi's absence from meetprasad denied reports that gujarat chief minister narendra modi, who missed the first day of the meet, has been upset with the party.""it is wrong to say that he has not come on account of differences, but it is because of navratra. yeddyurappa is performing shradh of his deceased wife,"" prasad said, adding, ""narendra modi is one of the candidates for prime ministership and as it has been stated, the issue will be decided by the parliamentary board.""eyes on up electiontalking about the forthcoming uttar pradesh assembly polls, prasad said the bjp would fight the election on its own and there would be no tie-up with the bsp or the samajwadi party.saying the bjp's position in the state was improving and the party ""may be able to come to power"" prasad said there was a triangle in the state involving the congress, sp and bsp.""there will be no alliance with any party in any situation. we would prefer sitting in the opposition (if party loses),"" he added.issue of black moneyprasad lashed out at the centre for going soft on black money stashed abroad by the tax evaders. he promised that if the bjp comes to power, it would get black money back to the country.",0.07876984126984128,"upa suffering anarchy leadership crisis , says bjp","bjp friday launched fresh broadside upa government national executive meet started national capital friday.bjp spokesman ravi shankar prasad , briefing media party president nitin gadkari ' opening speech national executive meet , took prime minister manmohan singh inability control corruption government. "" upa government suffering anarchy leadership crisis , "" prasad said , adding , "" manmohan singh holding prime minister ' post indifferent oblivious people ' problem ? "" main opposition party , met fine tune strategy veteran leader l.k. advani ' yatra corruption , turned heat government.chidambaram comes attackprasad trained guns government 2g spectrum allocation scam insisting finance minister pranab mukherjee wrong give clean chit home minister p. chidambaram. sought know cbi inclined question former finance minister.dismissing mukherjee ' clean chit chidambaram 2g note , prasad said finance minister made "" comical "" statement thursday. insisted chidambaram jail role 2g case.modi ' absence meetprasad denied reports gujarat chief minister narendra modi , missed first day meet , upset party. "" wrong say come account differences , navratra. yeddyurappa performing shradh deceased wife , "" prasad said , adding , "" narendra modi one candidates prime ministership stated , issue decided parliamentary board. "" eyes electiontalking forthcoming uttar pradesh assembly polls , prasad said bjp would fight election would tie-up bsp samajwadi party.saying bjp ' position state improving party "" may able come power "" prasad said triangle state involving congress , sp bsp. "" alliance party situation. would prefer sitting opposition ( party loses ) , "" added.issue black moneyprasad lashed centre going soft black money stashed abroad tax evaders. promised bjp comes power , would get black money back country .","{'bjp': 4, 'cong': 1}",1,4
