Date,Title,Article,Sentiment,clean title,clean article,polarity,cong,bjp
2016-10-20,is akhilesh yadav fighting rahul gandhi syndrome in samajwadi party?,"samajwadi party is a divided house today. up chief minister akhilesh yadav has made his intentions clear that he will take on the old guards just like congress vice-president rahul gandhi is doing within the grand old party. incidentally, the two young leaders have come up the order through dynasty politics.by announcing his solo rath yatra just from november 3, two days ahead of the silver jubilee celebrations of the party, akhilesh seems to have almost declared war on the old guards of the samajwadi party.after akhilesh decided to launch his separate election campaign, sp mlc udayveer singh made it awkward for the old guards by shooting off a letter to party president mulayam singh yadav asking him to pave the way for a generational shift in leadership within the party.read| sp on verge of split? akhilesh to start up campaign with rath yatra, likely to miss party's silver jubilee celebration udayveer singh demanded that akhilesh be made national president of the samajwadi party. it's a war between akhilesh and company on one hand and the old guards nurtured by mulayam singh on the other.shivpal wants to remote control akhilesh?only a couple of weeks ago, mulayam singh laboured hard to broker a peace between his brother shivpal yadav and son akhilesh. the two have sparred over several key issues within the party.shivpal wanted dp yadav in party, akhilesh stood in the way. shivpal wanted amar singh back in the party. akhilesh opposed it but had to give in. shivpal wanted a merger of quami ekta dal of up muscleman mukhtar ansari with the sp. akhilesh opposed it tooth and nail. but, mulayam singh seems to be siding with his brother, thus putting himself in the opposition camp.read| has mulayam lost confidence in akhilesh as up cm? all this while shivpal publicly maintained that akhilesh was the sp leader and face of the government in up. clearly, he along with azam khan had tried to remote control the chief minister, who is fighting hard to emerge as a leader on his own.akhilesh's fight within sp has uncanny similarities with that of congress vice-president rahul gandhi within his party.also watch: the rahul syndromewhat akhilesh is facing today in sp, rahul gandhi has been battling for few years. it was rahul, who held elections within the nsui in order to make it transparent. he tried to replicate this at the senior level, when the old guard got apprehensive.rahul gandhi wanted a regular meeting the congress working committee, the supreme decision-making body of the party. rahul got support from senior party leader p chidambaram, who also suggested that a proper mechanism should be there for the party president.the old guards then drew the battlelines against rahul within the party, stalling his reform process by refusing to co-operate. rahul retaliated, sometimes with aggression. he still seems to be fighting the battle but with congress out of power, the party vice-president is showing signs of emergence from the cocoon built by the old guards for him.read| not so happy families will they emerge victorious?rahul faced non-cooperation when he started to talk of reforming the congress and challenging the system created by it. he criticised the congress old guard for ignoring the poor and the farmers.this policy showed him as champion of the poor within the congress, when he enforced implementation of mnrega in all the districts when the government wanted to launch it as pilot project. he took on the old guards once again when he tore up the ordinance aimed at negating the supreme court verdict on convicted lawmakers.read| india today-axis opinion poll for uttar pradesh: bjp dream run to continue, but a hung assembly likely akhilesh, on the other hand, was publicly rapped by mulayam singh yadav after the humiliating performance of sp in the lok sabha elections. mualayam admonished the up cm for emphasising computer education by distributing laptops, which he blamed for party's poor show in the elections.but, now akhilesh seems to have a taken a leaf from rahul gandhi's book. he did not withdraw. in fact, he launched a counter-attack on the old guard. he is understood to have even threatened to leave the party early this week before he was pacified to have his way.there are chances that he would skip the silver jubilee celebrations of the party, where the old guards want to showcase their power. but, the question is, will he?also read:samajwadi party will suffer in up election if rift continues, says imam bukhari samajwarring party: a timeline of how mulayam's clan sunk deep into crisis ",0.01729166666666667,akhilesh yadav fighting rahul gandhi syndrome samajwadi party ?,"samajwadi party divided house today. chief minister akhilesh yadav made intentions clear take old guards like congress vice-president rahul gandhi within grand old party. incidentally , two young leaders come order dynasty politics.by announcing solo rath yatra november 3 , two days ahead silver jubilee celebrations party , akhilesh seems almost declared war old guards samajwadi party.after akhilesh decided launch separate election campaign , sp mlc udayveer singh made awkward old guards shooting letter party president mulayam singh yadav asking pave way generational shift leadership within party.read &#124; sp verge split ? akhilesh start campaign rath yatra , likely miss party ' silver jubilee celebration udayveer singh demanded akhilesh made national president samajwadi party. ' war akhilesh company one hand old guards nurtured mulayam singh other.shivpal wants remote control akhilesh?only couple weeks ago , mulayam singh laboured hard broker peace brother shivpal yadav son akhilesh. two sparred several key issues within party.shivpal wanted dp yadav party , akhilesh stood way. shivpal wanted amar singh back party. akhilesh opposed give in. shivpal wanted merger quami ekta dal muscleman mukhtar ansari sp. akhilesh opposed tooth nail. , mulayam singh seems siding brother , thus putting opposition camp.read &#124; mulayam lost confidence akhilesh cm ? shivpal publicly maintained akhilesh sp leader face government up. clearly , along azam khan tried remote control chief minister , fighting hard emerge leader own.akhilesh ' fight within sp uncanny similarities congress vice-president rahul gandhi within party.also watch : rahul syndromewhat akhilesh facing today sp , rahul gandhi battling years. rahul , held elections within nsui order make transparent. tried replicate senior level , old guard got apprehensive.rahul gandhi wanted regular meeting congress working committee , supreme decision-making body party. rahul got support senior party leader p chidambaram , also suggested proper mechanism party president.the old guards drew battlelines rahul within party , stalling reform process refusing co-operate. rahul retaliated , sometimes aggression. still seems fighting battle congress power , party vice-president showing signs emergence cocoon built old guards him.read &#124; happy families emerge victorious?rahul faced non-cooperation started talk reforming congress challenging system created it. criticised congress old guard ignoring poor farmers.this policy showed champion poor within congress , enforced implementation mnrega districts government wanted launch pilot project. took old guards tore ordinance aimed negating supreme court verdict convicted lawmakers.read &#124; india today-axis opinion poll uttar pradesh : bjp dream run continue , hung assembly likely akhilesh , hand , publicly rapped mulayam singh yadav humiliating performance sp lok sabha elections. mualayam admonished cm emphasising computer education distributing laptops , blamed party ' poor show elections.but , akhilesh seems taken leaf rahul gandhi ' book. withdraw. fact , launched counter-attack old guard. understood even threatened leave party early week pacified way.there chances would skip silver jubilee celebrations party , old guards want showcase power. , question , he?also read : samajwadi party suffer election rift continues , says imam bukhari samajwarring party : timeline mulayam ' clan sunk deep crisis","{'bjp': 1, 'cong': 7}",7,1
2016-10-21,"punjab's amarinder singh says manohar parrikar worst defence minister ever, calls him a joker","former punjab chief minister captain amarinder singh has called for the removal of defence minister manohar parrikar. in an exclusive to india today, amarinder singh came down heavily on parrikar calling him the worst defence minister. he said, ""in the 40 years that i have been in politics i have never seen a more incompetent defence minister. he is a joker and is absolutely clueless about his job, he should be removed forthwith.""read: pak analyst confirms india's surgical strikes, says pakistan itself to blame the former chief minister also refused to give any credit to the political leadership of the country for the surgical strikes. ""the army did what it had to do, it avenged the killings of our soldiers. it is not something that has been done for the first time, it has happened earlier too,"" he said.singh accused the bjp of trying to milk the surgical strikes politically. "" they want to in-cash it in the uttar pradesh elections. i'm a soldier and i know what the army thinks of him. i know that it's a political move and the bjp is doing a great disservice to the country by trying to politicise the strikes,"" he said.read: inside story of indian army's daring surgical strikes against pakistanaccording to singh, the strikes would boomerang on the akali government in punjab. ""they forced people to evacuate their villages, leave behind their crops and cattle all for drama, the government will pay dearly for this,"" he said.amarinder singh once again offered an olive branch to navjot singh sidhu, saying that he was welcome to join the congress party but without any pre conditions. ""i am neither in touch with him nor his wife , but they are welcome to join, his father was a congressman after all,"" said the former cm.read: parrikar attributing success of surgical strike to rss teachings degrades indian army: mayawati he also denied suggestions that he had gone soft on the akali's. ""that can never happen. they embody everything that has gone wrong with punjab, they are a part of the drug mafia, the liquor and transport mafia."" he threatened to launch an inquiry against the misdeeds of the akali's once the congress party comes to power in punjab.watch video also read: pakistan in a state of coma after surgical strikes, says manohar parrikar credit for surgical strikes goes to pm modi, only helped in planning: manohar parrikar surgical strikes in pok: how indian para commandos killed 50 terrorists, hit 7 campsdid india conduct surgical strikes in the past? allegations and denials fly after foreign secy's remarkspost surgical strikes by india, these pakistanis say make friends, not war ",0.03462301587301587,"punjab ' amarinder singh says manohar parrikar worst defence minister ever , calls joker","former punjab chief minister captain amarinder singh called removal defence minister manohar parrikar. exclusive india today , amarinder singh came heavily parrikar calling worst defence minister. said , "" 40 years politics never seen incompetent defence minister. joker absolutely clueless job , removed forthwith. "" read : pak analyst confirms india ' surgical strikes , says pakistan blame former chief minister also refused give credit political leadership country surgical strikes. "" army , avenged killings soldiers. something done first time , happened earlier , "" said.singh accused bjp trying milk surgical strikes politically. "" want in-cash uttar pradesh elections. ' soldier know army thinks him. know ' political move bjp great disservice country trying politicise strikes , "" said.read : inside story indian army ' daring surgical strikes pakistanaccording singh , strikes would boomerang akali government punjab. "" forced people evacuate villages , leave behind crops cattle drama , government pay dearly , "" said.amarinder singh offered olive branch navjot singh sidhu , saying welcome join congress party without pre conditions. "" neither touch wife , welcome join , father congressman , "" said former cm.read : parrikar attributing success surgical strike rss teachings degrades indian army : mayawati also denied suggestions gone soft akali ' s. "" never happen. embody everything gone wrong punjab , part drug mafia , liquor transport mafia. "" threatened launch inquiry misdeeds akali ' congress party comes power punjab.watch video also read : pakistan state coma surgical strikes , says manohar parrikar credit surgical strikes goes pm modi , helped planning : manohar parrikar surgical strikes pok : indian para commandos killed 50 terrorists , hit 7 campsdid india conduct surgical strikes past ? allegations denials fly foreign secy ' remarkspost surgical strikes india , pakistanis say make friends , war","{'bjp': 2, 'cong': 2}",2,2
2016-10-23,"up chief minister akhilesh yadav sacks uncle shivpal again, declares war on amar singh","in a swift and sudden move, uttar pradesh chief minister akhilesh yadav today sacked his uncle shivpal singh yadav as a senior minister in his cabinet for the second time.actor-turned-politician jaya prada was also sacked from the post of vice president of the up film development council. according to sources, some more pro-amar singh ministers are likely to be dropped.meanwhile, samajwadi party chief mulayam singh yadav is holding a meeting with senior party leaders in lucknow to chalk out a future course of action for the party. cover story| up election: the not-so-happy families of samajwadi partythe samajwadi party is fast hurtling towards a split and unless mulayam singh yadav and his son chief minister akhilesh yadav can resolve their differences right away, a formal split in the party appears inevitable.the signs are ominous as in a pre-emptive strike, the chief minister has sacked 4 senior ministers including his estranged uncle shivpal yadav from his government.the move comes on the heels of a meeting chief minister addressed this morning to mlas loyal to him at his residence a while ago.read| building brand akhileshby sacking the powerful shivpal yadav and three of his supporters, the cm has thrown down the gauntlet and indicated willingness to part ways with his father.from the magazine| targeting akhilesh perfect recipe for disaster for samajwadi party?shivpal sacked: all you need to know about akhilesh vs mulayam pariwarthe amar factor the cm's move was preceded by a series of events that were seen as steady deterioration in the relations between the father and the son and also between akhilesh and his uncle shivpal yadav. differences first arose over the induction of amar singh in the party overriding strong opposition from the cm, ram gopal yadav and azam khan.this was followed by differences over the merger of the qaumi ekta dal with the sp and the unceremonious replacement of akhilesh yadav as the state president by shivpal yadav.in the past, every time there has been a crisis in the sp, mulayam singh yadav managed to tide over it. however, the current crisis in the party has seen akhilesh stand up to his father.father-son split anticipated? supported by ramgopal yadav and a large number of the current crop of party mlas and mps, the cm has now indicated that he is willing to part ways with even his father.read| up chief minister akhilesh yadav sacks uncle shivpal again, declares war on amar singh the current crisis in the party could not have come at a more inopportune time for the sp with the assembly elections in uttar pradesh scheduled for early next year. in addition to the incumbency factor, a split in the sp will almost certainly make its hopes of regaining power all the more difficult.watch| all you need to know about amar singh's role in the ongoing samajwadi pariwar read| as mulayam seeks to shield son, chorus grows for projecting akhilesh as sp's cm facesamajwadi party and mulayam singh yadav have often claimed in the past that the sp will never split till the time he is around. that boast will be put to a test in the days ahead.read| uttar pradesh's game of thrones: swot analysis of each netahere are the latest updates:mulayum singh's meeting with senior party leaders naresh, shivpal, and kiranmoy nanda is over now.mulayum is likely to take action against akhilesh yadav and ramgopal. removal of akhilesh as cm not ruled out, sources said.akhilesh will participate in the meeting called by mulayam singh on mondayamar singh is creating rift between father and son: akhilesh yadavshivpal yadav has returned his official car. he returned in his private car from mulayam's residence.sp leader neelam romila singh breaks down in front of media, says want whole yadav family to be togethersacking would not impact samajwadi party much. akhilesh has not spoken of a spilt in the party: sp leader azam khansacking a cabinet member comes under the purview of chief minister's right. we had a feeling that this day would arrive: azam khanmla raja bhaiya meets chief minister akhilesh yadav at his residencechief minister akhilesh yadav has been exposed from the very beginning: srikant sharma, bjp ",0.1519519519519519,"chief minister akhilesh yadav sacks uncle shivpal , declares war amar singh","swift sudden move , uttar pradesh chief minister akhilesh yadav today sacked uncle shivpal singh yadav senior minister cabinet second time.actor-turned-politician jaya prada also sacked post vice president film development council. according sources , pro-amar singh ministers likely dropped.meanwhile , samajwadi party chief mulayam singh yadav holding meeting senior party leaders lucknow chalk future course action party. cover story &#124; election : not-so-happy families samajwadi partythe samajwadi party fast hurtling towards split unless mulayam singh yadav son chief minister akhilesh yadav resolve differences right away , formal split party appears inevitable.the signs ominous pre-emptive strike , chief minister sacked 4 senior ministers including estranged uncle shivpal yadav government.the move comes heels meeting chief minister addressed morning mlas loyal residence ago.read &#124; building brand akhileshby sacking powerful shivpal yadav three supporters , cm thrown gauntlet indicated willingness part ways father.from magazine &#124; targeting akhilesh perfect recipe disaster samajwadi party?shivpal sacked : need know akhilesh vs mulayam pariwarthe amar factor cm ' move preceded series events seen steady deterioration relations father son also akhilesh uncle shivpal yadav. differences first arose induction amar singh party overriding strong opposition cm , ram gopal yadav azam khan.this followed differences merger qaumi ekta dal sp unceremonious replacement akhilesh yadav state president shivpal yadav.in past , every time crisis sp , mulayam singh yadav managed tide it. however , current crisis party seen akhilesh stand father.father-son split anticipated ? supported ramgopal yadav large number current crop party mlas mps , cm indicated willing part ways even father.read &#124; chief minister akhilesh yadav sacks uncle shivpal , declares war amar singh current crisis party could come inopportune time sp assembly elections uttar pradesh scheduled early next year. addition incumbency factor , split sp almost certainly make hopes regaining power difficult.watch &#124; need know amar singh ' role ongoing samajwadi pariwar read &#124; mulayam seeks shield son , chorus grows projecting akhilesh sp ' cm facesamajwadi party mulayam singh yadav often claimed past sp never split till time around. boast put test days ahead.read &#124; uttar pradesh ' game thrones : swot analysis netahere latest updates : mulayum singh ' meeting senior party leaders naresh , shivpal , kiranmoy nanda now.mulayum likely take action akhilesh yadav ramgopal. removal akhilesh cm ruled , sources said.akhilesh participate meeting called mulayam singh mondayamar singh creating rift father son : akhilesh yadavshivpal yadav returned official car. returned private car mulayam ' residence.sp leader neelam romila singh breaks front media , says want whole yadav family togethersacking would impact samajwadi party much. akhilesh spoken spilt party : sp leader azam khansacking cabinet member comes purview chief minister ' right. feeling day would arrive : azam khanmla raja bhaiya meets chief minister akhilesh yadav residencechief minister akhilesh yadav exposed beginning : srikant sharma , bjp","{'bjp': 1, 'cong': 0}",0,1
