Date,Title,Article,Sentiment,clean title,clean article,polarity,cong,bjp
2016-05-03,"uttar pradesh polls: after modi, akhilesh sets out to woo ballia","uttar pradesh chief minister akhilesh yadav headed to ballia district in poorvanchal region of the state on monday with a bunch of schemes, just a day after prime minister narendra modi launched the pradhan mantri ujwala yojana from there on sunday.his maiden speech at the foundation stone laying ceremony of the chandrashekhar university was mainly aimed at offering clarifications against allegations regarding the law and order situation in the state and boasting about the various schemes launched by his government over the past four years.""our dial 100 service is the fastest in the country and the cops reach the spot within 10 minutes. very soon, there will be no need for a complainant to go to the police station. the police will be at your doorstep,"" yadav said. taking a jibe at the centre's ujwala scheme, yadav asked ""cylinder toh mil jayega, usse bharwaoge kaise?(you will get a cylinder for free but how will you refill it?). our government is providing samajwadi pension to 30 lakh families and soon it will accommodate another 25 lakh families. it is just a matter of assessment and we will see how long the central government's pension scheme is on.""continuing with the attack, yadav said his four-year-old government could be pitted against the two-year-old central government on the basis of developmental works.""we have developed by many folds with our limited resources and have fulfilled all the promises we made during the last elections. we had high expectations from this (bjp) government and were hopeful that the central budget (for up) will increase. however, our hopes have all been in vain.""boasting further about the works carried out by his government, yadav said, ""we have laid the largest network of roads in the state. we are also increasing the production of electricity and the network of sub-stations set up has been the largest during our regime. besides, our lohia awas yojana, laptop scheme, kanya vidya dhan, and the rest can be cited as a benchmark achievement for uttar pradesh.""also read:law and order to affect outcome of uttar pradesh elections uttar pradesh assembly elections: rahul gandhi first choice for cm post, says congress ",0.08782738095238096,"uttar pradesh polls : modi , akhilesh sets woo ballia","uttar pradesh chief minister akhilesh yadav headed ballia district poorvanchal region state monday bunch schemes , day prime minister narendra modi launched pradhan mantri ujwala yojana sunday.his maiden speech foundation stone laying ceremony chandrashekhar university mainly aimed offering clarifications allegations regarding law order situation state boasting various schemes launched government past four years. "" dial 100 service fastest country cops reach spot within 10 minutes. soon , need complainant go police station. police doorstep , "" yadav said. taking jibe centre ' ujwala scheme , yadav asked "" cylinder toh mil jayega , usse bharwaoge kaise?( get cylinder free refill ? ) . government providing samajwadi pension 30 lakh families soon accommodate another 25 lakh families. matter assessment see long central government ' pension scheme on. "" continuing attack , yadav said four-year-old government could pitted two-year-old central government basis developmental works. "" developed many folds limited resources fulfilled promises made last elections. high expectations ( bjp ) government hopeful central budget ( ) increase. however , hopes vain. "" boasting works carried government , yadav said , "" laid largest network roads state. also increasing production electricity network sub-stations set largest regime. besides , lohia awas yojana , laptop scheme , kanya vidya dhan , rest cited benchmark achievement uttar pradesh. "" also read : law order affect outcome uttar pradesh elections uttar pradesh assembly elections : rahul gandhi first choice cm post , says congress","{'bjp': 1, 'cong': 1}",1,1
2016-05-31,revealed: bjp's masterplan for 2017 up assembly polls,"after scripting a historic victory in the just concluded assam assembly elections, the bharatiya janata party (bjp) has now started preparing for uttar pradesh assembly polls, scheduled to be held in 2017.coming two years ahead of the 2019 lok sabha polls, the up polls are crucial for the bjp. a good show in country's most populous state will give the saffron party a great impetus ahead going into the general elections.getting the caste mathematics rightbjp's chief strategist amit shah has already got down to business chalking out his party's tactics. shah knows that bjp must get its caste mathematics absolutely correct if it has to win uttar pradesh. amit shah and om mathur, who is considered close to pm modi, are the chief supervisors of bjp's up masterplan 2017.with an eye on the backward votebank, keshav prasad maurya was roped in as party's state unit president - the first move of the 'social engineering' the party is working upon in the state.why naqvi got rajya sabha ticket from jharkhandconsidering the caste equations, the bjp has decided to send mukhtar abbas naqvi to rajya sabha from jharkhand and bring shiv pratap shukla, a known brahmin face of the party in up, in his place. bjp's social engineers are aware that the party is unlikely to get a lot of muslim support in the state and sending naqvi to the upper house from uttar pradesh would have irked its core vote bank.more district chiefs from backward castesin the last couple of decades, 80 to 90 per cent of bjps district chiefs in uttar pradesh came from forward caste(brahmin or thakur). things are changing thick and fast now. out of the latest list of 94 district presidents, 44 belong to backward or extremely backward castes, 29 are brahmins, 10 thakurs, nine vaishyas and four dalits.during the bihar elections in 2010, the bjp and nitish kumar's jd(u) utilised the mahadalit card, successfully handing a massive defeat to lalu prasad's rjd and ram vilas paswan's ljp alliance. the bjp would like to work out a similar plan for up.the state has 35 per cent vote of yadav, jatav and muslim combine, and it is the remaining 65 per cent of vote share that the saffron party is eyeing. bjp strategy makers aim to strike a perfect balance between the backward and forward votebanks.eye on small but important playersthe bjp is also planning to dent bsp's core vote bank and for that it has already started luring extremely backward castes. it was precisely for this reason that amit shah addressed a rally of the rajbhar community in varanasi last year. the community has its presence in dewaria, balia, azamgarh, salempur and gazipur. bjp masterminds have suggested giving 10 seats to ashok rajbhar's bhartiya samaj party or persuade the local party leader to merge with the bjp ahead of polls.the bjp is already in alliance with the apna dal, the party which commands a handsome number of backward caste votes.dent in mayawati's core vote bankhome minister rajnath singh flagged off brahm chetna yatra from varanasi on april 24, a move seen as targeting buddhist voters.rajnath singh has even promised to build a buddha statue taller than the ones in bamiyan in afghanistan which were blown up by the taliban, if bjp came to power in uttar pradesh in next year's polls.shah, rajnath's rally marathonprime minister narendra modi sounded the poll bugle in uttar pradesh from saharanpur addressing a massive rally on the occasion of second anniversary of his government. today(may 31) amit shah had lunch at a dalit's house in allahabad following which he addressed a farmers gathering. the bjp chief is slated to host six party workers' seminars in the next one month. rajnath singh will be addressing at least six public rallies. the home minister will be in amroha on june 5, and in mau on june 9.no decision on cm candidate yetwhile the party is finalising its strategy, it is yet to zero in on the cm candidate. sources said that union ministers smriti irani and mahesh sharma are the top runners.however, insiders say that neither shah nor modi are keen on these two names. according to some media reports, the bjp is also likely ask veteran leader kalyan singh to lead the election campaign. the 84-year-old leader, who is currently serving as rajasthan governor, was once the face of the ram janmabhoomi movement.also read:country's changing but some minds refuse to change, says modi at saharanpur rally rss' welfare projects helping bjp ahead of 2017 uttar pradesh elections ",0.14550264550264552,revealed : bjp ' masterplan 2017 assembly polls,"scripting historic victory concluded assam assembly elections , bharatiya janata party ( bjp ) started preparing uttar pradesh assembly polls , scheduled held 2017.coming two years ahead 2019 lok sabha polls , polls crucial bjp. good show country ' populous state give saffron party great impetus ahead going general elections.getting caste mathematics rightbjp ' chief strategist amit shah already got business chalking party ' tactics. shah knows bjp must get caste mathematics absolutely correct win uttar pradesh. amit shah om mathur , considered close pm modi , chief supervisors bjp ' masterplan 2017.with eye backward votebank , keshav prasad maurya roped party ' state unit president - first move ' social engineering ' party working upon state.why naqvi got rajya sabha ticket jharkhandconsidering caste equations , bjp decided send mukhtar abbas naqvi rajya sabha jharkhand bring shiv pratap shukla , known brahmin face party , place. bjp ' social engineers aware party unlikely get lot muslim support state sending naqvi upper house uttar pradesh would irked core vote bank.more district chiefs backward castesin last couple decades , 80 90 per cent bjps district chiefs uttar pradesh came forward caste( brahmin thakur ) . things changing thick fast now. latest list 94 district presidents , 44 belong backward extremely backward castes , 29 brahmins , 10 thakurs , nine vaishyas four dalits.during bihar elections 2010 , bjp nitish kumar ' jd( u ) utilised mahadalit card , successfully handing massive defeat lalu prasad ' rjd ram vilas paswan ' ljp alliance. bjp would like work similar plan up.the state 35 per cent vote yadav , jatav muslim combine , remaining 65 per cent vote share saffron party eyeing. bjp strategy makers aim strike perfect balance backward forward votebanks.eye small important playersthe bjp also planning dent bsp ' core vote bank already started luring extremely backward castes. precisely reason amit shah addressed rally rajbhar community varanasi last year. community presence dewaria , balia , azamgarh , salempur gazipur. bjp masterminds suggested giving 10 seats ashok rajbhar ' bhartiya samaj party persuade local party leader merge bjp ahead polls.the bjp already alliance apna dal , party commands handsome number backward caste votes.dent mayawati ' core vote bankhome minister rajnath singh flagged brahm chetna yatra varanasi april 24 , move seen targeting buddhist voters.rajnath singh even promised build buddha statue taller ones bamiyan afghanistan blown taliban , bjp came power uttar pradesh next year ' polls.shah , rajnath ' rally marathonprime minister narendra modi sounded poll bugle uttar pradesh saharanpur addressing massive rally occasion second anniversary government. today( may 31 ) amit shah lunch dalit ' house allahabad following addressed farmers gathering. bjp chief slated host six party workers ' seminars next one month. rajnath singh addressing least six public rallies. home minister amroha june 5 , mau june 9.no decision cm candidate yetwhile party finalising strategy , yet zero cm candidate. sources said union ministers smriti irani mahesh sharma top runners.however , insiders say neither shah modi keen two names. according media reports , bjp also likely ask veteran leader kalyan singh lead election campaign. 84-year-old leader , currently serving rajasthan governor , face ram janmabhoomi movement.also read : country ' changing minds refuse change , says modi saharanpur rally rss ' welfare projects helping bjp ahead 2017 uttar pradesh elections","{'bjp': 17, 'cong': 0}",0,17
2016-06-10,posters touting varun gandhi as future bjp cm annoys high command,"a debate has been raging over the most suitable bjp candidate for the post of uttar pradesh's chief minister after assembly elections in 2017. supporters of bjp mp varun gandhi have now gone ahead and declared a poster war on the saffron party to press for his name as the cm choice.just days ahead of the bjp's crucial national executive meet in allahabad, massive hoardings with varun gandhi's face along with prime minister narendra modi and amit shah's images were found dotting the city.no crime, no corruption, this time bjp governmentone such big hoarding grabbing eyeballs is placed right outside bamrauli airport in allahabad. the big hoarding of varun gandhi along with prime minister narendra modi reads, ""na apradh, na brashtachar, abki baar bhajpa sarkar"" [no crime, no corruption, this time bjp government].images of modi detractorsurprisingly, many of the hoardings also have images of former modi detractor sanjay joshi and rebel mp shatrughan sinha.this open display of assertion by gandhi and his supporters have reportedly not gone down well with the party. a bjp leader in up said that chances are there that these posters may upset party president amit shah.sources said that varun's may 1 visit to allahabad also failed to go down well with the party's top leadership which has ordered the young leader to restrict his political activities to his sultanpur constituency.no influencehowever, some in the party feel that the sight of posters will play little role in influencing people's choice.""nothing is achieved out of these posters. the party works at the grassroot level and we will win the elections because of these workers,"" bjp national secretary shrikant sharma said.meanwhile, even though sources say that union home minister rajnath singh could lead the bjp in the up assembly elections, only two of the posters have his face.reports suggest that the most important reasons behind the bjp's clipping of varun's wings ahead of the up election is his refusal to toe the party's hindutva agenda. varun, who had once come close to being declared the bjp's poster boy after he was found guilty of hate speech in 2012, is no more seen echoing what his colleagues from up - yogi adityanath, sakshi maharaj, sanjeev balyan - are famous for.also read: why rajnath singh-for-cm is not going to be an easy campaign for bjp in up ",0.0731185002736727,posters touting varun gandhi future bjp cm annoys high command,"debate raging suitable bjp candidate post uttar pradesh ' chief minister assembly elections 2017. supporters bjp mp varun gandhi gone ahead declared poster war saffron party press name cm choice.just days ahead bjp ' crucial national executive meet allahabad , massive hoardings varun gandhi ' face along prime minister narendra modi amit shah ' images found dotting city.no crime , corruption , time bjp governmentone big hoarding grabbing eyeballs placed right outside bamrauli airport allahabad. big hoarding varun gandhi along prime minister narendra modi reads , "" na apradh , na brashtachar , abki baar bhajpa sarkar "" [ crime , corruption , time bjp government ] .images modi detractorsurprisingly , many hoardings also images former modi detractor sanjay joshi rebel mp shatrughan sinha.this open display assertion gandhi supporters reportedly gone well party. bjp leader said chances posters may upset party president amit shah.sources said varun ' may 1 visit allahabad also failed go well party ' top leadership ordered young leader restrict political activities sultanpur constituency.no influencehowever , party feel sight posters play little role influencing people ' choice. "" nothing achieved posters. party works grassroot level win elections workers , "" bjp national secretary shrikant sharma said.meanwhile , even though sources say union home minister rajnath singh could lead bjp assembly elections , two posters face.reports suggest important reasons behind bjp ' clipping varun ' wings ahead election refusal toe party ' hindutva agenda. varun , come close declared bjp ' poster boy found guilty hate speech 2012 , seen echoing colleagues - yogi adityanath , sakshi maharaj , sanjeev balyan - famous for.also read : rajnath singh-for-cm going easy campaign bjp","{'bjp': 11, 'cong': 0}",0,11
2016-06-12,"on kairana, bjp wants cbi probe, gives 15-day ultimatum to up","notwithstanding denials of any exodus of hindus from kairana town by the uttar pradesh government, bjp mla sangeet som today gave a 15-day 'ultimatum' to the state for the return of those who migrated from the town. meanwhile, his party has demanded a cbi inquiry into the alleged kairana migration.""we are giving an ultimatum to the state administration to bring back the people who left kairana within 15 days, otherwise no one will be able to stop us,"" som told reporters at sardhana village near kairana town in shamli district.""if in 15 days they do not return we're warning that no one will be able to stop bjp workers from going to kairana or to any other place,"" som, who is an accused in the 2013 muzaffarnagar riots case, said.bjp had made a u-turn on kairanabjp mp hukum singh had earlier claimed mass exodus of hindu families from kairana. on june 14, he stressed that the exodus was not a communal issue but of law and order. the bjp leader had told a tv channel that the people fled due to ""threats and extortion by criminal elements belonging to a particular community"".meanwhile, the local administration prevented som from entering kairana for holding a protest march in the area. prohibitory orders have been enforced across shamli district and borders of kairana sealed even as som suspended his march to the restive town.""we are bjp workers and respect law and order. we are not moving ahead as section 144 has been imposed by the administration but they will not be able to stop us if they fail to bring back the families which have migrated,"" som asserted.sangeet som's nirbhay rallysom had started his 'nirbhay' rally to kairana from his house in sardhana with thousands of followers but was stopped at the border of the town keeping in mind the situation. a rally by samawadi party, led by party leader atul pradhan, was also stopped some distance from sardhana town limits.all entrances to kairana have been sealed with the deployment of paramilitary forces with security officials keeping a watch on the situation.cbi probe into kairanameanwhile, a bjp delegation also met uttar pradesh governor ram naik and gave him a memorandum demanding a cbi inquiry on the kairana issue. with less than a year to go for the crucial uttar pradesh election, the explosive issue of kairana is likely to be kept on slow boil by the bjp and other parties in the state.also readin akhilesh yadav's uttar pradesh, mobster forces hindu exodus",-0.0037500000000000033,"kairana , bjp wants cbi probe , gives 15-day ultimatum","notwithstanding denials exodus hindus kairana town uttar pradesh government , bjp mla sangeet som today gave 15-day ' ultimatum ' state return migrated town. meanwhile , party demanded cbi inquiry alleged kairana migration. "" giving ultimatum state administration bring back people left kairana within 15 days , otherwise one able stop us , "" som told reporters sardhana village near kairana town shamli district. "" 15 days return ' warning one able stop bjp workers going kairana place , "" som , accused 2013 muzaffarnagar riots case , said.bjp made u-turn kairanabjp mp hukum singh earlier claimed mass exodus hindu families kairana. june 14 , stressed exodus communal issue law order. bjp leader told tv channel people fled due "" threats extortion criminal elements belonging particular community "" .meanwhile , local administration prevented som entering kairana holding protest march area. prohibitory orders enforced across shamli district borders kairana sealed even som suspended march restive town. "" bjp workers respect law order. moving ahead section 144 imposed administration able stop us fail bring back families migrated , "" som asserted.sangeet som ' nirbhay rallysom started ' nirbhay ' rally kairana house sardhana thousands followers stopped border town keeping mind situation. rally samawadi party , led party leader atul pradhan , also stopped distance sardhana town limits.all entrances kairana sealed deployment paramilitary forces security officials keeping watch situation.cbi probe kairanameanwhile , bjp delegation also met uttar pradesh governor ram naik gave memorandum demanding cbi inquiry kairana issue. less year go crucial uttar pradesh election , explosive issue kairana likely kept slow boil bjp parties state.also readin akhilesh yadav ' uttar pradesh , mobster forces hindu exodus","{'bjp': 6, 'cong': 0}",0,6
2016-06-12,"bjp on growth graph across india, says amit shah: latest updates","with an eye on the crucial uttar pradesh assembly election, prime minister narendra modi was in allahabad to attend bjp's two-day national executive meeting.in his address at the conclave, bjp president amit shah asked the party to gear up for the up elections. shah said that winning uttar pradesh is very important for the party.the prime minister also addressed the members for 10 minutes and emphasised on reinventing the party in sync with the changing times.key highlights senior members of the union cabinet, chief ministers of bjp-ruled states and members of parliament took part in the meet. party president amit shah along with the prime minister inaugurated the executive meeting.meanwhile, union minister ravi shankar prasad said the national executive will not name any chief ministerial candidate for the up polls, noting that such a decision can be taken only by the party s parliamentary board, its highest decision-making body.according to sources, for the crucial state polls in the hindi heartland, the party will play the card of caste and polarisation. it will also highlight modi government achievements.""there is goonda raj in uttar pradesh under akhilesh yadav. the cocktail politics of samajwadi party, bahujan samaj party, congress and rashtriya lok dal have ruined the state,"" bjp national secretary srikant sharma said.the national executive on its first day and shah in his speech did not refer to the party s core issue of ram temple with prasad saying that it was not necessary to take it up in every meeting but it was a matter of faith not elections for the party.pm modi also visited the historic allahabad high court in uttar pradesh today.modi reached the high court premises at 4 pm and was received by judges led by acting chief justice v k shukla and members of the bar association. he spent nearly an hour at the institution currently celebrating 150 years of its establishment.allahabad has turned into a fortress for this crucial meet of the bjp party. almost all the streets and roundabouts are dotted with billboards and posters.ahead of bjp's national executive meeting, rival parties have announced plans for protests in the city though aap has been denied permission for it, prompting it to move high court.congress said it will observe 12 june, the day of commencement of the prime minister's visit, as 'pol khol diwas' (day of expose) while its youth wing has announced a city bandh on sunday. also read: with eye on up polls, bjp national executive meet begins in allahabad: 10 things to know",0.10294117647058823,"bjp growth graph across india , says amit shah : latest updates","eye crucial uttar pradesh assembly election , prime minister narendra modi allahabad attend bjp ' two-day national executive meeting.in address conclave , bjp president amit shah asked party gear elections. shah said winning uttar pradesh important party.the prime minister also addressed members 10 minutes emphasised reinventing party sync changing times.key highlights senior members union cabinet , chief ministers bjp-ruled states members parliament took part meet. party president amit shah along prime minister inaugurated executive meeting.meanwhile , union minister ravi shankar prasad said national executive name chief ministerial candidate polls , noting decision taken party parliamentary board , highest decision-making body.according sources , crucial state polls hindi heartland , party play card caste polarisation. also highlight modi government achievements. "" goonda raj uttar pradesh akhilesh yadav. cocktail politics samajwadi party , bahujan samaj party , congress rashtriya lok dal ruined state , "" bjp national secretary srikant sharma said.the national executive first day shah speech refer party core issue ram temple prasad saying necessary take every meeting matter faith elections party.pm modi also visited historic allahabad high court uttar pradesh today.modi reached high court premises 4 pm received judges led acting chief justice v k shukla members bar association. spent nearly hour institution currently celebrating 150 years establishment.allahabad turned fortress crucial meet bjp party. almost streets roundabouts dotted billboards posters.ahead bjp ' national executive meeting , rival parties announced plans protests city though aap denied permission , prompting move high court.congress said observe 12 june , day commencement prime minister ' visit , ' pol khol diwas ' ( day expose ) youth wing announced city bandh sunday. also read : eye polls , bjp national executive meet begins allahabad : 10 things know","{'bjp': 6, 'cong': 1}",1,6
