Date,Title,Article,Sentiment,clean title,clean article,polarity,cong,bjp
2010-05-20,"raja is exposed, says cpi(m)","the communist party of india (marxist) on thursday demanded the resignation of communications minister a. raja, saying the vast difference in the prices garnered for 3g spectrum and the 2g spectrum “convincingly proved” that he was “involved in corrupt practices by selling 2g spectrum to some industrialists by manipulating trai telecom regulatory authority of india recommendations.”, in a statement, the cpi(m) pointed out that whereas rs. 70,000 crore was promised in the 3g auction, 2g was sold for just rs. 2,000 crore. this proved that “mr. raja had done so by blatantly violating the law, causing a huge loss to the public exchequer. despite repeated demands made in parliament and outside, he is nonchalantly continuing to stick to his position. such a situation cannot be allowed to be continued.”, “the cpi(m) demands that mr. raja immediately resign from his post pending a high-power enquiry into the entire 2g spectrum scam. if the minister refuses to resign, the prime minister should sack him to maintain the dignity of the high post mr. raja is holding in the government,” the statement said.",0.006000000000000008,"raja exposed , says cpi( )","communist party india ( marxist ) thursday demanded resignation communications minister a. raja , saying vast difference prices garnered 3g spectrum 2g spectrum “convincingly proved ” “involved corrupt practices selling 2g spectrum industrialists manipulating trai telecom regulatory authority india recommendations. ” , statement , cpi( ) pointed whereas rs. 70,000 crore promised 3g auction , 2g sold rs. 2,000 crore. proved “mr. raja done blatantly violating law , causing huge loss public exchequer. despite repeated demands made parliament outside , nonchalantly continuing stick position. situation cannot allowed continued. ” , “the cpi( ) demands mr. raja immediately resign post pending high-power enquiry entire 2g spectrum scam. minister refuses resign , prime minister sack maintain dignity high post mr. raja holding government , ” statement said .","{'bjp': 0, 'cong': 0}",0,0
2010-05-27,"tdp demands political reservation for women, minorities, bcs","a file picture of tdp president n. chandrababu naidu. photo: k.v. poornachandra kumar. , the telugu desam party (tdp) has demanded that political reservation be provided to women, minorities and other backward communities in parliament as well as state legislatures., “we shall fight for political reservation to these sections in the legislatures. the centre should immediately table the women’s reservation bill in lok sabha as well,” tdp chief n. chandrababu naidu said., delivering the presidential address after inaugurating the three-day annual conference of tdp - mahanadu - at gandipet near here on thursday, mr. naidu lashed out both at the upa government as well as the state government saying the congress party has become synonymous with corruption., “the upa government has failed to perform on all fronts, particularly in the last one year. major scandals are breaking out regularly but the government of india has failed to take any action even in one case, be it the ipl scandal or the 2g spectrum scam,” mr. naidu pointed out., it has also failed to crackdown on the mining mafia that was plundering national mineral wealth., “we have submitted all evidences against the mining mafia as well as former chief minister y. s. rajasekhara reddy but the manmohan singh government remained indifferent,” he alleged., on the other hand, the centre was misusing the central bureau of investigation to blackmail political opponents like mulayam singh yadav, lalu prasad yadav, j. jayalalithaa and sibu soren only to serve its political interests.",-0.07478070175438596,"tdp demands political reservation women , minorities , bcs","file picture tdp president n. chandrababu naidu. photo : k.v. poornachandra kumar. , telugu desam party ( tdp ) demanded political reservation provided women , minorities backward communities parliament well state legislatures. , “we shall fight political reservation sections legislatures. centre immediately table women ’ reservation bill lok sabha well , ” tdp chief n. chandrababu naidu said. , delivering presidential address inaugurating three-day annual conference tdp - mahanadu - gandipet near thursday , mr. naidu lashed upa government well state government saying congress party become synonymous corruption. , “the upa government failed perform fronts , particularly last one year. major scandals breaking regularly government india failed take action even one case , ipl scandal 2g spectrum scam , ” mr. naidu pointed out. , also failed crackdown mining mafia plundering national mineral wealth. , “we submitted evidences mining mafia well former chief minister y. s. rajasekhara reddy manmohan singh government remained indifferent , ” alleged. , hand , centre misusing central bureau investigation blackmail political opponents like mulayam singh yadav , lalu prasad yadav , j. jayalalithaa sibu soren serve political interests .","{'bjp': 0, 'cong': 1}",1,0
2010-07-06,"food security — of apl, bpl & ipl","caption : for daily : tirunelveli : july : 11/07/2007 : a boy about get rice during the mambazha sangam held at palayamkottai on wednesday. photo: a_shaikmohideen - caption : for daily : tirunelveli : july : 11/07/2007 : a boy about get rice during the mambazha sangam held at palayamkottai on wednesday. photo: a_shaikmohideen | photo credit: a_shaikmohideen - a_shaikmohideen , there was irony in the timing of the petrol price decontrol order. the decision, which also covered major hikes in diesel and kerosene prices, and affects hundreds of millions of people, came even as manmohan singh advised world leaders in toronto on the need for “inclusive growth.” and while we are still debating “food security” and how best that should be achieved in law. it came while food price inflation edges towards 17 per cent and general inflation is in double digits. who are we trying to “include” in that growth?, no less tragic was the media's reaction to the price decontrol. even as cabinet ministers sought to distance themselves from it, the editorials mostly reeked of triumphalism: “free at last,” screamed one. “a bold, welcome move,” shrilled another headline. with rare exceptions, the edits — in contrast to the response of millions to monday's bandh — showed yet again how far the mass media are from mass reality., most of the time, as the late murray kempton used to say, the job editorial writers do, is to “come down from the hills after the battle is over and shoot the wounded.” the media have done that definition proud. there's even been an editorial on bhopal in the same month that didn't wait for that battle to be over. it finds the villains of bhopal to be the “activist industry that continues to milk the tragedy.” and mourns the real tragedy: that “any corporation, across the world, would be forced to think twice before proudly announcing to its shareholders that it has set up an ancillary unit in bhopal.” it does not once mention the words “union carbide.” roll over kempton. the shooting's on., the early protests against the price rise got short shrift in the media. in the largest english daily, it earned a couple of stories spanning a modest few inches across three or four columns. the same daily twice devoted a full page — without an ad — on successive days to the death by suicide of a fashion model in mumbai. also, passing off without much comment this week — the elevation of our food and agriculture minister to the post of president of the international cricket council. at a time when the entire nation is focussed on the issue of food prices and food security., mr. pawar is quoted as saying (afp, new delhi, july 2) that he would request the prime minister to lessen his ministerial workload. “i may suggest having more hands to help me. i had asked for three ministers but they have given me only one,” he told journalists. “... if i request to reduce some of my work, we may find some solution.” however, he does promise us that “i won't allow my work in the government to suffer.” that's reassuring. maybe it's time for the prime minister to extend inclusive growth to bring the food and agriculture minister into food and agriculture. (or we could include cricket in that sector.) four ministers in the same field would be truly inclusive., yet the fuel price decontrol will profoundly affect the prices of just about everything. at a time of already spiralling food costs. punctuated by periodic claims that “it should come down within a couple of months,” from ministers and upa hacks., now comes the news that the food security bill may be set for a radical overhaul. i guess that is welcome — it can't be worse than the early attempts at drafting one. take for instance the meeting of the empowered group of ministers held in february. they were to “discuss the enactment of the proposed national food security bill.” the first thing the egom came up with was this gem. 2.1 (a) “the definition of food security should be limited to the specific issue of foodgrains (wheat and rice) and be delinked from the larger issue of nutritional security.”, food security delinked from nutritional security? note that the same line concedes nutritional security is “the larger issue.” why then the need to delink the two?, is 35 kg of rice at rs. 3 a kilo (for a section of the population) food security? are there no other determinants of food security? like health, nutrition, livelihoods, jobs, food prices? can we even delink the fuel price hike from discussions on food security? or from the wilful gutting of the public distribution system? or from the havoc wrought by the ever-growing futures trade in wheat, pulses, edible oils and more?, the truth is the government seeks ways to spend less and less on the very food security it talks about. hunger is defined not by how many people suffer it, but by how many the government is willing to pay for. hence the endless search for a lower bpl figure. to the government's great dismay, all three officially-constituted committees have turned up estimates of poverty higher than its own. even the tendulkar committee, closest to the ruling elite's worldview, raises the estimate of rural poverty to 42 per cent. (on a weak and fragile basis, it is true. but still higher than the government's count.), the bpl expert group headed by n.c. saxena raises that to around 50 per cent. while the report of the national commission for enterprises in the unorganised sector states on its first page that 836 million indians (77 per cent of our people) live on rs. 20 a day or less. accepting that, for instance, would mean a few thousand crores more in spending on the hungry. the official line is simple. since we cannot afford to feed all the hungry, there must only be as many hungry as we can afford to feed., most dishonest of all is the “there-is-no-money” line. the country spends rs. 10,000 crore on a new airport. there's rs. 40,000 crore or more for the commonwealth games. there's rs. 60,000 crore happily lost in the spectrum scam. there's rs. 500,000 crore in write-offs under just three heads for the super-rich and the corporate sector in the current union budget. but funds for the hungry are hard to come by. what would it cost to universalise the pds? pravin jha and nilachal acharya estimate that if rice/wheat were made available to all indians at rs. 3 a kilo, it would add rs.84,399 crore to the food subsidy in coming budgets. that's about one-sixth of the tax write-offs for the wealthy in this year's budget. (other estimates place the added expenditure each year at no more than rs. 45,000 crore)., what will be the costs of not finding the money — in a country which ranks at 66 among 88 in the global hunger index? in a nation whose child malnourishment record is worse than that of sub-saharan africa? a country now ranking 134 in the united nations human development index below bhutan and laos?, the same country that has 49 dollar billionaires in the forbes list. (many of whom receive government freebies in diverse forms. some for their ipl involvements). if a government will not even try to ensure that no citizen goes hungry, should it remain in power? or should it, at the very least, state honestly that the food security of every indian is neither its aim nor its intent? why tag ‘food security' to a bill that will legitimise the opposite? how can we call something a ‘right' if everyone does not have it?, a disclosure: i was a member of the bpl expert group. in a note annexed to that report, i argued that in four sectors — food, healthcare, education and decent work — access had to be universal. that flows from the directive principles of state policy of the constitution. the rights of our people are based on their being citizens. not on their ability to pay. not on their being bpl or apl (or even ipl). rights, by definition, are universal and indivisible.",0.12856203477490605,"food security — apl , bpl &amp; ipl","caption : daily : tirunelveli : july : 11/07/2007 : boy get rice mambazha sangam held palayamkottai wednesday. photo : a_shaikmohideen - caption : daily : tirunelveli : july : 11/07/2007 : boy get rice mambazha sangam held palayamkottai wednesday. photo : a_shaikmohideen &#124; photo credit : a_shaikmohideen - a_shaikmohideen , irony timing petrol price decontrol order. decision , also covered major hikes diesel kerosene prices , affects hundreds millions people , came even manmohan singh advised world leaders toronto need “inclusive growth. ” still debating “food security ” best achieved law. came food price inflation edges towards 17 per cent general inflation double digits. trying “include ” growth? , less tragic media ' reaction price decontrol. even cabinet ministers sought distance , editorials mostly reeked triumphalism : “free last , ” screamed one. “a bold , welcome move , ” shrilled another headline. rare exceptions , edits — contrast response millions monday ' bandh — showed yet far mass media mass reality. , time , late murray kempton used say , job editorial writers , “come hills battle shoot wounded. ” media done definition proud. ' even editorial bhopal month ' wait battle over. finds villains bhopal “activist industry continues milk tragedy. ” mourns real tragedy : “any corporation , across world , would forced think twice proudly announcing shareholders set ancillary unit bhopal. ” mention words “union carbide. ” roll kempton. shooting ' on. , early protests price rise got short shrift media. largest english daily , earned couple stories spanning modest inches across three four columns. daily twice devoted full page — without ad — successive days death suicide fashion model mumbai. also , passing without much comment week — elevation food agriculture minister post president international cricket council. time entire nation focussed issue food prices food security. , mr. pawar quoted saying ( afp , new delhi , july 2 ) would request prime minister lessen ministerial workload. “i may suggest hands help me. asked three ministers given one , ” told journalists. “ ... request reduce work , may find solution. ” however , promise us “i ' allow work government suffer. ” ' reassuring. maybe ' time prime minister extend inclusive growth bring food agriculture minister food agriculture. ( could include cricket sector. ) four ministers field would truly inclusive. , yet fuel price decontrol profoundly affect prices everything. time already spiralling food costs. punctuated periodic claims “it come within couple months , ” ministers upa hacks. , comes news food security bill may set radical overhaul. guess welcome — ' worse early attempts drafting one. take instance meeting empowered group ministers held february. “discuss enactment proposed national food security bill. ” first thing egom came gem. 2.1 ( ) “the definition food security limited specific issue foodgrains ( wheat rice ) delinked larger issue nutritional security. ” , food security delinked nutritional security ? note line concedes nutritional security “the larger issue. ” need delink two? , 35 kg rice rs. 3 kilo ( section population ) food security ? determinants food security ? like health , nutrition , livelihoods , jobs , food prices ? even delink fuel price hike discussions food security ? wilful gutting public distribution system ? havoc wrought ever-growing futures trade wheat , pulses , edible oils more? , truth government seeks ways spend less less food security talks about. hunger defined many people suffer , many government willing pay for. hence endless search lower bpl figure. government ' great dismay , three officially-constituted committees turned estimates poverty higher own. even tendulkar committee , closest ruling elite ' worldview , raises estimate rural poverty 42 per cent. ( weak fragile basis , true. still higher government ' count. ) , bpl expert group headed n.c. saxena raises around 50 per cent. report national commission enterprises unorganised sector states first page 836 million indians ( 77 per cent people ) live rs. 20 day less. accepting , instance , would mean thousand crores spending hungry. official line simple. since cannot afford feed hungry , must many hungry afford feed. , dishonest “there-is-no-money ” line. country spends rs. 10,000 crore new airport. ' rs. 40,000 crore commonwealth games. ' rs. 60,000 crore happily lost spectrum scam. ' rs. 500,000 crore write-offs three heads super-rich corporate sector current union budget. funds hungry hard come by. would cost universalise pds ? pravin jha nilachal acharya estimate rice/wheat made available indians rs. 3 kilo , would add rs.84,399 crore food subsidy coming budgets. ' one-sixth tax write-offs wealthy year ' budget. ( estimates place added expenditure year rs. 45,000 crore ) . , costs finding money — country ranks 66 among 88 global hunger index ? nation whose child malnourishment record worse sub-saharan africa ? country ranking 134 united nations human development index bhutan laos? , country 49 dollar billionaires forbes list. ( many receive government freebies diverse forms. ipl involvements ) . government even try ensure citizen goes hungry , remain power ? , least , state honestly food security every indian neither aim intent ? tag ‘food security ' bill legitimise opposite ? call something ‘right ' everyone it? , disclosure : member bpl expert group. note annexed report , argued four sectors — food , healthcare , education decent work — access universal. flows directive principles state policy constitution. rights people based citizens. ability pay. bpl apl ( even ipl ) . rights , definition , universal indivisible .","{'bjp': 0, 'cong': 0}",0,0
2010-11-14,yechury demands central level probe in adarsh scam,"a file picture of cpi(m) polit bureau member sitaram yechury. photo: rajeev bhatt , cpi(m) politburo member sitaram yechury today demanded a central level probe in adarsh society scam, terming the issue as an insult to nation since flats in the society were meant for kargil war heroes and widows., “an in-depth probe should be made by the central government in adarsh scam and leaders and officials involved in it should be punished to crush the evil practises in the country,” mr. yechury told media here., “a joint parliamentary committee will be welcomed to investigate the matter,” he said, adding that but the committee should not be appointed to put the burning issue in back burner., “it is an insult for the nation since flats in adarsh society were meant for the kargil war heroes and families of those who laid down their lives in the war, but the flats were allotted to politicians and bureaucrats,” mr. yechury said., the senior communist leader also demanded that union power minister sushil kumar shinde and heavy industries minister vilasrao deshmukh should resign on moral grounds owing to the allegations levelled against them in adarsh scam., “congress party should not hesitate to initiate action against mr. shinde and mr. deshmukh. had mr. shinde been clear in the scam, he would have come forward immediately to clarify his position before the press in his home town (solapur),” mr. yechury said., mr. yechury also criticised prime minister manmohan singh for protecting union telecom minister a raja in 2g spectrum scam., “prime minister should come forward and clarify about all the allegations levelled against mr. raja,” he said., “central government is gripped with scams, corruption and mismanagement and failing on all fronts. it should step down or punish the corrupt forces,” mr. yechury said., “we are helpless as we have no other option to form a new government after toppling the upa in centre. we want to keep bjp out from the power so we urge the current government to gear up,” he made it clear.",-0.09451546717171716,yechury demands central level probe adarsh scam,"file picture cpi( ) polit bureau member sitaram yechury. photo : rajeev bhatt , cpi( ) politburo member sitaram yechury today demanded central level probe adarsh society scam , terming issue insult nation since flats society meant kargil war heroes widows. , “an in-depth probe made central government adarsh scam leaders officials involved punished crush evil practises country , ” mr. yechury told media here. , “a joint parliamentary committee welcomed investigate matter , ” said , adding committee appointed put burning issue back burner. , “it insult nation since flats adarsh society meant kargil war heroes families laid lives war , flats allotted politicians bureaucrats , ” mr. yechury said. , senior communist leader also demanded union power minister sushil kumar shinde heavy industries minister vilasrao deshmukh resign moral grounds owing allegations levelled adarsh scam. , “congress party hesitate initiate action mr. shinde mr. deshmukh. mr. shinde clear scam , would come forward immediately clarify position press home town ( solapur ) , ” mr. yechury said. , mr. yechury also criticised prime minister manmohan singh protecting union telecom minister raja 2g spectrum scam. , “prime minister come forward clarify allegations levelled mr. raja , ” said. , “central government gripped scams , corruption mismanagement failing fronts. step punish corrupt forces , ” mr. yechury said. , “we helpless option form new government toppling upa centre. want keep bjp power urge current government gear , ” made clear .","{'bjp': 1, 'cong': 1}",1,1
