Date,Title,Article,Sentiment,clean title,clean article,polarity,cong,bjp
2011-01-12,"sorry people, we're hanging up on you","new delhi, 07/01/2011: union minister of communications and information technology, kapil sibal addressing a press conference on telecom issues including 2g spectrum in new delhi on friday, 07, january, 2011. photo: s_subramanium | photo credit: s_subramanium , “milord,” cunning lawyers have argued in countless hindi movies, “how can there have been a murder when there is no dead body?” i was reminded of this line when i heard kapil sibal — who has been performing as an understudy at the ministry of communications and information technology ever since a. raja was ousted on corruption charges — bravely defending the legacy of his predecessor at a press conference. by attacking the comptroller and auditor general's 2g spectrum scam report and claiming the government lost no revenue despite the fact that “procedural irregularities in the implementation of the first-come first-served policy” may have occurred, mr. sibal has done the political equivalent of removing the “dead body” from the crime scene and then declaring his clients innocent. for if the government lost no money through the sale of spectrum in 2008, it stands to reason that the politicians, bureaucrats and businessmen who are today being investigated could not have made any money either. illegitimate profits cannot be conjured out of thin air — which is what spectrum essentially is. there is no dead body milord., sadly for prime minister manmohan singh and congress president sonia gandhi, who no doubt prepped mr. sibal to make his ill-advised arguments, the cag report is full of incriminating corpses. and their ghosts are likely to stick around long enough to haunt the ruling party at the time of the next general election., the central thrust of mr. sibal's argument is that the pac used flawed logic to arrive at the conclusion that the sale of universal access service licenses by the department of telecom in 2008 led to a revenue loss of rs.1,76,000 crore. but here's what he chose not to say. the cag itself acknowledged in its concluding chapter that the amount of loss could be debated but “the fact that there has been loss to the national exchequer in the allocation of 2g spectrum cannot be denied.”, indeed, the cag made separate calculations based on four different methodologies in order to demonstrate the flawed nature of the licensing system the dot ran. the figure cited by mr. sibal came from using the 3g spectrum auction proceeds as a guide to the revenue the government gave up by not auctioning 2g spectrum. other methods used were looking at the sale of equity by shell-company licensees swan telecom and unitech. both of these companies sold a chunk of their otherwise worthless equity to established operators, thereby providing a helpful indication of what the licenses they had bought for a song were truly worth. extrapolating from those sales figures, the cag estimated that the government short-changed itself by anywhere from rs.57,666 crore to rs.69,626 crore., the cag report methodically establishes how the great spectrum robbery of 2008 was essentially a scam within a scam. the original scam was designed to benefit the universe of existing and potential telecom operators by selling them a scarce resource — spectrum — on a first come, first served (fcfs) basis at a seven-year-old price that had no bearing on current market conditions. given the exponential increase in teledensity between 2001 and 2008 — by some estimates, the number of mobile subscribers had already risen from four million to 300 million and was expected to continue to grow at a rapid clip — the failure to use an efficient price discovery mechanism meant the government was prepared to forsake an enormous amount of revenue in order to benefit operators fortunate enough to get hold of new spectrum., but having scripted super profits for the lucky telecom companies in the spectrum allocation process, it was inevitable that the politicians and bureaucrats running the show would take the next step. the only way to accumulate rent from companies benefiting from a giveaway that is available to all as a matter of policy is to use one's allocative power to favour some over others. this was the genesis of the second scam in which a handful of applicants — many of whom were completely unqualified to be applying for telecom licenses at all — were cherry-picked by the dot in an arbitrary subversion of the first come, first served process. the cag report demonstrates how swan, in which the anil dhirubhai ambani group had a key stake, and unitech were among the beneficiaries of this. bank drafts and guarantees were prepared in advance by some companies who were unofficially tipped off so that their completed applications for spectrum could be submitted literally within minutes and hours of the official call going out., mr. sibal, who tore into the cag, was sporting enough to admit there may have been some wrongdoing in the manner in which the fcfs policy was implemented. at the same time, he insisted the policy of charging 2001 prices was correct and that a 2g spectrum auction would have led to an increase in the price of telecom services. what he ignores is the fact that the cost of telecom services emerging from the 2g allocation will be a function not of the absurdly low price at which the government sold spectrum but of the prevailing tariff rate in the market and also the higher resale price at which this precious commodity finally enters the system. to paraphrase an argument first made by sunil jain in the financial express last year, there was indeed an auction for 2g spectrum whether mr. sibal approves of auctioning or not. but this auction was conducted not by the government, as it should have been, but by the companies who benefited from the arbitrary manner in which spectrum ended up getting allocated. they simply turned around and resold what they had received to the highest bidder., mr. sibal also sought to argue that the government policy on spectrum allocation — of underpricing it or even giving it away free — was justified in the name of keeping the cost of basic telephony down. he compared the rs.17 a minute cost of a mobile phone call a decade back with the 30 paise per minute rate today to prove his point but this is a flawed argument. most technology-driven consumer goods and services experience a declining price curve over time. i paid $1,000 as a graduate student in new york for my first laptop computer in 1990. it was a no-brand, 386 chip, 40mb hard drive heavyweight monster whose battery lasted about an hour if i was lucky. today, $1,000 will buy you a powerful notebook and decent variants can be bought for as little as $300. it also cost me $2 a minute to call my parents back home (which is why i rarely did so). the last time i was in the u.s., i could call india for eight cents a minute. the drop in call rates has nothing to do with subsidised spectrum as mr. sibal would have us believe, but with competition, increases in productivity and the global ebb and flow of technological change and obsolescence which allowed indian companies to buy 2g network equipment at a relatively inexpensive cost. in any case, even at the supposedly low call rates in india, telecom operators are making serious money. the last thing they need is a free handout in the form of an fcfs spectrum allocation policy, that too one which is rigged., the government's argument about keeping mobile call rates low may have had some credibility if the logic was applied consistently. but everything in india is contingent on whose asset is being sold to whom. when a public asset like spectrum is to be sold to a private company like anil ambani's swan telecom, or to tata or others, we are told the price must be kept low even if there is a revenue loss. when a public asset like food grain is to be sold to the poor under the proposed right to food act, the same people say prices cannot be kept low because this would lead to a revenue loss. when a public resource like krishna-godavari (kg) gas comes into the hands of an industrialist like mukesh ambani, the price must be kept high even if this means consumers end up paying a higher price for electricity and fertilizers. from 2g to kg to cwg the system's logic and rules will always be designed to allow maximum profits for those with real connections.",0.06444228701581642,"sorry people , ' hanging","new delhi , 07/01/2011 : union minister communications information technology , kapil sibal addressing press conference telecom issues including 2g spectrum new delhi friday , 07 , january , 2011. photo : s_subramanium &#124; photo credit : s_subramanium , “milord , ” cunning lawyers argued countless hindi movies , “how murder dead body ? ” reminded line heard kapil sibal — performing understudy ministry communications information technology ever since a. raja ousted corruption charges — bravely defending legacy predecessor press conference. attacking comptroller auditor general ' 2g spectrum scam report claiming government lost revenue despite fact “procedural irregularities implementation first-come first-served policy ” may occurred , mr. sibal done political equivalent removing “dead body ” crime scene declaring clients innocent. government lost money sale spectrum 2008 , stands reason politicians , bureaucrats businessmen today investigated could made money either. illegitimate profits cannot conjured thin air — spectrum essentially is. dead body milord. , sadly prime minister manmohan singh congress president sonia gandhi , doubt prepped mr. sibal make ill-advised arguments , cag report full incriminating corpses. ghosts likely stick around long enough haunt ruling party time next general election. , central thrust mr. sibal ' argument pac used flawed logic arrive conclusion sale universal access service licenses department telecom 2008 led revenue loss rs.1,76,000 crore. ' chose say. cag acknowledged concluding chapter amount loss could debated “the fact loss national exchequer allocation 2g spectrum cannot denied. ” , indeed , cag made separate calculations based four different methodologies order demonstrate flawed nature licensing system dot ran. figure cited mr. sibal came using 3g spectrum auction proceeds guide revenue government gave auctioning 2g spectrum. methods used looking sale equity shell-company licensees swan telecom unitech. companies sold chunk otherwise worthless equity established operators , thereby providing helpful indication licenses bought song truly worth. extrapolating sales figures , cag estimated government short-changed anywhere rs.57,666 crore rs.69,626 crore. , cag report methodically establishes great spectrum robbery 2008 essentially scam within scam. original scam designed benefit universe existing potential telecom operators selling scarce resource — spectrum — first come , first served ( fcfs ) basis seven-year-old price bearing current market conditions. given exponential increase teledensity 2001 2008 — estimates , number mobile subscribers already risen four million 300 million expected continue grow rapid clip — failure use efficient price discovery mechanism meant government prepared forsake enormous amount revenue order benefit operators fortunate enough get hold new spectrum. , scripted super profits lucky telecom companies spectrum allocation process , inevitable politicians bureaucrats running show would take next step. way accumulate rent companies benefiting giveaway available matter policy use one ' allocative power favour others. genesis second scam handful applicants — many completely unqualified applying telecom licenses — cherry-picked dot arbitrary subversion first come , first served process. cag report demonstrates swan , anil dhirubhai ambani group key stake , unitech among beneficiaries this. bank drafts guarantees prepared advance companies unofficially tipped completed applications spectrum could submitted literally within minutes hours official call going out. , mr. sibal , tore cag , sporting enough admit may wrongdoing manner fcfs policy implemented. time , insisted policy charging 2001 prices correct 2g spectrum auction would led increase price telecom services. ignores fact cost telecom services emerging 2g allocation function absurdly low price government sold spectrum prevailing tariff rate market also higher resale price precious commodity finally enters system. paraphrase argument first made sunil jain financial express last year , indeed auction 2g spectrum whether mr. sibal approves auctioning not. auction conducted government , , companies benefited arbitrary manner spectrum ended getting allocated. simply turned around resold received highest bidder. , mr. sibal also sought argue government policy spectrum allocation — underpricing even giving away free — justified name keeping cost basic telephony down. compared rs.17 minute cost mobile phone call decade back 30 paise per minute rate today prove point flawed argument. technology-driven consumer goods services experience declining price curve time. paid $ 1,000 graduate student new york first laptop computer 1990. no-brand , 386 chip , 40mb hard drive heavyweight monster whose battery lasted hour lucky. today , $ 1,000 buy powerful notebook decent variants bought little $ 300. also cost $ 2 minute call parents back home ( rarely ) . last time u.s. , could call india eight cents minute. drop call rates nothing subsidised spectrum mr. sibal would us believe , competition , increases productivity global ebb flow technological change obsolescence allowed indian companies buy 2g network equipment relatively inexpensive cost. case , even supposedly low call rates india , telecom operators making serious money. last thing need free handout form fcfs spectrum allocation policy , one rigged. , government ' argument keeping mobile call rates low may credibility logic applied consistently. everything india contingent whose asset sold whom. public asset like spectrum sold private company like anil ambani ' swan telecom , tata others , told price must kept low even revenue loss. public asset like food grain sold poor proposed right food act , people say prices cannot kept low would lead revenue loss. public resource like krishna-godavari ( kg ) gas comes hands industrialist like mukesh ambani , price must kept high even means consumers end paying higher price electricity fertilizers. 2g kg cwg system ' logic rules always designed allow maximum profits real connections .","{'bjp': 0, 'cong': 1}",1,0
2011-01-24,alliances to be finalised before february 20: pandian,"alliances for the ensuing tamil nadu assembly election will be finalised before february 20, said d. pandian, state secretary of the communist party of india., “the party is talking to the all india anna dravida munnetra kazhagam, communist party of india (marxist), marumalarchi dravida munnetra kazhagam and a few other like-minded parties on cementing the alliance,” he told reporters in coimbatore on monday., he clarified that in the interests of better governance, the left was aligning with the aiadmk knowing fully well that it had frozen recruitment for government jobs in the past., efforts are on to “strengthen and broaden” the alliance, which would then be able to remove the ruling combine that had “failed on all fronts”, mr. pandian said., there would be a common manifesto, which would reflect the left parties’ concern on the need to increase employment opportunities, power generation, environment protection and other issues. the parties would also come out with separate manifestoes., the parties in the alliance were not worried that the ruling combine would indulge in electoral malpractices as it was said have to done during by-elections, mr. pandian said, adding that assembly elections were a different game altogether., ""in by-elections the ruling party concentrated all its energy and resources on a constituency, which would not be possible in the assembly elections. and, they were not so crucial as to bring about a change in government, which is the case with the forthcoming elections,"" mr. pandian said., ""moreover, the spectrum scam, price rise, failure to allot lands to the poor, shortage of power, would weigh high on the people’s mind when they vote and this would bring about a change in government,"" mr. pandian added., referring to the killing of n. jayakumar, a fisherman from nagapattinam, mr. pandian said indian fishermen continued to be killed on the seas because of wrong policies of the union government. jayakumar was allegedly killed by the sri lankan navy, who, according to mr. pandian, chopped of his fingers and strangulated him., “if the indian government that is able to rescue hijacked ships from pirates off the yemeni sea is failing in its duty to protect the lives of tamil fishermen, there is something seriously wrong. it is nothing but a sheer failure on the part of the government to protect the lives of its citizens.”, the assurance of the finance minister, pranab mukherjee, on taking up the issue with sri lanka was not convincing enough, mr. pandian said.",-0.11243589743589744,alliances finalised february 20 : pandian,"alliances ensuing tamil nadu assembly election finalised february 20 , said d. pandian , state secretary communist party india. , “the party talking india anna dravida munnetra kazhagam , communist party india ( marxist ) , marumalarchi dravida munnetra kazhagam like-minded parties cementing alliance , ” told reporters coimbatore monday. , clarified interests better governance , left aligning aiadmk knowing fully well frozen recruitment government jobs past. , efforts “strengthen broaden ” alliance , would able remove ruling combine “failed fronts ” , mr. pandian said. , would common manifesto , would reflect left parties ’ concern need increase employment opportunities , power generation , environment protection issues. parties would also come separate manifestoes. , parties alliance worried ruling combine would indulge electoral malpractices said done by-elections , mr. pandian said , adding assembly elections different game altogether. , "" by-elections ruling party concentrated energy resources constituency , would possible assembly elections. , crucial bring change government , case forthcoming elections , "" mr. pandian said. , "" moreover , spectrum scam , price rise , failure allot lands poor , shortage power , would weigh high people ’ mind vote would bring change government , "" mr. pandian added. , referring killing n. jayakumar , fisherman nagapattinam , mr. pandian said indian fishermen continued killed seas wrong policies union government. jayakumar allegedly killed sri lankan navy , , according mr. pandian , chopped fingers strangulated him. , “if indian government able rescue hijacked ships pirates yemeni sea failing duty protect lives tamil fishermen , something seriously wrong. nothing sheer failure part government protect lives citizens. ” , assurance finance minister , pranab mukherjee , taking issue sri lanka convincing enough , mr. pandian said .","{'bjp': 0, 'cong': 0}",0,0
2011-01-25,sibal's comments,"the editorial “wake-up call for sibal” (jan. 24) could not have been more candid. though the supreme court is monitoring the cbi probe into the 2g spectrum scam, it is naive to expect the premier investigating agency to be entirely unbiased in its efforts to unravel the truth. till the completion of investigation, communications minister kapil sibal must exercise restraint and avoid controversial comments., p.k .varadarajan,, chennai, mr. sibal has been chastised for his folly, but the editorial seems to have left out mr. montek singh ahluwalia, deputy chairman of the planning commission, who has attacked the cag report in interviews to the electronic media. two high ranking officials, in quick succession, rubbishing the report, maintaining that there is no loss at all to the exchequer, leads to the suspicion that the government is trying to obfuscate the issue.",0.23041666666666666,sibal ' comments,"editorial “wake-up call sibal ” ( jan. 24 ) could candid. though supreme court monitoring cbi probe 2g spectrum scam , naive expect premier investigating agency entirely unbiased efforts unravel truth. till completion investigation , communications minister kapil sibal must exercise restraint avoid controversial comments. , p.k .varadarajan ,, chennai , mr. sibal chastised folly , editorial seems left mr. montek singh ahluwalia , deputy chairman planning commission , attacked cag report interviews electronic media. two high ranking officials , quick succession , rubbishing report , maintaining loss exchequer , leads suspicion government trying obfuscate issue .","{'bjp': 0, 'cong': 0}",0,0
2011-01-27,true ramifications of 2g spectrum scam alarming,"aiadmk general secretary j. jayalalithaa has alleged that a firm, to which 2g licence was issued, was linked to a shareholder of another firm, who was a “front man” of mafia don dawood ibrahim. file photo , all india anna dravida munnetra kazhagam (aiadmk) general secretary jayalalithaa said on thursday that the true ramifications of the 2g spectrum scam were alarming and impinged on the nation's security in a big way., in a statement here, she said several critical issues had gone unnoticed as everyone was fascinated by the loss of rs.1.80 lakh crore to exchequer., “frightening insights”, a closer look at the companies granted licence at “ridiculously low rates gave frightening insights into a conspiracy by global forces inimical to the interests of the country.”, the union home ministry had sought security-linked information from a company — whether it had operations in pakistan and afghanistan and a technical tie-up with a chinese telecom equipment maker., the ministry had also expressed concern that the chinese company had the capability to remotely manipulate the equipment it supplied to clients., it was strange that the telecom ministry under former minister a. raja cleared all the deals despite the home ministry raising objections at various stages.",-0.06818181818181819,true ramifications 2g spectrum scam alarming,"aiadmk general secretary j. jayalalithaa alleged firm , 2g licence issued , linked shareholder another firm , “front man ” mafia dawood ibrahim. file photo , india anna dravida munnetra kazhagam ( aiadmk ) general secretary jayalalithaa said thursday true ramifications 2g spectrum scam alarming impinged nation ' security big way. , statement , said several critical issues gone unnoticed everyone fascinated loss rs.1.80 lakh crore exchequer. , “frightening insights ” , closer look companies granted licence “ridiculously low rates gave frightening insights conspiracy global forces inimical interests country. ” , union home ministry sought security-linked information company — whether operations pakistan afghanistan technical tie-up chinese telecom equipment maker. , ministry also expressed concern chinese company capability remotely manipulate equipment supplied clients. , strange telecom ministry former minister a. raja cleared deals despite home ministry raising objections various stages .","{'bjp': 0, 'cong': 0}",0,0
