Date,Title,Article,Sentiment,clean title,clean article,polarity,cong,bjp
2011-09-22,"will cbi investigate finance ministry note, asks brinda karat","cpi(m) polit bureau member brinda karat has demanded to know if the central bureau of investigations (cbi) would include in its investigation the office memorandum from the finance ministry to the prime minister’s office showing that home minister p. chidambaram had, while holding charge of finance, played an active role in deciding the price of 2g spectrum in 2008., inaugurating the new state committee office of the all india democratic women’s association (aidwa) here on thursday, ms. karat pointed out that the letter had not been letter by any of the opposition leaders or the left parties, but the second most important minister in the united progressive alliance (upa) cabinet after prime minister manmohan singh. the office memorandum from the finance ministry clearly showed that there was a conspiracy involved in deciding the 2g spectrum price and that the government owed an explanation to the people about mr. chidambaram’s real role in the 2g spectrum scam, she said., the cpi(m) leader said that the argument that benefits of economic growth under the new policy regime would percolate from the top to the lower layers of society, being propounded by the advocates of neo-liberalism, was more suited to explain the manner in which corruption was spreading top-down under the upa government. like the river that gets polluted all along its course once the source is polluted, the entire system of governance under the upa was getting corrupted from the very source of power, she added., coming down heavily on the planning commission’s position that rs. 26 constituted adequate private daily individual expenditure on food, education and health in the rural areas, mr. karat asked the prime minister, who is also chairman of the planning commission, to clarify what was the justification for this finding. the planning commission had arrived such a conclusion at a time prices were shooting through the roof, the latest trigger being the hike in petrol price, the situation was likely to turn worse the government takes away the subsidy on cooking gas. the left was of the firm view that the government should revive the administered pricing mechanism in respect of petroleum products, she said.",0.09347041847041848,"cbi investigate finance ministry note , asks brinda karat","cpi( ) polit bureau member brinda karat demanded know central bureau investigations ( cbi ) would include investigation office memorandum finance ministry prime minister ’ office showing home minister p. chidambaram , holding charge finance , played active role deciding price 2g spectrum 2008. , inaugurating new state committee office india democratic women ’ association ( aidwa ) thursday , ms. karat pointed letter letter opposition leaders left parties , second important minister united progressive alliance ( upa ) cabinet prime minister manmohan singh. office memorandum finance ministry clearly showed conspiracy involved deciding 2g spectrum price government owed explanation people mr. chidambaram ’ real role 2g spectrum scam , said. , cpi( ) leader said argument benefits economic growth new policy regime would percolate top lower layers society , propounded advocates neo-liberalism , suited explain manner corruption spreading top-down upa government. like river gets polluted along course source polluted , entire system governance upa getting corrupted source power , added. , coming heavily planning commission ’ position rs. 26 constituted adequate private daily individual expenditure food , education health rural areas , mr. karat asked prime minister , also chairman planning commission , clarify justification finding. planning commission arrived conclusion time prices shooting roof , latest trigger hike petrol price , situation likely turn worse government takes away subsidy cooking gas. left firm view government revive administered pricing mechanism respect petroleum products , said .","{'bjp': 0, 'cong': 0}",0,0
2011-10-04,the indulgence which turned gas into gold,"before 2g was kg: the cag has said “irregularities” in ril’s operation of the kg basin d-6 block gasfield have led to an as yet unquantified loss to the public exchequer. in this file photo from 2008, reliancechief mukesh ambani greets senior pmo officials m.k. narayanan, now the governor of west bengal, andt.k.a. nair, as murli deora, who was union minister for petroleum and natural gas, looks on. photo: rajeev bhatt | photo credit: rajeev bhatt , the dust has not even settled on the 2g spectrum scam and the manmohan singh government has been hit by another storm: the report of the comptroller and auditor general (cag) on irregularities committed in the offshore kg basin d-6 block to favour the mukesh ambani-owned reliance industries limited. parliamentarian tapan sen — a rajya sabha member from the communist party of india (marxist) — has been demanding a probe into the kg project for the past six years. the final cag report has corroborated many of the issues mr. sen had raised with the petroleum ministry as well as with the prime minister and his office. a member of parliament's standing committee on petroleum and natural gas, he spoke to sujay mehdudia on the alleged regularities, the indifferent attitude of the prime minister and pmo, and the nexus between ril and the upa government in gas exploration in the kg basin. excerpts from the interview:, with the cag's final report out, should the government launch a full-fledged investigation into the kg basin operations of ril?, an investigation should have been ordered long back. the cag has only confirmed the issues raised by me during the past six years. the upa government has been in denial mode on corruption in the kg basin d-6 block. it is dragging its feet and does not want to take on a private contractor who has indulged in unjust drainage of the national exchequer. right from the issue of gold plating to raising the gas price irrationally and abnormally, everything has been done to satisfy the private contractor. now the circle is complete. gold-plating was done to get a bigger profit in whichever manner possible. allowing gold-plating at the beginning and then hiking the gas price to almost what had been demanded by the private contractor indicated a nexus at the highest level. despite repeated pleas, the government has been indifferent to the issue. i have read in the media that the cbi is looking into the issue but till something concrete happens or it emerges from the cbi that they have launched investigations into the matter, i would not like to believe reports that a probe is actually happening., what is the most important aspect of this issue that needs to be probed?, the matter is linked to energy, which is very important and a lifeline for the people and the country. the whole issue relates to fuel, and national interest was not taken on priority. this issue has brought out the holes in the system and questions the integrity of the whole system of governance. the irregularities in kg basin d-6 block need to be probed on top priority., what was being done was so visible right from day-one. it all began with the submission of the field development plan (fdp) by ril. the initial fdp was for production of 40 mmscmd million metric standard cubic metres per day of gas at a cost of $2.47 billion. subsequently, the fdp was amended and the production target was raised to 80 mmscmd but the fdp went up four times to a whopping $8.84 billion. the whole fdp was approved by the director-general of hydrocarbons, v.k. sibal, who is facing cbi investigations now, in 33 days flat. how could such a big cost escalation be approved in just 33 days, that too when doubts had been raised inside and outside parliament?, do you think that the $4.2-per-mmbtu price fixed by the empowered group of ministers in 2007 was unjustified keeping in mind that international gas prices had been declining?, unfortunately, the whole governance is captivated by the corporates today. the government went ahead and approved the gas price almost in toto — to what was suggested by ril. a slight difference was made to say that they had not accepted what ril suggested. there was another impropriety done. ril, which quoted $4.3 per mmbtu to the egom, quoted $2.34 per mmbtu in the international competitive bidding tender of ntpc. they would not have quoted $2.34 per mmbtu without keeping a profit margin. the same ril is on record in the supreme court on an affidavit that their basic cost of exploring gas is much less than $2 per mmbtu. the committee of secretaries had opposed the gas price being fixed at $4.2 per mmbtu. the power and fertilizer minister had opposed that price. all this was given in writing to the egom headed by pranab mukherjee, that ntpc would be losing rs.24,000 crore on two projects — gandhar and kawas — if the $4.2 price was accepted instead of the tender price of $2.34. but the egom went ahead and approved a higher price shamelessly. i think the gold-plating issue needs to be probed thoroughly, but also the issue of gas price fixing. the truth should be brought out before the people who have been burdened and made to shell out more to benefit a private contractor. at that point of time, too, i had asked the government to explain on what basis ril fixed the price of $4.3. the egom, just to posture and fool the people, agreed to $4.2., how do you see the role of the prime minister and the pmo in this whole matter?, without being too uncharitable, i can say the role of the pmo and the prime minister has been indulgent. it is not something post facto as the prime minister has been claiming in various cases. the issue was pointed out by me way back in 2006. the matter was raised in parliament. every fact was put in the public domain, in writing, but no action was taken for some strange reason. the cag and its report came on the scene much later. i cannot but point the finger at the prime minister in this whole affair, and not single out the petroleum ministry as they do not have the power to do such a big thing. like a. raja cannot be singled out in the 2g scam, one man cannot be singled out. others cannot just wash their hands off in the present system of governance. in 2007, i wrote to the prime minister pointing out the irregularities. i wrote that i am not satisfied with the petroleum ministry's presentation made to me. i wrote four or five times. only once was it acknowledged., what do you make of the sudden fall in production of gas from the kg basin d-6 block?",0.07025189786059352,indulgence turned gas gold,"2g kg : cag said “irregularities ” ril ’ operation kg basin d-6 block gasfield led yet unquantified loss public exchequer. file photo 2008 , reliancechief mukesh ambani greets senior pmo officials m.k. narayanan , governor west bengal , andt.k.a. nair , murli deora , union minister petroleum natural gas , looks on. photo : rajeev bhatt &#124; photo credit : rajeev bhatt , dust even settled 2g spectrum scam manmohan singh government hit another storm : report comptroller auditor general ( cag ) irregularities committed offshore kg basin d-6 block favour mukesh ambani-owned reliance industries limited. parliamentarian tapan sen — rajya sabha member communist party india ( marxist ) — demanding probe kg project past six years. final cag report corroborated many issues mr. sen raised petroleum ministry well prime minister office. member parliament ' standing committee petroleum natural gas , spoke sujay mehdudia alleged regularities , indifferent attitude prime minister pmo , nexus ril upa government gas exploration kg basin. excerpts interview : , cag ' final report , government launch full-fledged investigation kg basin operations ril? , investigation ordered long back. cag confirmed issues raised past six years. upa government denial mode corruption kg basin d-6 block. dragging feet want take private contractor indulged unjust drainage national exchequer. right issue gold plating raising gas price irrationally abnormally , everything done satisfy private contractor. circle complete. gold-plating done get bigger profit whichever manner possible. allowing gold-plating beginning hiking gas price almost demanded private contractor indicated nexus highest level. despite repeated pleas , government indifferent issue. read media cbi looking issue till something concrete happens emerges cbi launched investigations matter , would like believe reports probe actually happening. , important aspect issue needs probed? , matter linked energy , important lifeline people country. whole issue relates fuel , national interest taken priority. issue brought holes system questions integrity whole system governance. irregularities kg basin d-6 block need probed top priority. , done visible right day-one. began submission field development plan ( fdp ) ril. initial fdp production 40 mmscmd million metric standard cubic metres per day gas cost $ 2.47 billion. subsequently , fdp amended production target raised 80 mmscmd fdp went four times whopping $ 8.84 billion. whole fdp approved director-general hydrocarbons , v.k. sibal , facing cbi investigations , 33 days flat. could big cost escalation approved 33 days , doubts raised inside outside parliament? , think $ 4.2-per-mmbtu price fixed empowered group ministers 2007 unjustified keeping mind international gas prices declining? , unfortunately , whole governance captivated corporates today. government went ahead approved gas price almost toto — suggested ril. slight difference made say accepted ril suggested. another impropriety done. ril , quoted $ 4.3 per mmbtu egom , quoted $ 2.34 per mmbtu international competitive bidding tender ntpc. would quoted $ 2.34 per mmbtu without keeping profit margin. ril record supreme court affidavit basic cost exploring gas much less $ 2 per mmbtu. committee secretaries opposed gas price fixed $ 4.2 per mmbtu. power fertilizer minister opposed price. given writing egom headed pranab mukherjee , ntpc would losing rs.24,000 crore two projects — gandhar kawas — $ 4.2 price accepted instead tender price $ 2.34. egom went ahead approved higher price shamelessly. think gold-plating issue needs probed thoroughly , also issue gas price fixing. truth brought people burdened made shell benefit private contractor. point time , , asked government explain basis ril fixed price $ 4.3. egom , posture fool people , agreed $ 4.2. , see role prime minister pmo whole matter? , without uncharitable , say role pmo prime minister indulgent. something post facto prime minister claiming various cases. issue pointed way back 2006. matter raised parliament. every fact put public domain , writing , action taken strange reason. cag report came scene much later. cannot point finger prime minister whole affair , single petroleum ministry power big thing. like a. raja cannot singled 2g scam , one man cannot singled out. others cannot wash hands present system governance. 2007 , wrote prime minister pointing irregularities. wrote satisfied petroleum ministry ' presentation made me. wrote four five times. acknowledged. , make sudden fall production gas kg basin d-6 block ?","{'bjp': 0, 'cong': 0}",0,0
2011-10-23,summons for 28 witnesses,"the cbi's star witness in the 2g spectrum scam case, senior telecom department official a.k. srivastava, does not figure in the first list of 28 witnesses the prosecution wants summoned to depose at the trial starting on november 11., instead, it will be two officials of the reliance ada group and an executive of etisalat db telecom. their summons was sought for november 11., the first list sought to be served were issued for dates between november 11 and 28, with an average of three witnesses being summoned on each date. there are a total of 164 prosecution witnesses, including niira radia.",0.09166666666666666,summons 28 witnesses,"cbi ' star witness 2g spectrum scam case , senior telecom department official a.k. srivastava , figure first list 28 witnesses prosecution wants summoned depose trial starting november 11. , instead , two officials reliance ada group executive etisalat db telecom. summons sought november 11. , first list sought served issued dates november 11 28 , average three witnesses summoned date. total 164 prosecution witnesses , including niira radia .","{'bjp': 0, 'cong': 0}",0,0
2011-10-25,graft: c.t. ravi turns the tables on congress,"c.t.ravi addressing at press meet at bjp party office in mangalore on monday. , mla c.t. ravi said on monday that the track ecord of the bharatiya janata party (bjp) in dealing with corruption cases was much better than that of congress party., addressing presspersons here, mr. ravi said that the amount of total scams in just three years of the second innings of the congress-led-united progressive alliance (upa) itself came to a whopping rs. 4 lakh crore., though the congress claimed that it had taken action on those accused in the 2g spectrum scam, commonwealth games scam and others, the fact was that action was taken after nearly a year of sustained pressure., but whenever a scam connected to any person in the bjp arose, the party immediately took action against them. even in the case of the bjp leader b.s. yeddyurappa, he was asked to resign immediately after the lokayukta submitted its report., “the bjp has never and will never shield the corrupt,” he said. mr. ravi regretted that the whistle-blower mps of the bjp had been arrested in the cash-for-votes scam while the guilty walked scot-free., most of the corruption cases engulfing the centre had been exposed by the comptroller and auditor-general of india. the upa had not taken action against delhi chief minister sheila dikshit although she had been named by the lokayukta there in a scam. action had not been taken against the rajasthan chief minister ashok gehlot although he had failed to tackle corruption., action was not taken against the former chief minister of andhra pradesh the late y.s. rajasekhara reddy, although there were several corruption cases against him., “hence the congress, which ruled this country for a long time and has a litany of scams to its credit, has no moral authority to question the credentials of the senior bjp leader l.k. advani's jan chetana yatra”, he said., mr. advani's yatra would reach udupi at 2 p.m. on october 31., mr. advani would address a public meeting at the rajangana parking area here. he would stay at murudeshwar in uttara kannada district overnight. he would address public meetings at kumta and karwar the following day, mr. ravi said., bjp district unit president udaykumar shetty said that mr. advani's yatra would be given a grand reception at hejmady, the southern border of udupi district on its arrival., bjp leaders tingale vikramarjuna hegde, mattar ratnakar hegde, and katapady shankar poojary were present.",0.013999999999999995,graft : c.t. ravi turns tables congress,"c.t.ravi addressing press meet bjp party office mangalore monday. , mla c.t. ravi said monday track ecord bharatiya janata party ( bjp ) dealing corruption cases much better congress party. , addressing presspersons , mr. ravi said amount total scams three years second innings congress-led-united progressive alliance ( upa ) came whopping rs. 4 lakh crore. , though congress claimed taken action accused 2g spectrum scam , commonwealth games scam others , fact action taken nearly year sustained pressure. , whenever scam connected person bjp arose , party immediately took action them. even case bjp leader b.s. yeddyurappa , asked resign immediately lokayukta submitted report. , “the bjp never never shield corrupt , ” said. mr. ravi regretted whistle-blower mps bjp arrested cash-for-votes scam guilty walked scot-free. , corruption cases engulfing centre exposed comptroller auditor-general india. upa taken action delhi chief minister sheila dikshit although named lokayukta scam. action taken rajasthan chief minister ashok gehlot although failed tackle corruption. , action taken former chief minister andhra pradesh late y.s. rajasekhara reddy , although several corruption cases him. , “hence congress , ruled country long time litany scams credit , moral authority question credentials senior bjp leader l.k. advani ' jan chetana yatra ” , said. , mr. advani ' yatra would reach udupi 2 p.m. october 31. , mr. advani would address public meeting rajangana parking area here. would stay murudeshwar uttara kannada district overnight. would address public meetings kumta karwar following day , mr. ravi said. , bjp district unit president udaykumar shetty said mr. advani ' yatra would given grand reception hejmady , southern border udupi district arrival. , bjp leaders tingale vikramarjuna hegde , mattar ratnakar hegde , katapady shankar poojary present .","{'bjp': 9, 'cong': 3}",3,9
2011-10-30,niira radia says ‘tata’ to the pr business,"new delhi: corporate lobbyist niira radia leaves the enforcement directorate after being questioned on her firms' alleged role in the 2g spectrum allocation case, in new delhi on wednesday. pti photo by aman sharma (pti11_24_2010_000153b) , niira radia — the formidably networked corporate lobbyist whose leaked telephone conversations with politicians, journalists and businessmen tarnished or destroyed the reputation, and even career, of many movers and shakers in the capital, has decided to quit the public relations business., in a statement on sunday, ms. radia, whose top clients include the tata group and mukesh ambani's reliance industries ltd., cited personal reasons for her decision. “to give precedence to my personal priorities of family and health, i have decided against renewing any client mandates and to exit the business of communications consultancy. it is a painful decision which has been taken after much consideration and consultation with my family, doctors, clients and colleagues,” she said., efforts on to place employees elsewhere, she is the head of vaishnavi corporate communications pvt. ltd. (vccpl) and an associate of hers told the hindu that the company was shutting down. efforts are on to place its 200-odd employees elsewhere, with ril already absorbing 30., though she made her reputation operating below the radar as a person who could get things done during the bjp-led nda government, ms. radia came into the limelight in 2009 after it was alleged that she lobbied successfully for dmk politician a. raja, now in the tihar jail in the 2g spectrum scam, to get him the telecom portfolio in the congress-led upa-ii. it is also alleged that she influenced government decisions in favour of the tata group's communications business.",0.061430090377458814,niira radia says ‘tata ’ pr business,"new delhi : corporate lobbyist niira radia leaves enforcement directorate questioned firms ' alleged role 2g spectrum allocation case , new delhi wednesday. pti photo aman sharma ( pti11_24_2010_000153b ) , niira radia — formidably networked corporate lobbyist whose leaked telephone conversations politicians , journalists businessmen tarnished destroyed reputation , even career , many movers shakers capital , decided quit public relations business. , statement sunday , ms. radia , whose top clients include tata group mukesh ambani ' reliance industries ltd. , cited personal reasons decision. “to give precedence personal priorities family health , decided renewing client mandates exit business communications consultancy. painful decision taken much consideration consultation family , doctors , clients colleagues , ” said. , efforts place employees elsewhere , head vaishnavi corporate communications pvt. ltd. ( vccpl ) associate told hindu company shutting down. efforts place 200-odd employees elsewhere , ril already absorbing 30. , though made reputation operating radar person could get things done bjp-led nda government , ms. radia came limelight 2009 alleged lobbied successfully dmk politician a. raja , tihar jail 2g spectrum scam , get telecom portfolio congress-led upa-ii. also alleged influenced government decisions favour tata group ' communications business .","{'bjp': 0, 'cong': 0}",0,0
