Date,Title,Article,Sentiment,clean title,clean article,polarity,cong,bjp
2011-04-16,"‘swan, a front company of reliance adag'","the central bureau of investigation in a reply filed to the bail applications moved by 2g spectrum scam accused senior reliance ada group officials gautam doshi, surendra pipara and hari nair on friday said that it was the group's managing director mr. doshi's “brain child” to use swan telecom as a “front company” of reliance ada group for applying for unified access service (uas) licences for disguising the actual ownership and control., this was done to circumvent the department of telecommunication's uas licence guidelines dated december 14, 2005, that prohibited a company from having more than 10 per cent equity in more than one licensee company for the same service area. the guidelines also required a submission of a certificate from the applicant company's secretary along with the uas licence application., the cbi's reply said that “hari nair in collusion with surendra pipara and gautam doshi submitted false certificates to dot as company secretary regarding shareholding pattern of swan telecom falsely declaring that reliance telecom had only minority stake (9.9 per cent) in swan.”, the agency said the accused persons “instead of withdrawing fraudulent application in the name of swan telecom which was not eligible at all, allowed the transfer of control of swan to dynamix balwa group and thus enabled perpetuating an illegality.”, the cbi also said the trio also “facilitated the new management of swan telecom to get uas licences on the basis of applications filed by the former management.” the cbi charged that the transfer of management of swan telecom to the db group and the sale of equity held by it to delphi investments, mauritius, had “enabled reliance telecom to earn a profit of around rs. 10 crore which was otherwise not possible if they had withdrawn the applications.”",0.030578512396694194,"‘swan , front company reliance adag '","central bureau investigation reply filed bail applications moved 2g spectrum scam accused senior reliance ada group officials gautam doshi , surendra pipara hari nair friday said group ' managing director mr. doshi ' “brain child ” use swan telecom “front company ” reliance ada group applying unified access service ( uas ) licences disguising actual ownership control. , done circumvent department telecommunication ' uas licence guidelines dated december 14 , 2005 , prohibited company 10 per cent equity one licensee company service area. guidelines also required submission certificate applicant company ' secretary along uas licence application. , cbi ' reply said “hari nair collusion surendra pipara gautam doshi submitted false certificates dot company secretary regarding shareholding pattern swan telecom falsely declaring reliance telecom minority stake ( 9.9 per cent ) swan. ” , agency said accused persons “instead withdrawing fraudulent application name swan telecom eligible , allowed transfer control swan dynamix balwa group thus enabled perpetuating illegality. ” , cbi also said trio also “facilitated new management swan telecom get uas licences basis applications filed former management. ” cbi charged transfer management swan telecom db group sale equity held delphi investments , mauritius , “enabled reliance telecom earn profit around rs. 10 crore otherwise possible withdrawn applications . ”","{'bjp': 0, 'cong': 0}",0,0
2011-04-23,vs to lead ‘satyagraha' on monday,"kerala chief minister v.s. achuthanandan addresses the media in thiruvananthapuram. , kerala government and various non-governmental organisations in the state will organise protests across the state on monday demanding ban on endosulfan as the conference of parties of the stockholm convention meets in geneva to consider a global ban., chief minister v.s. achuthanandan will lead a mass ‘satyagraha' from 10 a.m. to 5 p.m. at the martyrs' column here demanding that india should adopt a stand in favour of the ban at the convention, and that the centre should provide assistance to the state to compensate victims of endosulfan. his cabinet colleagues will lead sit-ins at district headquarters., the chief minister took strong objection to prime minister manmohan singh not conceding the demand of an all-party delegation from kerala for a national ban on endosulfan and support for the cause at the convention. “the prime minister should not use his office to promote the pesticide lobby like the union minister for agriculture sharad pawar,” he said adding that mr. singh should look into the issues presented by the delegation on friday seriously., urging mr. singh to rethink his stand, the chief minister called upon the prime minister to discuss the matter in the cabinet. union ministers from kerala should also rethink their stand and support the ban. it was regrettable that the centre was not assisting the state to provide the compensation recommended by the national human rights commission to the victims., he warned that the prime minister would face situation similar to the 2g spectrum scam and people's protest against corruption under the leadership of anna hazare if he went by the views of people like mr. pawar. mr. pawar was one who had supported the sugar lobby ignoring the cause of farmers., now, he was claiming that he was trying to protect the interests of farmers elsewhere in india. no government should ignore the travails of the people on the ground that they were from two states only., describing union minister for environment and forests jairam ramesh as ‘‘anti-people and anti-environment,'' mr. achuthanandan asked whether mr. ramesh did not know that endosulfan was dangerous. people of 96 villages in his home state of karnataka had been hit by the pesticide., minister for law m. vijayakumar said that endosulfan caused the biggest humanitarian problem in kerala causing the death of hundreds and rendering thousands ill in the plantation areas. members of parliament, the assembly and the local self-governments and political, social, cultural and trade union leaders would join the protest on monday. the opposition leaders had also been invited to join the protest. mass gatherings in districts would take pledges against endosulfan., as a prelude to the programmes, an exhibition of paintings would be organised at the martyrs' column on sunday., the green community announced that it would organise ‘satyagraha' from april 25 to 29 in front of the secretariat to coincide with the meeting of the conference of parties of stockholm convention. several other non-governmental organisations announced that they would join the ‘satyagraha' on monday.",-0.07447916666666668,vs lead ‘satyagraha ' monday,"kerala chief minister v.s. achuthanandan addresses media thiruvananthapuram. , kerala government various non-governmental organisations state organise protests across state monday demanding ban endosulfan conference parties stockholm convention meets geneva consider global ban. , chief minister v.s. achuthanandan lead mass ‘satyagraha ' 10 a.m. 5 p.m. martyrs ' column demanding india adopt stand favour ban convention , centre provide assistance state compensate victims endosulfan. cabinet colleagues lead sit-ins district headquarters. , chief minister took strong objection prime minister manmohan singh conceding demand all-party delegation kerala national ban endosulfan support cause convention. “the prime minister use office promote pesticide lobby like union minister agriculture sharad pawar , ” said adding mr. singh look issues presented delegation friday seriously. , urging mr. singh rethink stand , chief minister called upon prime minister discuss matter cabinet. union ministers kerala also rethink stand support ban. regrettable centre assisting state provide compensation recommended national human rights commission victims. , warned prime minister would face situation similar 2g spectrum scam people ' protest corruption leadership anna hazare went views people like mr. pawar. mr. pawar one supported sugar lobby ignoring cause farmers. , , claiming trying protect interests farmers elsewhere india. government ignore travails people ground two states only. , describing union minister environment forests jairam ramesh ‘‘anti-people anti-environment , ' ' mr. achuthanandan asked whether mr. ramesh know endosulfan dangerous. people 96 villages home state karnataka hit pesticide. , minister law m. vijayakumar said endosulfan caused biggest humanitarian problem kerala causing death hundreds rendering thousands ill plantation areas. members parliament , assembly local self-governments political , social , cultural trade union leaders would join protest monday. opposition leaders also invited join protest. mass gatherings districts would take pledges endosulfan. , prelude programmes , exhibition paintings would organised martyrs ' column sunday. , green community announced would organise ‘satyagraha ' april 25 29 front secretariat coincide meeting conference parties stockholm convention. several non-governmental organisations announced would join ‘satyagraha ' monday .","{'bjp': 0, 'cong': 0}",0,0
2011-04-26,top politicians and corporate honchos rub shoulders in tihar,"the high-profile, mighty and powerful — all are lodged in delhi's tihar jail, one of the largest prison complexes in the world., politicians, high-ranking bureaucrats and top corporate honchos are all rubbing shoulders, thanks to the crackdown of the central bureau of investigation in at least two cases: the scam in the commonwealth games and the 2g spectrum allocation., in the spectrum scam alone, the jail is home to the former communications minister, a. raja; his close aide r.k. chandolia; the then telecom secretary, siddharth behura; db realty chief shahid balwa and his partner vinod goenka; unitech chief sanjay chandra; and the top officials of the reliance adag group g. doshi, hari nair and surendra pipada., two former top officials of the commonwealth games organising committee — lalit bhanot and v. k.verma, both considered close associates of the former organising committee chairman, suresh kalmadi — are still lodged in one of the prisons in the tihar complex. mr. kalmadi, arrested by the cbi on monday, is also likely to head to the tihar jail at the end of his eight-day police custody., “probably, it is the first time that so many top members of india inc. are lodged in the tihar jail. it also shows how the politician-bureaucrat-corporate nexus is working to engineer scams, and a crackdown by an agency like the cbi at least has been able to make a dent in it,” sources in the cbi said., the agency arrested national aluminium company ltd. chief a.k. srivastav, his wife and two others about a month ago in a case of bribery. the four are still cooling their heels in the jail., mr. raja, arrested on february 2 and sent to the jail later, has been the least demanding of prisoners. “inside the jail, no one is a vip. high-profile prisoners are not given any extra facilities unless ordered by the court,” the jail's public relations officer sunil gupta said here on tuesday., other prisoners with high connections include manu sharma, who was awarded a life term in the jessica lall murder case; santosh singh, a criminal lawyer and son of a former ips officer who was handed life sentence in the priyadarshini mattoo murder case; and the former ips officer, r.k. sharma, convicted in the murder of journalist shivani bhatnagar., the tihar complex, with nine prisons, and the rohini district jail together have a sanctioned capacity of 6,250 prisoners, but are crowded, with 12,000.",0.03644736842105263,top politicians corporate honchos rub shoulders tihar,"high-profile , mighty powerful — lodged delhi ' tihar jail , one largest prison complexes world. , politicians , high-ranking bureaucrats top corporate honchos rubbing shoulders , thanks crackdown central bureau investigation least two cases : scam commonwealth games 2g spectrum allocation. , spectrum scam alone , jail home former communications minister , a. raja ; close aide r.k. chandolia ; telecom secretary , siddharth behura ; db realty chief shahid balwa partner vinod goenka ; unitech chief sanjay chandra ; top officials reliance adag group g. doshi , hari nair surendra pipada. , two former top officials commonwealth games organising committee — lalit bhanot v. k.verma , considered close associates former organising committee chairman , suresh kalmadi — still lodged one prisons tihar complex. mr. kalmadi , arrested cbi monday , also likely head tihar jail end eight-day police custody. , “probably , first time many top members india inc. lodged tihar jail. also shows politician-bureaucrat-corporate nexus working engineer scams , crackdown agency like cbi least able make dent , ” sources cbi said. , agency arrested national aluminium company ltd. chief a.k. srivastav , wife two others month ago case bribery. four still cooling heels jail. , mr. raja , arrested february 2 sent jail later , least demanding prisoners. “inside jail , one vip. high-profile prisoners given extra facilities unless ordered court , ” jail ' public relations officer sunil gupta said tuesday. , prisoners high connections include manu sharma , awarded life term jessica lall murder case ; santosh singh , criminal lawyer son former ips officer handed life sentence priyadarshini mattoo murder case ; former ips officer , r.k. sharma , convicted murder journalist shivani bhatnagar. , tihar complex , nine prisons , rohini district jail together sanctioned capacity 6,250 prisoners , crowded , 12,000 .","{'bjp': 0, 'cong': 0}",0,0
2011-04-27,small but significant step,"the supplementary charge sheet in the 2g spectrum allocation case is a small but significant step for the central bureau of investigation in what is clearly a difficult journey in pursuit of truth and justice. the first charge sheet kept out some sensitive names for reasons of political expediency. the second deals mostly with one money trail, involving about rs.200 crore, from swan telecom to kalaignar tv, which is but a small part of the rs.22,000 crore that the cbi estimates to be the loss to the government in the spectrum scam. however, in the context of the criminal investigation of the case, this money trail plays a crucial role by laying bare an intricate web of financial transactions which, decoded, could establish a quid pro quo between politicians in power and businessmen who benefited from the manipulation of the ‘first-come, first-served' policy in spectrum allocation. true, kalaignar tv paid back the amount with interest, but this was only between december 2010 and february 2011 after the cbi registered the case, which seemed more like a cover-up attempt. moreover, during the period of the transaction between december 2008 and august 2009, the paid-up equity of kalaignar tv was merely rs.10.01 crore, and its entire income for the year ending march 31, 2009 rs.47.54 crore. not surprisingly, the judge of the special court, taking cognisance of the charge sheet, said he was satisfied that there was “enough incriminating material on record to proceed against the accused persons.”",0.030505952380952377,small significant step,"supplementary charge sheet 2g spectrum allocation case small significant step central bureau investigation clearly difficult journey pursuit truth justice. first charge sheet kept sensitive names reasons political expediency. second deals mostly one money trail , involving rs.200 crore , swan telecom kalaignar tv , small part rs.22,000 crore cbi estimates loss government spectrum scam. however , context criminal investigation case , money trail plays crucial role laying bare intricate web financial transactions , decoded , could establish quid pro quo politicians power businessmen benefited manipulation ‘first-come , first-served ' policy spectrum allocation. true , kalaignar tv paid back amount interest , december 2010 february 2011 cbi registered case , seemed like cover-up attempt. moreover , period transaction december 2008 august 2009 , paid-up equity kalaignar tv merely rs.10.01 crore , entire income year ending march 31 , 2009 rs.47.54 crore. surprisingly , judge special court , taking cognisance charge sheet , said satisfied “enough incriminating material record proceed accused persons . ”","{'bjp': 0, 'cong': 0}",0,0
2011-04-27,laudable,"the cbi deserves praise for making progress in its investigations into the commonwealth games scam and the 2g spectrum scam. the arrest of suresh kalmadi in the cwg scam and the charge sheeting of kanimozhi and four others in the 2g case, irrespective of their status and political clout, is heartening. people are the least bothered about the government's coalition compulsions. they expect action against corruption., arjun r. shankar,, thiruvananthapuram, the cartoon (april 26) speaks volumes about corruption in the upa government. the arrest of mr. kalmadi and the charge sheeting of ms kanimozhi and others have reinforced people's faith in the cbi. what people also want to know is where the huge sums alleged to have been paid as bribes have gone. what we see is only the tip of the iceberg. one hopes to see the bigger players also exposed.",9.251858538542969e-18,laudable,"cbi deserves praise making progress investigations commonwealth games scam 2g spectrum scam. arrest suresh kalmadi cwg scam charge sheeting kanimozhi four others 2g case , irrespective status political clout , heartening. people least bothered government ' coalition compulsions. expect action corruption. , arjun r. shankar ,, thiruvananthapuram , cartoon ( april 26 ) speaks volumes corruption upa government. arrest mr. kalmadi charge sheeting ms kanimozhi others reinforced people ' faith cbi. people also want know huge sums alleged paid bribes gone. see tip iceberg. one hopes see bigger players also exposed .","{'bjp': 0, 'cong': 0}",0,0
2011-04-30,draft report of the pac and draft recommendations on the 2g spectrum scam,"we publish here the draft report of parliament's public accounts committee (pac) on the 2g spectrum scam and the draft recommendations of the pac. these were not adopted by the pac at its highly contentious meeting of april 28, 2011. eleven of the 21 committee members claimed to have ""voted"" to reject the draft report and pac chairman dr. murli manohar joshi adjourned the meeting and walked out, claiming he had done this to give himself time to examine certain allegations made by members.the hindu is publishing these documents, which contain a lot of factual detail, so that readers can make up their own minds on various aspects of the 2g spectrum scam, including questions of ministerial and prime ministerial accountability.",0.19485714285714284,draft report pac draft recommendations 2g spectrum scam,"publish draft report parliament ' public accounts committee ( pac ) 2g spectrum scam draft recommendations pac. adopted pac highly contentious meeting april 28 , 2011. eleven 21 committee members claimed "" voted "" reject draft report pac chairman dr. murli manohar joshi adjourned meeting walked , claiming done give time examine certain allegations made members.the hindu publishing documents , contain lot factual detail , readers make minds various aspects 2g spectrum scam , including questions ministerial prime ministerial accountability .","{'bjp': 0, 'cong': 0}",0,0
2011-05-05,kanimozhi says she’ll come out clean in the 2g case,"ahead of her appearance before a cbi court in connection with the 2g spectrum scam, dmk mp kanimozhi on thursday said that she would fight the case legally and come out of it clean., “it is a very, very serious charge and that i am very clear and i am very sure that we will come out of it and i will come out of it clean,” she told tv channels when asked about the cbi court summons to her to appear before it on friday. she has been named in the second charge sheet filed by the cbi in the 2g case., 43-year-old kanimozhi, daughter of dmk chief m. karunanidhi, said, “we will fight it legally and there is nothing to say that i am a co-conspirator and we will face it legally.”, the rajya sabha mp, who has also been asked by the enforcement directorate to appear before it in connection with the 2g case under the prevention of money laundering act, said she believed in the legal system of the country and that she will abide by it., “whatever the court decides, i will accept,” she said., in its supplementary charge sheet filed in a special court on april 25, the cbi had accused ms. kanimozhi of entering into a criminal conspiracy with former telecom minister a raja for allegedly accepting illegal gratification through kalaignar tv — a channel run by the ruling dmk in tamil nadu, in which the money related to the 2g scam was routed., dismissing any difference in the dmk first family on the issue, she said, “my family is not divided on this issue. my family stands with the party’s decision. my family stands together along with whatever decisions the leader and the party have made. i think this is another perception which some people in the press are trying to create.”",0.08747899159663865,kanimozhi says ’ come clean 2g case,"ahead appearance cbi court connection 2g spectrum scam , dmk mp kanimozhi thursday said would fight case legally come clean. , “it , serious charge clear sure come come clean , ” told tv channels asked cbi court summons appear friday. named second charge sheet filed cbi 2g case. , 43-year-old kanimozhi , daughter dmk chief m. karunanidhi , said , “we fight legally nothing say co-conspirator face legally. ” , rajya sabha mp , also asked enforcement directorate appear connection 2g case prevention money laundering act , said believed legal system country abide it. , “whatever court decides , accept , ” said. , supplementary charge sheet filed special court april 25 , cbi accused ms. kanimozhi entering criminal conspiracy former telecom minister raja allegedly accepting illegal gratification kalaignar tv — channel run ruling dmk tamil nadu , money related 2g scam routed. , dismissing difference dmk first family issue , said , “my family divided issue. family stands party ’ decision. family stands together along whatever decisions leader party made. think another perception people press trying create . ”","{'bjp': 0, 'cong': 0}",0,0
